lyrics,tags,num_syllables,pos,year,fog_index,flesch_index,num_words,num_lines,sentiment,title,f_k_grade,artist,difficult_words,num_dupes
"Here she comes now sayin' Mony Mony
Shoot 'em down turn around come on Mony
Hey, she give me love and I feel all right now
Come on you gotta toss and turn
And feel all right, yeah I feel all right
I said yeah (yeah), yeah (yeah) yeah...

'Cause you make me feel
So good, so good, so good
So fine, so fine 
It's all mine, well I feel all right
I said yeah (yeah), yeah (yeah), yeah...

Well, you could shake it Mony Mony
Shot gun dead and I'll come on home yeah
Don't stop cookin' 'cause I feel all right now
Don't stop now come on Mony
Come on yeah, I said yeah (yeah), yeah (yeah), yeah...

'Cause you make me feel
So good, so good
Well I feel all right
You're so fine, you're so fine
You're, and I feel all right
I said yeah (yeah), yeah (yeah), yeah...

I love you Mony mo-mo-mony
I love you Mony mo-mo-mony sure I do
I love you Mony mo-mo-mony sure I do
I love you Mony mo-mo-mony sure I do
I love you Mony mo-mo-mony sure I do
I love you Mony mo-mo-mony sure I do
I love you Mony mo-mo-mony sure I do
I love you Mony mo-mo-mony
Yeah, yeah, yeah, yeah, yeah, yeah

Come on, come on
Come on, come on
Come on, come on
Come on, come on
Come on, come on
Feel all right, I said yeah, yeah, yeah, 
yeah, yeah, yeah

Wake it, shake it Mony Mony
Up, down, turn around, come on Mony
Hey she give me love and I feel all right now
Don't stop now come on Mony
Come on, I said yeah, yeah, yeah, 
yeah, yeah

'Cause you make me feel
So good, so good, so good
Feel all right, all right
Well I feel all right
I said yeah, yeah, yeah, yeah

Ride your pony, ride your pony
Ride your pony come on, come on
Mony Mony
Feel all right, I said yeah, yeah, yeah, yeah, yeah","['alternative dance', 'british', 'classic pop and rock', 'electronic', 'england', 'english', 'hard rock', 'new wave', 'pop rock', 'punk', 'rock', 'uk']",406.8,19,1987,4.4,99.23,339,51,"{'neg': 0.029, 'neu': 0.539, 'pos': 0.432, 'compound': 0.9993000000000001}",Mony Mony,0.9,Billy Idol,10,23
"I've never seen you looking so lovely as you did tonight
I've never seen you shine so bright
Mmm, mmm, mmm, mmm

I've never seen so many men ask you if you wanted to dance
They're looking for a little romance
Given half a chance

I have never seen that dress you're wearing
Or the highlights in your hair that catch your eyes
I have been blind

The lady in red
Is dancing with me
Cheek to cheek
There's nobody here

It's just you and me
It's where I wanna be
But I hardly know
This beauty by my side

I'll never forget
The way you look tonight

I've never seen you looking so gorgeous as you did tonight
I've never seen you shine so bright
You were amazing

I've never seen so many people want to be there by your side
And when you turned to me and smiled
It took my breath away

I have never had such a feeling
Such a feeling of complete and utter love
As I do tonight

The lady in red
Is dancing with me
Cheek to cheek
There's nobody here

It's just you and me
It's where I wanna be
But I hardly know
This beauty by my side

I'll never forget
The way you look tonight
I never will forget
The way you look tonight

The lady in red
The lady in red
The lady in red
My lady in red

I love you","['chris de burgh', 'classic pop and rock']",297.9,21,1987,4.0,100.24,243,45,"{'neg': 0.02, 'neu': 0.785, 'pos': 0.195, 'compound': 0.9934000000000001}",The Lady In Red,0.5,Chris De Burgh,19,27
"Remember when we held on in the rain
The nights we almost lost it once again
We can take the night into tomorrow
Living on feelings
Touching you, I feel it all again

Didn't we almost have it all
When love was all we had worth giving
The ride with you was worth the fall, my friend
Loving you makes life worth living

Didn't we almost have it all
The nights we held on till the morning
You know you'll never love that way again
Didn't we almost have it all

The way you used to touch me felt so fine
We kept our hearts together down the line
A moment in the soul can last forever
Comfort and keep us
Help me bring the feeling back again

Didn't we almost have it all
When love was all we had worth giving
The ride with you was worth the fall, my friend
Loving you makes life worth living

Didn't we almost have it all
The nights we held on till the morning
You know you'll never love that way again
Didn't we almost have it all

Didn't we have the best of times
When love was young and new
Couldn't we reach inside and find
That world of me and you

We'll never lose it again
'Cause once you know what love is
You'll never let it end

Didn't we almost have it all
When love was all we had worth giving
The ride with you was worth the fall, my friend
Loving you makes life worth living

Didn't we almost have it all
The nights we held on till the morning
You know you'll never love that way again
Didn't we almost have it all

Didn't we almost have it all","['adult contemporary', 'contemporary r&b', 'dance-pop', 'death by drowning', 'new jack swing', 'o happy day', 'pop', 'pop soul', 'r&b', 'soul and reggae']",342.9,22,1987,4.4,99.23,292,42,"{'neg': 0.009000000000000001, 'neu': 0.724, 'pos': 0.268, 'compound': 0.998}",Didn't We Almost Have It All,0.9,Whitney Houston,15,28
"I have climbed the highest mountains
I have run through the fields
Only to be with you
Only to be with you.

I have run, I have crawled
I have scaled these city walls
These city walls
Only to be with you.

But I still haven't found
What I'm looking for.
But I still haven't found
What I'm looking for.

I have kissed honey lips
Felt the healing in her finger tips
It burned like fire
This burning desire.

I have spoke with the tongue of angels
I have held the hand of a devil
It was warm in the night
I was cold as a stone.

But I still haven't found
What I'm looking for.
But I still haven't found
What I'm looking for.

I believe in the Kingdom Come
Then all the colours will bleed into one
Bleed into one.
But yes, I'm still running.

You broke the bonds
And you loosened the chains
Carried the cross of all my shame
All my shame, you know I believe it.

But I still haven't found
What I'm looking for.
But I still haven't found
What I'm looking for.

But I still haven't found
What I'm looking for.
But I still haven't found
What I'm looking for.",['the unforgettable fire'],248.4,23,1987,4.0,100.24,207,40,"{'neg': 0.077, 'neu': 0.86, 'pos': 0.063, 'compound': -0.5994}",I Still Haven't Found What I'm Looking For,0.5,U2,19,23
"There's things that you guess
And things that you know
There's boys that you can trust
And girls that you don't

There's little things you hide
And little things that you show
Sometimes you think you're gonna get it
But you don't and that's just the way it goes

I swear I won't tease you
Won't tell you no lies
I don't need no bible
Just look in my eyes

I've waited so long baby
Now that we're friends
Every man's got his patience
And here's where mine ends

I want your sex
I want you
I want your... sex

It's playing on my mind
It's dancing on my soul
It's taken so much time
So why don't you just let me go

I'd really like to try
Oh, I'd really love to know
When you tell me you're gonna regret it
Then I tell you that I love you but you still say NO!

I swear I won't tease you
Won't tell you no lies
I don't need no bible
Just look in my eyes

I've waited so long baby
Out in the cold
I can't take much more girl
I'm losing control

I want your sex
I want your love
I want your... sex

It's natural
It's chemical (let's do it)
It's logical
Habitual (can we do it?)

It's sensual
But most of all...
Sex is something that we should do
Sex is something for me and you

Sex is natural - sex is good
Not everybody does it
But everybody should
Sex is natural - sex is fun
Sex is best when it's... one on one
One on one

I'm not your father
I'm not your brother
Talk to your sister
I am a lover

C-c-c-c-come on

What's your definition of dirty baby
What do you consider pornography
Don't you know I love it till it hurts me baby
Don't you think it's time you had sex with me

What's your definition of dirty baby
What do you call pornography
Don't you know I love it till it hurts me baby
Don't you think it's time you had sex with me

Sex with me
Sex with me
Have sex with me

C-c-c-c-come on.","['adult contemporary', 'blue-eyed soul', 'british', 'classic pop and rock', 'dance pop', 'dance-pop', 'english', 'pop', 'pop rock', 'pop soul', 'rhythm and blues', 'rock', 'smooth jazz', 'smooth soul', 'sophisti-pop', 'uk']",422.1,24,1987,4.0,100.24,364,65,"{'neg': 0.074, 'neu': 0.733, 'pos': 0.193, 'compound': 0.9929}",I Want Your Sex,0.5,George Michael,24,28
"Love, like a road that never ends
How it leads me back again
To heartache
I'll never understand

Darling, I
Put my heart up on the shelf
Till the moment was right
And I told myself

Next time I fall in love
I'll know better what to do
Next time I fall in love
Ooh, ooh, ooh
The next time I fall in love
The next time I fall in love
It will be with you

Oh now
As I look into your eyes
Well, I wonder if it's wise
To hold you like I've wanted to before

Tonight
Ooh, I was thinking that you might
Be the one who breathes life
In this heart of mine

Next time I fall in love
I'll know better what to do
Next time I fall in love
Ooh, ooh, ooh
The next time I fall in love
The next time I fall in love
It will be with you

Next time I'm gonna follow through
And if it drives me crazy
I will know better why
The next time I try

Next time I fall in love
I'll know better what to do
Next time I fall in love
Ooh, ooh, ooh
The next time I fall in love
The next time I fall in love
It will be with you

Next time I fall in love
Oh, oh, oh
Next time I fall in love
Ooh, ooh, ooh
The next time I fall in love
The next time I fall in love
It will be with you",['rock and indie'],291.6,28,1987,4.0,108.7,256,44,"{'neg': 0.018000000000000002, 'neu': 0.676, 'pos': 0.306, 'compound': 0.9982000000000001}",The Next Time I Fall,-0.7000000000000001,Peter Cetera,13,29
"Watch out!

I see you on the street and you walk on by
You make me wanna hang my head down and cry
If you gave me half a chance you'd see
My desire burning inside of me
But you choose to look the other way

I've had to work much harder than this
For something I want, don't try to resist me

Open your heart to me, baby
I hold the lock and you hold the key
Open your heart to me, darlin'
I'll give you love if you, you turn the key

I think that you're afraid to look in my eyes
You look a little sad, boy, I wonder why
I follow you around but you can't see
Too wrapped up in yourself to notice
So you choose to look the other way
Well, I've got something to say

Don't try to run, I can keep up with you
Nothing can stop me from trying, you've got to

Open your heart to me, baby
I hold the lock and you hold the key
Open your heart to me, darlin'
I'll give you love if you, you turn the key

Open your heart with the key
One is such a lonely number

(Ah, ah, ah, ah)
Open your heart, I'll make you love me
It's not that hard, if you just turn the key

Don't try to run I can keep up with you
Nothing can stop me from trying, you've got to

Open your heart to me, baby
I hold the lock and you hold the key
Open your heart to me, darlin'
I'll give you love if you, you turn the key

Open your heart with the key
Open your heart, I'll make you love me (c'mon baby)
It's not that hard, if you just turn the key
Open your heart, I'll make you love me
It's not that hard, if you just turn the key
(Watch out, watch out, watch out)
(Fade...)","['american', 'américain', 'arabic', 'art pop', 'chanteur', 'dance', 'dance-pop', 'downtempo', 'electronic', 'electropop', 'greatest hits', 'multiple ipi', 'pop', 'pop and chart', 'singer', 'tell me', 'usa']",356.4,30,1987,5.2,105.66,327,40,"{'neg': 0.036000000000000004, 'neu': 0.837, 'pos': 0.127, 'compound': 0.9861000000000001}",Open Your Heart,0.5,Madonna,11,23
"Oh, I, I just died in your arms tonight
It must've been something you said
I just died in your arms tonight

I keep looking for something I can't get
Broken hearts lie all around me
And I don't see an easy way
To get out of this

Her diary sits by the bedside table
The curtains are closed, the cat's in her cradle
Who would've thought
That a boy like me could come to this?

Oh-oh-oh, whoa
Oh, I, I just died in your arms tonight
It must've been something you said
I just died in your arms tonight
Oh-oh-oh, whoa

Oh, I, I just died in your arms tonight
It must've been some kind of kiss
I should've walked away
I should've walked away

Is there any just cause for feeling like this?
On the surface, I'm a name on a list
I try to be discreet
But then blow it again

I've lost and found, it's my final mistake
She's loving by proxy, no give and all take
'Cause I've been thrilled to fantasy
One too many times

Oh-oh-oh, whoa
Oh, I, I just died in your arms tonight
It must've been something you said
I just died in your arms tonight

Oh, I, I just died in your arms tonight
It must've been some kind of kiss
I should've walked away
I should've walked away

It was a long hot night
She made it easy, she made it feel right
But now it's over, the moment is gone
I followed my hands, not my head
I know I was wrong

Oh, I, I just died in your arms tonight
It must've been something you said
I just died in your arms tonight

Oh, I, I just died in your arms tonight
It must've been some kind of kiss
I should've walked away
I should've walked away",['classic pop and rock'],372.6,32,1987,4.4,99.23,310,45,"{'neg': 0.164, 'neu': 0.766, 'pos': 0.07, 'compound': -0.9866}",(I Just) Died In Your Arms,0.9,Cutting Crew,26,31
"(Keep me hangin' on)

Set me free why don't cha, babe?
Get out of my life why don't cha, babe?
'Cause you don't really love me
You just keep me hangin' on

Set me free why don't cha, babe?
Get out of my life why don't cha, babe? (wooh)
'Cause you don't really need me
But you keep me hangin' on

Why do you keep a-comin' around?
Playing with my heart
Why don't cha get out of my life
And let me make a brand new start?
Let me get over you
The way you've gotten over me, yeah

Set me free why don't cha, babe?
Get out of my life why don't cha, babe? (wooh)
'Cause you don't really love me
You just keep me hangin' on
Now you don't really need me
You just keep me hangin' on

You say although we broke up
You still just wanna be friends
But how can we still be friends
When seeing you only breaks my heart again?
And there ain't nothing I can do about it

Whoa whoa whoa
Whoa whoa whoa whoa
Whoa whoa whoa whoa
Whoa whoa whoa, yeah

Get out, get out of my life
And let me sleep at night
'Cause you don't really love me
You just keep me hangin' on

You say you still care for me
But your heart and soul needs to be free
And now that you've got your freedom
You wanna still hold on to me
You don't want me for yourself
So let me find somebody else

Set me free why don't cha, babe?
Get out of my life why don't cha, babe? (wooh)
'Cause you don't really love me
You just keep me hangin' on

Why don't cha be a man about it
And set me free? (wooh)
Now you don't care a thing about me
You're just using me, hey, abusing me

Get out, get out of my life
And let me sleep at night (wooh)
'Cause you don't really love me
You just keep me hangin' on (wooh)","['british', 'dance and electronica', 'english', 'uk']",373.5,34,1987,4.4,107.69,342,52,"{'neg': 0.065, 'neu': 0.8210000000000001, 'pos': 0.114, 'compound': 0.9572}",You Keep Me Hangin' On,-0.30000000000000004,Kim Wilde,11,25
"I got a little change in my pocket going ching-a-ling-a-ling
Wanna call you on the telephone, baby, give you a ring
But each time we talk, I get the same old thing
Always, ""No huggee, no kissee until I get a wedding ring""
My honey, my baby, don't put my love upon no shelf
She said, ""Don't hand me no lines and keep your hands to yourself""

Ooh, baby, baby, baby, why you gonna treat me this way?
You know I'm still your loverboy, I still feel the same way
That's when she told me a story 'bout free milk and a cow
And said, ""No huggee, no kissee until I get a wedding vow""
My honey, my baby, don't put my love upon no shelf
She said, ""Don't hand me no lines and keep your hands to yourself""

You see, I wanted her real bad and I was about to give in
That's when she started talking about true love, started talking about sin
I said, ""Honey, I'll live with you for the rest of my life""
She said, ""No huggee, no kissee until you make me a wife""
My honey, my baby, don't put my love upon no shelf
She said, ""Don't hand me no lines and keep your hands to yourself""","['boogie rock', 'country rock', 'southern rock']",253.8,35,1987,6.4,94.15,214,18,"{'neg': 0.23, 'neu': 0.733, 'pos': 0.037, 'compound': -0.9906}",Keep Your Hands To Yourself,2.9,Georgia Satellites,15,5
"Like a warrior that fights
And wins the battle
I know the taste of victory

Though I went through some nights
Consumed by the shadows
And was crippled emotionally

Somehow I made it through the heartache, yes I did
I escaped (ahaha)
I found my way out of the darkness
I kept my faith (I know you did), kept my faith

When the river was deep I didn't falter
When the mountain was high I still believed
When the valley was low it didn't stop me, no no
I knew you were waiting
Knew you were waiting for me, uh huh

With and endless desire
I kept on searching
Sure in time our eyes would meet

And like the bridge is on fire
The hurt is over
One touch and you set me free

No, I don't regret a single moment, no I don't
(I know you don't) Looking back
When I think of all those disappointments
I just laugh (I know you do), I just laugh

When the river was deep I didn't falter
When the mountain was high I still believed
When the valley was low it didn't stop me (oh)
I knew you were waiting (hey)
Knew you were waiting for me

So we were drawn together through destiny
Ooh, boy (ooh)
I know this love we share was meant to be (oh)

Knew you were waiting (Ooh, yeah)
Knew you were waiting (I knew you were waiting)
Knew you were waiting for me

I didn't falter (I didn't falter, no)
I still believed (When the valley was low)
It didn't stop me (Nothing can stop me, no)
I knew you were waiting (No I)
Knew you were waiting for me

I didn't falter (When the mountain was high)
I still believed (Oh, when the valley was low)
It didn't stop me (No, it didn't stop me, no)
I knew you were waiting
Knew you were waiting for me

I didn't falter (Oh, oh yeah)
I still believed (I still believed)
It didn't stop me (You know it couldn't stop me now)
Knew you were waiting
Someday (Someday), somehow (somehow)
For me

I didn't falter (When the valley was low)
I still believed (I still believed)
He didn't stop me (No, he didn't stop me, no)
No way","['american', 'deep soul', 'gospel', 'jazz', 'pop', 'pop soul', 'rhythm & blues', 'rnb', 'rock', 'smooth soul', 'soul', 'soul and reggae', 'southern soul']",450.0,36,1987,4.800000000000001,98.21,381,54,"{'neg': 0.061, 'neu': 0.774, 'pos': 0.165, 'compound': 0.9881000000000001}",I Knew You Were Waiting,1.3,Aretha Franklin,34,19
"This is a story about control,
My control
Control of what I say, control of what I do
And this time I'm gonna do it my way

I hope you enjoy this as much as I do
Are we ready? I am.
'Cause it's all about control
And I've got lots of it

When I was seventeen, I did what people told me
Did what my father said, and let my mother mold me
But that was long ago

I'm in control, never gonna stop
Control - to get what I want
Control - I got to have a lot
Control - now I'm all grown up

First time I fell in love
I didn't know what hit me
So young and so naive
I thought it would be easy
But now I know I've got to take...

Control - I got to have a lot
Control - to get what I want
Control - never gonna stop
Control - now I'm all grown up

That's right, I'm on my own,
I'll call my own shots, thank you

Got my own mind
I wanna make my own decisions
When it has to do with my life, my life
I wanna be the one in control

So let me take you by the hand
And lead you on this dance (control)
'Cause what I've got is because I took a chance
I don't wanna rule the world
Just wanna run my life
So make your life a little easier
When you get the chance just take...

Control - I got to have a lot
Control - to get what I want
Control - never gonna stop
Control - now I'm all grown up

Free at last, out here on my own
Now control this
That's right, career moves
I do what's right for me
And me wants to groove
Is that okay?

Got my own mind
I wanna make my own decisions
When it has to do with my life
I wanna be the one in control

Hop to it
I'm in control (and I love it, that's right)
Control - now I've got a lot
Control - now I'm all grown up

I'm in control
I'm in control
I'm in control
Don't make me lose it","['dance', 'janet jackson escapade', 'janet-jackson', 'pop', 'pop and chart', 'the queen']",416.7,37,1987,4.4,107.69,363,58,"{'neg': 0.008, 'neu': 0.861, 'pos': 0.132, 'compound': 0.9898}",Control,-0.30000000000000004,Janet Jackson,17,25
"Somewhere out there
Beneath the pale moonlight
Someone's thinking of me
And loving me tonight

Somewhere out there
Someone's saying a prayer
That we'll find one another
In that big somewhere out there

And even though I know how very far apart we are
It helps to think we might be wishing
On the same bright star

And when the night wind starts to sing a lonesome lullaby
It helps to think we're sleeping
Underneath the same big sky

Somewhere out there
If love can see us through
Then we'll be together
Somewhere out there
Out where dreams come true

And even though I know how very far apart we are
It helps to think we might be wishing
On the same bright star

And when the night wind starts to sing a lonesome lullaby
It helps to think we're sleeping
Underneath the same big sky

Somewhere out there
If love can see us through
Then we'll be together
Somewhere out there
Out where dreams come true","['american', 'classic pop and rock', 'country', 'folk', 'max']",224.1,39,1987,4.0,91.78,167,30,"{'neg': 0.026000000000000002, 'neu': 0.75, 'pos': 0.224, 'compound': 0.9885}",Somewhere Out There,1.7000000000000002,Linda Ronstadt,13,20
"I met a fan dancer
Down in Southside Birmingham
She was running from a fat man
Selling salvation in his hand

Now he's trying to save me
When I'm doing all right
The best that I can

Just another fallen angel 
Trying to get through the night

Step by step, one by one
Higher and higher 
Step by step, rung by rung
Climbing Jacob's ladder

Coming over the airwaves
The man says I'm overdue
Sing along, send some money
Join the chosen few, hey

Mister, I'm not in a hurry
And I don't want to be like you
All I want from tomorrow
Is to get it better than today

Step by step, one by one
Higher and higher
Step by step, rung by rung
Climbing Jacob's ladder

All I want from tomorrow
Is to get it better than today

Step by step, one by one
Higher and higher
Step by step, rung by rung
Climbing and climbing

Step by step, one by one
Step by step, rung by rung
Step by step
And step by step
Step by step","['classic pop and rock', 'fixme', 'fixme recordings merge']",213.3,41,1987,4.0,100.24,180,36,"{'neg': 0.033, 'neu': 0.844, 'pos': 0.123, 'compound': 0.9597}",Jacob's Ladder,0.5,Huey Lewis and The News,22,19
"Who's that girl?
Who's that girl?

When you see her, say a prayer and kiss your heart goodbye
She's trouble, in a word, get closer to the fire
Run faster, her laughter burns you up inside
You're spinning 'round and 'round
You can't get off, you try but you can't

Quien es esa niña (Who's that girl?)
Señorita mas fina (Who's that girl?)
Quien es esa niña (Who's that girl?)
Señorita mas fina (Who's that girl?)

You try to avoid her, fate is in your hands
She's smiling, an invitation to the dance
Her heart is on the street, tu corazon es suyo
Now you're falling at her feet
You try to get away but you can't

Quien es esa niña (Who's that girl?)
Señorita mas fina (Who's that girl?)
Quien es esa niña (Who's that girl?)
Señorita mas fina (Who's that girl?)

Light up my life, so blind I can't see
Light up my life, no one can help me now

Run faster, her laughter burns you up inside
You're spinning 'round and 'round
You can't get off, you try but you can't

Quien es esa niña (Who's that girl?)
Señorita mas fina (Who's that girl?)
Quien es esa niña (Who's that girl?)
Señorita mas fina (Who's that girl?)

Light up my life, so blind I can't see
Light up my life, no one can help me now
Who's that girl?
Now, who's that girl?
Now, who's that girl?
Now, who's that girl?

Quien es esa niña (Who's that girl?)
Señorita mas fina (Who's that girl?)
Quien es esa niña (Who's that girl?)
Señorita mas fina (Who's that girl?)

Quien es esa niña (Who's that girl?)
Señorita mas fina (Who's that girl?)
Quien es esa niña (Who's that girl?)
Señorita mas fina (Who's that girl?)

Quien es esa niña (Who's that girl?)
Señorita mas fina (Who's that girl?)
Quien es esa niña","['american', 'américain', 'arabic', 'art pop', 'chanteur', 'dance', 'dance-pop', 'downtempo', 'electronic', 'electropop', 'greatest hits', 'multiple ipi', 'pop', 'pop and chart', 'singer', 'tell me', 'usa']",373.5,42,1987,4.4,99.23,313,46,"{'neg': 0.07200000000000001, 'neu': 0.871, 'pos': 0.057, 'compound': -0.5972000000000001}",Who's That Girl,0.9,Madonna,15,39
