lyrics,tags,num_syllables,pos,year,fog_index,flesch_index,num_words,num_lines,sentiment,title,f_k_grade,artist,difficult_words,num_dupes
"I just want to lay next to you for a while
You look so beautiful tonight
Your eyes are so lovely
Your mouth is so sweet
A lot of people misunderstand me
That's because they don't
Know me at all
I just want to touch you
And hold you
I need you
God I need you
I love you so much

Each time the wind blows
I hear your voice so
I call your name

Whispers at morning
Our love is dawning
Heaven's glad you came

You know how I feel
This thing can't go wrong
I'm so proud to say I love you

Your love's got me high
I long to get by
This time is forever
Love is the answer

I hear your voice now
You are my choice now
The love you bring

Heaven's in my heart
At your call I hear harps
And angels sing

You know how I feel
This thing can't go wrong
I can't live my life without you

I just can't hold on
I feel we belong
My life ain't worth living
If I can't be with you

I just can't stop loving you
I just can't stop loving you
And if I stop then tell me just what will I do
'Cause I just can't stop loving you

At night when the stars shine
I pray in you I'll find
A love so true

When morning awakes me
Will you come and take me
I'll wait for you

You know how I feel
I won't stop until
I hear your voice saying, ""I do""
""I do""

This thing can't go wrong
This feeling's so strong
Well, my life ain't worth living
If I can't be with you

I just can't stop loving you (woah)
I just can't stop loving you
And if I stop, then tell me just what will I do
I just can't stop loving you

We can change all the world tomorrow
We can sing songs of yesterday
I can say, hey, farewell to sorrow
This is my life and I want to see you for always

I just can't stop loving you (no, baby)
I just can't stop loving you (If I can't stop)
And if I stop. (no, what will I do? uh, ooh)
Then tell me just what will I do

I just can't stop loving you (hee, hee, heee, know I do girl)
I just can't stop loving you (you know I do)
And if I stop, then tell me, just what will I do
I just can't stop loving you","['american', 'américain', 'chanteur', 'classic pop and rock', 'composer', 'compositeur', 'contemporary r&b', 'contemporary rnb', 'cool', 'dance-pop', 'disco', 'funk', 'lyricist', 'michael-jackson', 'new jack swing', 'parolier', 'pop', 'pop rock', 'pop soul', 'r&b', 'rnb', 'rock', 'singer', 'soul', 'united states', 'usa']",453.6,45,1987,4.0,108.7,427,72,"{'neg': 0.093, 'neu': 0.6900000000000001, 'pos': 0.217, 'compound': 0.9939}",I Just Can't Stop Loving You,-0.7000000000000001,Michael Jackson,24,25
"Unfortunately, we are not licensed to display the full lyrics for this song at the moment. Hopefully we will be able to in the future. Until then... how about a random page?","['american', 'américain', 'arabic', 'art pop', 'chanteur', 'dance', 'dance-pop', 'downtempo', 'electronic', 'electropop', 'greatest hits', 'multiple ipi', 'pop', 'pop and chart', 'singer', 'tell me', 'usa']",46.8,46,1987,6.0,69.79,32,3,"{'neg': 0.07, 'neu': 0.85, 'pos': 0.079, 'compound': 0.0772}",Causing A Commotion,6.0,Madonna,9,0
"There's something I want to tell you
There's something I think that you should know
It's not that I shouldn't really love you
Let's take it slow

When we get to know each other
And we're both feeling much stronger
Then let's try to talk it over
Let's wait awhile longer

Let's wait awhile before it's too late
Let's wait awhile before we go too far

Remember that special night?
When all of the stars were shining bright
We made our first endeavor to stay together 
We made our very first promise
To love, to share and be real honest
But on that very first night
It wasn't quite right

Let's wait awhile before it's too late
Let's wait awhile, our love will be great
Let's wait awhile before we go too far

I didn't really know not to let all my feelings show
To save some for later so our love will be greater

You said you would always love me
Remember I said the same thing too
You don't have to be frightened with my love
Because I'll never give up on you

Let's wait awhile, before it's too late
You know, you can't rush love
Let's just take our time
Love's so good - sure I'll love will be there
Slow it down

I promise, I'll be worth the wait.","['dance', 'janet jackson escapade', 'janet-jackson', 'pop', 'pop and chart', 'the queen']",281.7,48,1987,4.4,90.77,222,32,"{'neg': 0.12, 'neu': 0.729, 'pos': 0.151, 'compound': 0.4763}",Let's Wait Awhile,2.1,Janet Jackson,19,9
"I used to be a renegade, I used to fool around
But I couldn't take the punishment and had to settle down
Now I'm playing it real straight, and yes, I cut my hair
You might think I'm crazy, but I don't even care
'Cause I can tell what's going on

It's hip to be square
It's hip to be square

I like my bands in business suits, I watch them on TV
I'm working out most every day and watching what I eat
They tell me that it's good for me, but I don't even care
I know that it's crazy, I know that it's nowhere
But there is no denying that

It's hip to be square
It's hip to be square
It's hip to be square
So hip to be square

It's not too hard to figure out, you see it every day
And those that were the farthest out have gone the other way
You see them on the freeway, it don't look like a lot of fun
But don't you try to fight it, an idea whose time has come
Don't tell me that I'm crazy
Don't tell me I'm nowhere
Take it from me

It's hip to be square
It's hip to be square
It's hip to be square
So hip to be square
Tell 'em, boys

Here, there and everywhere
Hip, hip, so hip to be a square
Here, there and everywhere
Hip, hip

Here, there and everywhere
Hip, hip, so hip to be a square
Here, there and everywhere
It's hip, hip

Here, there and everywhere
Hip, hip, so hip to be a square
Here, there and everywhere
Hip, hip

Here, there and everywhere
Hip, hip, so hip to be a square
Here, there and everywhere
Hip, hip","['classic pop and rock', 'fixme', 'fixme recordings merge']",363.6,49,1987,4.800000000000001,98.21,295,41,"{'neg': 0.089, 'neu': 0.833, 'pos': 0.078, 'compound': -0.6732}",Hip To Be Square,1.3,Huey Lewis and The News,12,28
"Take me as I am
Put your hand in mine now and forever
Darling here I stand, stand before you now
Deep inside I always knew 

It was you, you and me
Two hearts drawn together bound by destiny
It was you, and you for me
Every road leads to your door
Every step I take forever more 

Just say you'll love me for the rest of your life
I got a lotta love and I don't want to let go
Will you still love me for the rest of my life
'Cause I can't go on
No, I can't go on
I can't go on
If I'm on my own 

Take me as I am
Put your heart in mine, stay with me forever
'Cause I am just a man who never understood
I never had a thing to prove 

'Till there was you, you and me
Then it all came clear so suddenly
How close to you that I wanna be 

Just say you'll love me for the rest of your life
I got a lotta love and I don't want to let go
Will you still love me for the rest of my life
'Cause I can't go on
No, I can't go on
I can't go on
If I'm on my own

Do you believe a love could run so strong
Do you believe a love could pass you by
There was no special one for me
I was the lonely one, you see
But then my heart lost all control
Now you're all that I know 

Just say you'll love me for the rest of your life
I got a lotta love and I don't want to let go
Will you still love me for the rest of my life
'Cause I can't go on (Can't go on)
No, I can't go on
I can't go on
If I'm on my own 

I can't go on (I can't go on)
No, I can't go on

'Cause I can't go on (Will you still love me?)
No, I can't go on (Just say you love me)
I can't go on
Without somebody I can call my own

'Cause I can't go on (Will you still love me?)
No, I can't go on (Just say you love me)
Stay around

'Cause I can't go on (Will you still love me?)
No, I can't go on (Just say you love me)
I can't go on
If you could say your love

'Cause I can't go on (Will you still love me?)
No, I can't go on (Just say you love me)
Stay around, you'll never be alone","['american', 'aor', 'classic pop and rock', 'hard rock', 'jazz', 'jazz-rock', 'pop', 'pop rock', 'rock', 'soft rock']",480.6,50,1987,4.800000000000001,106.67,439,58,"{'neg': 0.022, 'neu': 0.733, 'pos': 0.245, 'compound': 0.9988}",Will You Still Love Me?,0.1,Chicago,14,33
"If I could turn the page
In time, then I'd rearrange
Just a day or two
Close my, close my, close my eyes
But I couldn't find a way
So I'll settle for one day
To believe in you
Tell me, tell me, tell me lies

Tell me lies, tell me sweet little lies
Oh, no, no, you can't disguise
Tell me lies, tell me sweet little lies

Although I'm not making plans
I hope that you understand there's a reason why
Close your, close your, close your eyes
No more broken hearts
We're better off apart
Let's give it a try
Tell me, tell me, tell me lies

Tell me lies, tell me sweet little lies
Oh, no, no, you can't disguise
Tell me lies, tell me sweet little lies

If I could turn the page
In time, then I'd rearrange
Just a day or two
Close my, close my, close my eyes
But I couldn't find a way
So I'll settle for one day
To believe in you
Tell me, tell me, tell me lies

Tell me lies, tell me sweet little lies
Oh, no, no, you can't disguise
Tell me lies, tell me sweet little lies
Oh, no, no, you can't disguise
Tell me lies, tell me sweet little lies","['american', 'band', 'blues', 'blues rock', 'british', 'british blues', 'classic pop and rock', 'fleetwood mac', 'jam band', 'pop', 'pop rock', 'pop/rock', 'rock', 'soft rock']",239.4,51,1987,4.4,107.69,213,34,"{'neg': 0.269, 'neu': 0.614, 'pos': 0.117, 'compound': -0.9875}",Little Lies,-0.30000000000000004,Fleetwood Mac,5,22
"My name is Luka
I live on the second floor
I live upstairs from you
Yes, I think you've seen me before

If you hear something late at night
Some kind of trouble, some kind of fight
Just don't ask me what it was
Just don't ask me what it was
Just don't ask me what it was

I think it's 'cause I'm clumsy
I try not to talk too loud
Maybe it's because I'm crazy
I try not to act too proud

They only hit until you cry
After that you don't ask why
You just don't argue anymore
Just don't argue anymore
Just don't argue anymore

Yes, I think I'm okay
I walked into the door again
If you ask, that's what I'll say
And it's not your business anyway

I guess I'd like to be alone
With nothing broken, nothing thrown
Just don't ask me how I am
Just don't ask me how I am
Just don't ask me how I am

My name is Luka
I live on the second floor
I live upstairs from you
Yes, I think you've seen me before

If you hear something late at night
Some kind of trouble, some kind of fight
Just don't ask me what it was
Just don't ask me what it was
Just don't ask me what it was

And they only hit until you cry
After that, you don't ask why
You just don't argue anymore
Just don't argue anymore
You just don't argue anymore","['art pop', 'classic pop and rock', 'downtempo', 'folk pop', 'pop', 'pop rock', 'singer/songwriter', 'stay awake']",296.1,52,1987,4.4,99.23,250,41,"{'neg': 0.084, 'neu': 0.802, 'pos': 0.114, 'compound': 0.6121}",Luka,0.9,Suzanne Vega,14,24
"Who needs friends who never show?
I'll tell you what you want to know
I could have saved a broken heart
If I'd found out long ago

I'm just thinking about
Those lonely nights
(I'm just thinking about when I waited)
When I waited for your call
'Til I found out
All my friends were right
('Til I found out, ooh, ooh)
I didn't know you at all

I heard a rumour
Ooh, ooh, I heard a rumour
They say you got a broken heart
I heard it,
I heard a rumour
Ooh, ooh, I heard a rumour
Yes I did, boy ooh, ooh, ooh

Now it seems they're telling me
You've changed your wicked ways
But should I give you a second chance
Baby, I'm too afraid

So you realise what hurt you made
(So you realise the love)
And the love you threw away
How can I forgive or soon forget
(How can I forgive, ooh, ooh)
It's never gonna be the same

I heard a rumour
Ooh, ooh, I heard a rumour
They say you got a broken heart
I heard it,
I heard a rumour
Ooh, ooh, I heard a rumour
Yes I did, boy ooh, ooh, ooh","['british', 'dance', 'dance-pop', 'electronic', 'electropop', 'english', 'hi-nrg', 'musical parody', 'new wave', 'pop', 'rock and indie', 'synthpop', 'synthpop uk', 'uk']",227.7,53,1987,4.0,108.7,202,36,"{'neg': 0.10300000000000001, 'neu': 0.765, 'pos': 0.131, 'compound': 0.5574}",I Heard A Rumour,-0.7000000000000001,Bananarama,16,13
"Welcome to the big time, you're bound to be a star
Even if you don't go all the way, I know that you'll go far
This race is for rats, it can turn you upside down
Ain't no one you can count on in this sleazy little town, oh no

Lots of promises in the dark
Don't you open your heart

'Cause it don't mean nothing
The words that they say
No, it don't mean nothing
These games that people play

No, it don't mean nothing
No victim, no crime
No, it don't mean nothing
Till you sign it on the dotted line
Whoa yeah

The director smiles as you walk in the door
He says, ""I love your work, babe, but you're just not what we're looking for.""
It's never what, but who it is you know
So easy to get stuck in all that California snow, oh

Take a good look around and you'll find
People trying to mess with your mind

But it don't mean nothing
The words that they say
No, it don't mean nothing
These games that people play

No, it don't mean nothing
No victim, no crime
No, it don't mean nothing
Till you sign it on the dotted line

Hollywood can be so lonely
Make you the winner of a losing fight
Party is never over
The stars are always shining, doesn't matter if it's day or night

The producer says, ""Let me change a line or two.""
And a little bit of something can look awfully good to you
And you wanna scream, but you gotta keep it all inside
When you're trying to make a living, there ain't no such thing as pride, oh no

Lots of promises in the dark
Don't you open your heart

'Cause it don't mean nothing
The words that they say
No, it don't mean nothing
These games that people play

No, it don't mean nothing
No victim, no crime
No, it don't mean nothing
Till you sign it on the dotted line

(Don't mean nothing) Don't mean nothing
(Don't mean nothing) Oh no, it don't mean nothing
(Don't mean nothing) Oh no, it don't mean nothing
(Don't mean nothing) Don't mean nothing at all

(Don't mean nothing)
(Don't mean nothing)
(Don't mean nothing)
(Don't mean nothing)","['adult contemporary', 'american', 'classic pop and rock', 'pop']",443.7,54,1987,4.800000000000001,98.21,381,54,"{'neg': 0.137, 'neu': 0.714, 'pos': 0.149, 'compound': 0.16290000000000002}",Don't Mean Nothing,1.3,Richard Marx,26,36
"Como puede ser verdad

Last night I dreamt of San Pedro
Just like I'd never gone, I knew the song
A young girl with eyes like the desert
It all seems like yesterday, not far away

Tropical the island breeze
All of nature wild and free
This is where I long to be
La isla bonita

And when the samba played
The sun would set so high
Ring through my ears and sting my eyes
Your Spanish lullaby

I fell in love with San Pedro
Warm wind carried on the sea, he called to me
Te dijo te amo
I prayed that the days would last
They went so fast

Tropical the island breeze
All of nature wild and free
This is where I long to be
La isla bonita

I want to be where the sun warms the sky
When it's time for siesta you can watch them go by
Beautiful faces, no cares in this world
Where a girl loves a boy, and a boy loves a girl

Last night I dreamt of San Pedro
It all seems like yesterday, not far away

Tropical the island breeze
All of nature wild and free
This is where I long to be
La isla bonita

Tropical the island breeze
All of nature wild and free
This is where I long to be
La isla bonita

Tropical the island breeze
All of nature wild and free
This is where I long to be
La isla bonita

La la la la la la la
Te dijo te amo
La la la la la la la
El dijo que te ama

Pa-pa-la-pa-pa pa-pa-pa-pahaaa
Aha, aha-ahaaa
La isla bonita
Ahaa, aha-ahaaa...","['american', 'américain', 'arabic', 'art pop', 'chanteur', 'dance', 'dance-pop', 'downtempo', 'electronic', 'electropop', 'greatest hits', 'multiple ipi', 'pop', 'pop and chart', 'singer', 'tell me', 'usa']",347.4,58,1987,4.4,90.77,277,45,"{'neg': 0.007, 'neu': 0.8150000000000001, 'pos': 0.178, 'compound': 0.9934000000000001}",La Isla Bonita,2.1,Madonna,29,32
"Na!
Your butt is mine, gonna tell you right (Na!)
Just show your face in broad daylight (Na!)
I'm telling you on how I feel (Na!)
Gonna hurt your mind, don't shoot to kill 
Sh'mon, na, sh'mon
Lay it on me, na, all right

Na!
I'm giving you on count of three (Na!)
To show your stuff or let it be (Na!)
I'm telling you just watch your mouth (Na!)
I know your game, what you're about
Na

Well, they say the sky's the limit
And to me that's really true (Na!)
But, my friend, you have seen nothing
Just a-wait till I get through

Because I'm bad, I'm bad, sh'mon, na!
(Bad, bad - really, really bad)
You know I'm bad, I'm bad - you know it, na!
(Bad, bad - really, really bad)
You know I'm bad, I'm bad - come on, you know
(Bad, bad - really, really bad)
And the whole world has to answer right now
Just to tell you once again
Who's bad?

Na, na!
The word is out, na, you're doin' wrong (Na!)
Gonna lock you up before too long (Na!)
Your lyin' eyes gonna tell you right (Na!)
So listen up, ah, don't make a fight (Na!)
Your talk is cheap; you're not a man (Na!)
You're throwin' stones to hide your hands, uh

Well, they say the sky's the limit
And to me that's really true (Na!)
But my friend you have seen nothing
Just a-wait till I get through

Because I'm bad, I'm bad - sh'mon, na!
(Bad, bad - really, really bad)
You know I'm bad, I'm bad - you know it, na!
(Bad, bad - really, really bad)
You know I'm bad, I'm bad - you know it
You know
(Bad, bad - really, really bad)
And the whole world has to answer right now
Just to tell you once again
Who's bad?

Na!
We can change the world tomorrow
This could be a better place (Na!)
If you don't like what I'm sayin'
Then a-won't you slap my face?

Because I'm bad, I'm bad - sh'mon, na!
(Bad, bad - really, really bad)
You know I'm bad, I'm bad - you know it, ah!
(Bad, bad - really, really bad)
You know I'm bad, I'm bad - you know it
You know
(Bad, bad - really, really bad)

(And the whole world has to answer right now)
Woo! Woo! Woo!
(Just to tell you once again)
You know I'm bad, I'm bad - sh'mon, ah!
(Bad, bad - really, really bad)
You know I'm bad, I'm bad - you know it
You know it
(Bad, bad - really, really bad)
You know, you know, you know, come on
(Bad, bad - really, really bad)
And the whole world has to answer right now
Just to tell you once again

You know I'm smooth, I'm bad
You know it
(Bad, bad - really, really bad)
You know I'm bad,
I'm bad, baby
(Bad, bad - really, really bad)
You know, you know, you know it, come on
(Bad, bad - really, really bad)
And the whole world has to answer right now
Woo!
(Just to tell you once again)

You know I'm bad, I'm bad - you know it
(Bad, bad - really, really bad)
You know I'm bad - you know - hoo, na!
(Bad, bad - really, really bad)
You know I'm bad - I'm bad
You know it, you know
(Bad, bad - really, really bad)
And the whole world has to answer right now
Just to tell you once again
Who's bad?","['american', 'américain', 'chanteur', 'classic pop and rock', 'composer', 'compositeur', 'contemporary r&b', 'contemporary rnb', 'cool', 'dance-pop', 'disco', 'funk', 'lyricist', 'michael-jackson', 'new jack swing', 'parolier', 'pop', 'pop rock', 'pop soul', 'r&b', 'rnb', 'rock', 'singer', 'soul', 'united states', 'usa']",609.3,59,1987,4.800000000000001,106.67,566,80,"{'neg': 0.256, 'neu': 0.6930000000000001, 'pos': 0.051000000000000004, 'compound': -0.9993000000000001}",Bad,0.1,Michael Jackson,17,49
"Here I am
Just like I said I would be
I'm your friend
Just like you think it should be
Did you think I would stand here and lie
While our moment was passing us by
Oh, while I am here

Waiting for your change of heart
It just takes a beat
To turn it around
Yes, I'm waiting for your change of heart
At the edge of my seat
Please turn it around

Days go by
Leaving me with a hunger
I could fly
Back to when we were younger
When adventures like cars we would ride
And the years lied ahead still untried
While I stand here

Waiting for your change of heart
It just takes a beat
To turn it around
Yes, I'm waiting for your change of heart
At the edge of my seat
Please turn it around
Turn it around, around, around
Turn it around, around, around
Turn it around

Blind leading blind
Never feel the laughter
Search through time
Nothing reveals the answer
If it's truth that you're looking to find
It is nowhere outside of your mind
While I bide my time

Waiting for your change of heart
It just takes a beat
To turn it around
Yes, I'm waiting for your change of heart
At the edge of my seat
Please turn it around

Yes, I'm waiting for your change of heart
It just takes a beat
To turn it around
Yes, I'm waiting for your change of heart
At the edge of my seat
Please turn it around
Turn it around, around, around
Turn it around, around, around
Turn it around

And I'm waiting for your change of heart
Waiting for your change of heart","['blues', 'classic pop and rock', 'dance-pop', 'new wave', 'pop', 'pop rock', 'synthpop']",338.4,61,1987,4.0,100.24,284,53,"{'neg': 0.033, 'neu': 0.8300000000000001, 'pos': 0.137, 'compound': 0.9805}",Change Of Heart,0.5,Cyndi Lauper,19,29
"I see your face cloud over like a little girl's
And your eyes have lost their shine
You whisper something softly
I'm not meant to hear
Baby tell me what's on your mind
I don't' care what people say
About the two of us from different worlds
I love you so much that it hurts inside
Are you listening
Please listen to me girl

Can't we try just a little bit harder
Can't we give just a little bit more
Can't we try to understand
That it's love we're fighting for
Can't we try just a little more passion
Can't we try just a little less pride
I love you so much baby
That it tears me up inside

I hear you on the telephone
With god knows who
Spilling out your heart for free
Everyone needs someone they can talk to
Girls that someone should be me

So many times I've tried to tell you
You just turn away
My life is changing so fast now
Leaves me lonely and afraid
Don't be afraid, no

Can't we try just a little bit harder
Can't we give just a little bit more
Can't we try to understand
That it's love we're fighting for
Can't we try just a little more passion
Can't we try just a little less pride

I love you so much baby
That it tears me up inside
Don't let our love fade away
No matter what people say
I need you more and more each day

Can't we try just a little bit harder
Can't we give just a little bit more
Can't we try just a little bit harder
Can't we give just a little bit more
Can't we try just a little more passion
Can't we try just a little less pride
Love you so much baby
Tears me up inside","['adult contemporary', 'canadian', 'folk']",374.4,63,1987,4.4,99.23,307,47,"{'neg': 0.07, 'neu': 0.761, 'pos': 0.168, 'compound': 0.9871000000000001}",Can't We Try,0.9,Dan Hill,19,19
"Have I told you
Lately that I love you
If I din't, darlin',
You see, I'm so sorry
Didn't I reach out
And hold you
In these lovin' arms
Well, if I didn't, oh baby.
Well, I'm so sorry

When I realized that you need love too,
Gonna spend my life makin' love to you.
Got to be a lover.
Have mercy.
Forgot to be a lover, babe. (Have mercy)
Forgot to be a lover. (Have mercy)
Forgot to be a lover.
Make it on through to you somehow. (Have mercy, baby)
Got to be a lover, babe. (Forgot to be a lover)
Woo! Woo!

Well, did I ask you,
Yes, would you come and share,
Oh, share,
Oh, the burden and the task
That's at love's command
Didn't I say
All those lovin' special things
That you long to hear
To show how much I care

Well, when I realize
That you need love too,
Gonna spend my life
Makin' love to you
Forgot to be a lover,
Have mercy

Well, well I worked all day
Hard as I can
Worked all night, didn't make me a man.
(Forgot to be a lover)
Have mercy, Oo,

When I realized
That you need love too,
Gonna spend my life
Makin' love to you. (Forgot to be a lover)
Got to be a lover, babe.
Oo, mercy. (Have mercy)
Have mercy, baby. (Have mercy, baby)

I'm gonna make it on through
To you somehow,
So have mercy. (Have mercy, have mercy, baby)

Have I told you,
Yes, lately that I love you
If I didn't, oh baby,
Yes, I'm so sorry.
Ah, but you know I really love you, baby.(Love you baby)
I really love you baby (Love you baby)
I really need you baby (Need you baby)
I really want you baby (Want you baby)

When I realized,
That you need love too,
I'm gonna spend my life
Makin' love,
Makin' love,
Makin' love to you
Well, I worked all day
As hard as I can,
Worked all night,
It didn't make me a man, babe.
(Forgot to be a lover) (Have mercy)
Oo, have mercy baby (Have mercy)
Have mercy baby (Have mercy)
Oo, have mercy baby (Have mercy baby)
Oo, make it through.

Well, when I realized that you need love too,
I'm gonna spend my life,
Gotta spend my life makin' love to you.","['alternative dance', 'british', 'classic pop and rock', 'electronic', 'england', 'english', 'hard rock', 'new wave', 'pop rock', 'punk', 'rock', 'uk']",508.5,64,1987,4.0,91.78,397,74,"{'neg': 0.02, 'neu': 0.7030000000000001, 'pos': 0.277, 'compound': 0.9986}",To Be A Lover,1.7000000000000002,Billy Idol,42,13
