lyrics,tags,num_syllables,pos,year,fog_index,flesch_index,num_words,num_lines,sentiment,title,f_k_grade,artist,difficult_words,num_dupes
"Daniel is traveling tonight on a plane
I can see the red tail lights heading for Spain
Oh and I can see Daniel waving goodbye
God, it looks like Daniel, must be the clouds in my eyes

Oh, Daniel my brother
You are older than me
Do you still feel the pain 
Of the scars that won't heal
Your eyes have died 
But you see more than I
Daniel you're a star
In the face of the sky

They say Spain is pretty, though I've never been
Well, Daniel says it's the best place that he's ever seen
Oh, and he should know, he's been there enough
Lord, I miss Daniel, oh I miss him so much

Oh, Daniel my brother
You are older than me
Do you still feel the pain 
Of the scars that won't heal
Your eyes have died 
But you see more than I
Daniel you're a star
In the face of the sky

Daniel is traveling tonight on a plane
I can see the red tail lights heading for Spain
Oh and I can see Daniel waving goodbye
God, it looks like Daniel, must be the clouds in my eyes

Oh, Daniel my brother
You are older than me
Do you still feel the pain 
Of the scars that won't heal
Your eyes have died 
But you see more than I
Daniel you're a star
In the face of the sky

Daniel my brother
You are older than me
Do you still feel the pain 
Of the scars that won't heal
Your eyes have died 
But you see more than I
Daniel you're a star
In the face of the sky

Daniel is traveling tonight on a plane
I can see the red tail lights heading for Spain
Oh and I can see Daniel waving goodbye
God, it looks like Daniel, must be the clouds in my eyes
Oh, God, it looks like Daniel, must be the clouds in my eyes
Oh, God, it looks like Daniel, must be the clouds in my eyes","['adult contemporary', 'british', 'classic pop and rock', 'elton-john', 'english', 'glam rock', 'piano rock', 'pop', 'pop rock', 'pop/rock', 'rock', 'singer/songwriter', 'uk']",378.9,48,1973,4.4,107.69,339,50,"{'neg': 0.09, 'neu': 0.8270000000000001, 'pos': 0.084, 'compound': -0.6386000000000001}",Daniel,-0.30000000000000004,Elton John,9,38
"L.A. proved too much for the man
(Too much for the man, he couldn't make it)
So he's leaving a life
He's come to know, ooh

(He said he's going)
He said he's going back to find
(Going back to find)
Ooh, what's left of his world
The world he left behind not so long ago

He's leaving (leaving)
On that midnight train to Georgia, yeah
(Leaving on the midnight train) yeah
Said he's going back (going back to find)
To a simpler place and time, oh yes he is
(Whenever he takes that ride, guess who's gonna be right by his side)

I'll be with him (I know you will)
On that midnight train to Georgia
(Leaving on a midnight train to Georgia, woo woo)
I'd rather live in his world (live in his world)
Than live without him in mine
(Her world is his, his and hers alone)

He kept dreaming (dreaming)
Ooh, that some day he'd be a star
(A superstar, but he didn't get far)
But he sure found out the hard way
That dreams don't always come true, oh no, uh uh
(Dreams don't always come true, uh uh, no, uh uh)

So he pawned all his hopes
(Woo, woo, woo-woo)
And even sold his old car
(Woo, woo, woo-woo)
Bought a one way ticket back to the life he once knew
Oh yes he did, he said he would

Oh-oh, he's leaving (leaving)
On that midnight train to Georgia, yeah
(Leaving on a midnight train)
Said he's going back to find, ooh
(Going back to find)
A simpler place and time, ooh, yeah
(Whenever he takes that ride, guess who's gonna be right by his side)

Yeah, I'm gonna be with him (I know you will)
On that midnight train to Georgia
(Leaving on a midnight train to Georgia, woo woo)
I'd rather live in his world (live in his world)
Than live without him in mine
(Her world is his, his and hers alone)

Ooh, he's leaving (leaving)
On the midnight train to Georgia
(Leaving on the midnight train), yeah, ooh y'all
Said he's going back to find (Going back to find)
Ooh, a simpler place and time, ooh y'all, uh-huh
(Whenever he takes that ride, guess who's gonna be right by his side)

I've got to be with him (I know you will)
On that midnight train to Georgia
(Leaving on a midnight train to Georgia, woo woo)
I'd rather live in his world (live in his world)
Than live without him in mine
(Her world is his, his and hers alone)

For love, gonna board the midnight train to ride
For love, gonna board, gotta board the midnight train to go
For love, gonna board, uh huh, the midnight train to go
My world, his world, our world, mine and his alone
My world, his world, our world, mine and his alone
I got to go
I got to go
I got to go, hey
I got to go
I got to go
My world, his world, my man, his girl
I got to go
I got to go, oh
I got to go
My world, his world, our world, his girl",['classic pop and rock'],595.8,49,1973,4.800000000000001,106.67,531,73,"{'neg': 0.032, 'neu': 0.853, 'pos': 0.116, 'compound': 0.9942000000000001}",Midnight Train To Georgia,0.1,Gladys Knight and The Pips,21,30
"We all came out to Montreux
On the Lake Geneva shoreline
To make records with a mobile
We didn't have much time

A-Frank Zappa and the Mothers
Were at the best place around
But some stupid with a flare gun
Burned the place to the ground

Smoke on the water
A fire in the sky
Smoke on the water

They burned down the gambling house
It died with an awful sound
A-Funky Claude was running in and out
Pulling kids out the ground

When it all was over
We had to find another place
But Swiss time was running out
It seemed that we would lose the race

Smoke on the water
A fire in the sky
Smoke on the water

We ended up at the Grand Hotel
It was empty, cold and bare
But with the Rolling truck Stones thing just outside, heh
Making our music there

With a few red lights, heh, a few old beds, heh
We made a place to sweat
No matter what we get out of this, heh
I know, I know we'll never forget

Smoke on the water
A fire in the sky
Smoke on the water","['60s', '70s', '80s', 'anthology', 'aor', 'blues rock', 'british', 'classic pop and rock', 'classic rock', 'collection', 'deep purple', 'deep purple family', 'deep purple live in berlin 1973 dvd video', 'english', 'hard rock', 'heavy metal', 'metal', 'progressive rock', 'rock', 'symphonic rock', 'uk', 'want to listen']",241.2,50,1973,4.0,100.24,194,33,"{'neg': 0.157, 'neu': 0.796, 'pos': 0.048, 'compound': -0.9567}",Smoke On The Water,0.5,Deep Purple,26,14
"Your mama don't dance and
Your daddy don't rock and roll
Your mama don't dance and
Your daddy don't rock and roll
When evening rolls around
And it's time to go to town
Where do you go to rock and roll

The old folks say that you
Gotta end your date by ten
If you're out on a date
And you bring it home late, it's a sin

There just ain't no excuse
And you know you're gonna lose
You never win, I'll say it again

And it's all because
Your mama don't dance and
Your daddy don't rock and roll
Your mama don't dance and
Your daddy don't rock and roll
When evening rolls around
And it's time to go to town
Where do you go to rock and roll

You pull into a drive-in
You find a place to park
You hop into the backseat
Where you know it's nice and dark
You're just about to move
You're thinking it's a breeze

There's a light in your eye
And then a guy says
Out of the car, long hair
Oowee, you're coming with me
The local police

And it's all because
Your mama don't dance and
Your daddy don't rock and roll
Your mama don't dance and
Your daddy don't rock and roll
When evening rolls around
And it's time to go to town
Where do you go to rock and roll

Where do you go to rock and roll
Where do you go to rock and roll","['american', 'rock-pop']",290.7,53,1973,4.0,100.24,250,43,"{'neg': 0.042, 'neu': 0.9390000000000001, 'pos': 0.019, 'compound': -0.7101000000000001}",Your Mama Don't Dance,0.5,Loggins and Messina,12,25
"I do believe in you
And I know you believe in me
Oh, yeah
Oh, yeah
But now we've realized
Love's not all that it's s'posed to be
Oh, yeah
Oh, yeah

And knowing that you would have wanted it this way
I do believe I'm feelin' stronger every day

I know we really tried
Together we had love inside
Oh, yeah
Oh, yeah
So now the time has come
For both of us to live on the run
Oh, yeah
Oh, yeah

And knowing that you would have wanted it this way
I do believe I'm feelin' stronger every day
Yeah, yeah, yeah, huh
Yeah, yeah, yeah
Huh

After what you meant to me
Ooh, baby, now I can make it easily
Yeah, yeah, yeah
I know that we both agree
Best thing to happen to you, the best thing that happened to me
Yeah, yeah, yeah

We love you
We love you
Let's spend the night together
We love you
Jumpin' Jack Flash it's a gas, gas, gas

Feelin' stronger every day
Feelin' stronger every day
Feelin' stronger every day
(You know I'm all right now)
Feelin' stronger every day
(You know I'm all right now)
Feelin' stronger every day
(You know I'm all right now)
Feelin' stronger every day
(You know I'm all right now)
Feelin' stronger every day
(You know I'm all right now)
Feelin' stronger every day
(You know I'm all right now)
Feelin' stronger every day
(You know I'm all right now)
Feelin' stronger every day
(You know I'm all right now)
Feelin' stronger every day
(You know I'm all right now)","['american', 'aor', 'classic pop and rock', 'hard rock', 'jazz', 'jazz-rock', 'pop', 'pop rock', 'rock', 'soft rock']",326.7,54,1973,4.0,100.24,268,45,"{'neg': 0.0, 'neu': 0.67, 'pos': 0.33, 'compound': 0.9983000000000001}",Feelin' Stronger Every Day,0.5,Chicago,16,36
"When you were young
And your heart was an open book
You used to say live and let live
(You know you did, you know you did, you know you did)
But if this ever-changin' world
In which we're livin'
Makes you give in and cry
Say live and let die

(Live and let die)
Live and let die
(Live and let die)

What does it matter to ya?
When you got a job to do
You got to do it well
You got to give the other fella hell

You used to say live and let live
(You know you did, you know you did, you know you did)
But if this ever-changin' world
In which we're livin'
Makes you give in and cry
Say live and let die

(Live and let die)
Live and let die
(Live and let die)","['malaysia', 'rock']",157.5,56,1973,4.0,108.7,142,24,"{'neg': 0.163, 'neu': 0.8170000000000001, 'pos': 0.02, 'compound': -0.9781000000000001}",Live And Let Die,-0.7000000000000001,Wings,4,13
"
I feel sorry, I feel sorry
I feel sorry, I feel sorry

I feel for sorry for any man out there
When he can't look around
And say, this is my woman
My woman alone

I feel sorry, yeah
For any woman out there
Who can't say I got somebody
That I can call my very own

I feel sorry, I feel sorry
I feel sorry, I feel sorry

One thing I can say about the people of the world today
They see you with a good thing
They want to take it away

But I believe in you, you believe in me too, yeah
Even your best friend will come around making sly remarks
Trying to put you down
I believe in you, you believe in me too

Listen honey, people talking, trying to pull us apart
Sticking pins and needles in both of our hearts
I love you no matter
Don't care about the stormy weather

I heard your mother say
Loving me didn't make no sense
But when she put me down
You stood up in my defense

I believe in you
Anytime you against your own mother
It makes me know
You believe in me, yeah

Here's another thing
We had our hard times
And almost didn't make it
We always worked it
Never tried to fake it

But I believe in you
You believe in me too

Here's anything about it
People talking, trying to pull us apart
Always ticking pins and needles in both of our hearts
Our love together
Don't care about the stormy weather

I believe in you
You believe in me too, yeah

I believe, that's why every time we get a chance
I tell you, honey, how much I love you
Love you, love you
Love you, love you

And most of all, how much I trust you
The reason why I trust you, baby
Is because of one thing
I can lean on you, yeah, baby
And you can lean on me too
One more time I'm gonna say

I believe in you
Honey, please let me believe in you
I know a lot of folk out there
Wish they had somebody they could believe in

I believe, I believe in you
You believe in me too
Anytime you against your own mother
It makes me know

You believe in me
I believe in you
And you've shown me enough to know
You believe in me too",['death by heart attack'],512.1,58,1973,4.4,90.77,408,67,"{'neg': 0.067, 'neu': 0.767, 'pos': 0.166, 'compound': 0.9942000000000001}",I Believe In You,2.1,Johnnie Taylor,35,29
"Sing, sing a song
Sing out loud, sing out strong
Sing of good things not bad
Sing of happy not sad

Sing, sing a song
Make it simple to last your whole life long
Don't worry that it's not good enough
For anyone else to hear
Just sing, sing a song

Sing, sing a song
Let the world sing along
Sing of love there could be
Sing for you and for me

Sing, sing a song
Make it simple to last your whole life long
Don't worry that it's not good enough
For anyone else to hear
Just sing, sing a song
Just sing, sing a song
Just sing, sing a song","['adult contemporary', 'baroque pop', 'classic pop and rock', 'country pop', 'easy listening', 'pop']",120.6,59,1973,4.0,108.7,112,20,"{'neg': 0.0, 'neu': 0.757, 'pos': 0.243, 'compound': 0.982}",Sing,-0.7000000000000001,Carpenters,2,11
"(Ain't no woman like the one I've got.)
(Ain't no woman like the one I've got.)
(Ain't no woman like the one I've got.)

Every day the sun comes up around her.
She can make the birds sing harmony.
Every drop of rain is glad it found her.
Heaven must have made her just for me.
When she smiles so warm and tender,
A sight for sore eyes to see.

Oooh, (ain't no woman like the one I've got.)
Oh, no, they don't come better.
(To make her happy doesn't take a lot.)
She don't ask for things, no diamond rings.
(So together, like a hand in glove.)
Like pages in a letter.
(Ain't no woman like the one I love.)

She can fill me up when it's down I'm goin' (I'm goin').
Put a little music in my day.
Wouldn't be surprised if my love keeps growin' (it keeps growin').
Bigger every minute that she stays away.
I would kiss the ground she walks on,
'Cause it's my word, my word she'll obey, now.
Woo-ooh. (Ain't no woman like the one I've got.)
Well, I kiss the ground she walks on.
(To make her happy doesn't take a lot.)
She's a real good friend right to the end.
(So together like a hand in glove.)
A lonely man when she's gone.
(People, ain't no woman like the one I love.)

Oooh. What a good, good thing I've got.
She means to me a lot.

(Ain't no woman like the I've got.)
No, no, they don't come better.
(To make her happy doesn't take a lot.)
She don't ask for things, no diamond rings.
(So together, like a hand in glove.)
Like pages in a letter.
(Ain't no woman like the one I love, people.)

(Ain't no woman like the one I've got.)
Well, I kiss the ground she walks on.
(To make her happy doesn't take a lot.)
I'm a lonely man when my baby's gone.","['classic pop and rock', 'funk', 'pop soul', 'rhythm & blues', 'smooth soul', 'soul', 'vocal group']",396.9,60,1973,4.800000000000001,98.21,327,42,"{'neg': 0.10400000000000001, 'neu': 0.627, 'pos': 0.269, 'compound': 0.9961000000000001}",Ain't No Woman,1.3,Four Tops,19,15
"People keep on learnin'
Soldiers keep on warrin'
World keep on turnin'
'Cause it won't be too long

Powers keep on lyin'
While your people keep on dyin'
World keep on turnin'
'Cause it won't be too long

I'm so darn glad he let me try it again
'Cause my last time on earth I lived a whole world of sin
I'm so glad that I know more than I knew then
Gonna keep on tryin'
'Til I reach the highest ground

Teachers keep on teachin'
Preachers keep on preachin'
World keep on turnin'
'Cause it won't be too long
Oh no

Lovers keep on lovin'
Believers keep on believin'
Sleepers just stop sleepin'
Cause it won't be too long
Oh no

I'm so glad that he let me try it again
'Cause my last time on earth I lived a whole world of sin
I'm so glad that I know more than I knew then
Gonna keep on tryin'
'Til I reach my highest ground

'Til I reach my highest ground
Oh no
No one's gonna bring me down
Oh no
'Til I reach my highest ground
Don't you let nobody bring you down
God is gonna show you higher ground
He's the only friend you have around","['contemporary r&b', 'funk', 'pop', 'pop soul', 'rhythm & blues', 'rock and indie', 'soul']",235.8,62,1973,4.4,107.69,209,32,"{'neg': 0.091, 'neu': 0.792, 'pos': 0.117, 'compound': 0.5877}",Higher Ground,-0.30000000000000004,Stevie Wonder,24,17
"I can't believe that it's real
The way that you make me feel
A burning deep down inside
A love that I cannot hide

Our love is you and me, baby
That make the world go round
And if keeping you and loving you means 
Layin' all my troubles down

Here I am, baby, come and take me
Here I am, baby, come and take me
Take me by the hand
Show me
Here I am, baby

It always ends up this way
Me begging you every day
A love that I cannot have
You broke my heart into half

Our love is you and me, baby
That make the world go round
Keeping you and loving you means 
Laying all my troubles down

Here I am, baby, come and take me
Here I am, baby, come and take me
Take me by the hand
Show me
Here I am, baby

When I'm down I can always call you
For a helpin' hand
I know you'll do the best you can
But it don't take much for me
Before my cup runs over
All this love inside of me
I believe there's going to be an explosion

You can talk to me (oh, baby)
I'm in no hurry 
Tell me all your troubles
And you won't ever have to worry (no)
(And one more thing)
You just can't trust everybody
Everybody you see (no no)
You'll find yourself lost and alone
On a darkened street

Here I am, baby, come and take me
Here I am, baby, would you come and take me?
Take me by the hand
Show me
Take me
Show me, won't you?
Here I am, baby
Take me, won't you?
Teach me
Won't you take me by the hand?
Teach me
Here I am, baby","['gospel', 'smooth soul', 'soul', 'soul and reggae', 'southern soul']",361.8,63,1973,4.4,99.23,299,48,"{'neg': 0.064, 'neu': 0.781, 'pos': 0.154, 'compound': 0.9867}",Here I Am,0.9,Al Green,21,21
"Darkest of night
With the moon shining bright
There's a set goin' strong
Lotta things goin' on

The man of the hour
Has an air of great power
The dudes have envied him for so long

Oh, Superfly
You're gonna make your fortune by and by
But if you lose, don't ask no questions why
The only game you know is Do or Die
Ah-ha-ha

Hard to understand
What a hell of a man
This cat of the slum
Had a mind, wasn't dumb

But a weakness was shown
'Cause his hustle was wrong
His mind was his own
But the man lived alone

Ooh, Superfly
You're gonna make your fortune by and by
But if you lose, don't ask no questions why
The only game you know is Do or Die
Ah-ha-ha

The game he plays he plays for keeps
Hustlin' times and ghetto streets
Tryin' to get over
That's what he tryin' to do, y'all

Taking all that he can take
Gambling with the odds of fate
Tryin' to get over
Tryin' to get over
Tryin' to get over
Tryin' to get over
Wooh, Superfly

The aim of his role
Was to move a lot of blow
Ask him his dream
What does it mean? He wouldn't know

""Can't be like the rest""
Is the most he'll confess
But the time's running out
And there's no happiness

Ooh, Superfly
You're gonna make your fortune by and by
But if you lose, don't ask no questions why
The only game you know is Do or Die
Ah-ha-ha

Superfly
Superfly
Superfly
Superfly

Tryin' to get over
Tryin' to get over
Tryin' to get over
Tryin' to get over
Tryin' to get over
Tryin' to get over
Tryin' to get over
Tryin' to get over
Tryin' to get over","['american', 'chicago soul', 'death by diabetes', 'funk', 'rnb', 'soul', 'soul and reggae']",354.6,65,1973,4.0,100.24,298,52,"{'neg': 0.114, 'neu': 0.79, 'pos': 0.096, 'compound': -0.8327}",Superfly,0.5,Curtis Mayfield,25,36
"Told you once before
And I won't tell you no more
Get down, get down, get down
You're a bad dog, baby
But I still want you around

You give me the creeps
When you jump on your feet
So get down, get down, get down
Keep your hands to yourself
I'm strictly out of bounds

Once upon a time, I drank a little wine
Was as happy as could be, happy as could be
Now I'm just like a cat on a hot tin roof
Baby, what do you think you're doing to me

Told you once before
And I won't tell you no more
So get down, get down, get down
You're a bad dog, baby
But I still want you around, around
I still want you around
Hey hey hey

I don't give a damn
And I'd like you, if you can 
To get down, get down, get down
You're a bad dog, baby
But I still want you around

Once upon a time, I drank a little wine
Was as happy as could be, happy as could be
Now I'm just like a cat on a hot tin roof
Baby, what do you think you're doing to me

Told you once before
And I won't tell you no more
So get down, get down, get down
You're a bad dog, baby
But I still want you around, around
I still want you around, mmm","['british', 'classic pop and rock', 'english', 'irish', 'uk']",261.0,66,1973,4.4,107.69,238,36,"{'neg': 0.057, 'neu': 0.787, 'pos': 0.156, 'compound': 0.9434}",Get Down,-0.30000000000000004,Gilbert O'Sullivan,7,20
"Your everlasting summer, and you can see it fading fast
So you grab a piece of something that you think is gonna last
Well, you wouldn't even know a diamond if you held it in your hand
The things you think are precious, I can't understand

Are you reelin' in the years?
Stowin' away the time?
Are you gatherin' up the tears?
Have you had enough of mine?

Are you reelin' in the years?
Stowin' away the time?
Are you gatherin' up the tears?
Have you had enough of mine?

You've been telling me you're a genius since you were seventeen
In all the time I've known you, I still don't know what you mean
The weekend at the college didn't turn out like you planned
The things that pass for knowledge, I can't understand

Are you reelin' in the years?
Stowin' away the time?
Are you gatherin' up the tears?
Have you had enough of mine?

Are you reelin' in the years?
Stowin' away the time?
Are you gatherin' up the tears?
Have you had enough of mine?

I've spent a lot of money, and I've spent a lot of time
The trip we made to Hollywood is etched upon my mind
After all the things we've done and seen, you find another man
The things you think are useless, I can't understand

Are you reelin' in the years?
Stowin' away the time?
Are you gatherin' up the tears?
Have you had enough of mine?

Are you reelin' in the years?
Stowin' away the time?
Are you gatherin' up the tears?
Have you had enough of mine?","['classic pop and rock', 'jazz-rock', 'pop/rock']",347.4,68,1973,4.800000000000001,89.75,268,36,"{'neg': 0.026000000000000002, 'neu': 0.937, 'pos': 0.037, 'compound': 0.6142000000000001}",Reelin' In The Years,2.5,Steely Dan,20,27
"When I was young I'd listen to the radio
Waiting for my favorite songs
When they played I'd sing along
It made me smile

Those were such happy times and not so long ago
How I wondered where they'd gone
But they're back again just like a long lost friend
All the songs I loved so well

Every shalalala, every oho, oho
Still shines
Every shing-a-ling-a-ling that they're starting to sing's
So fine

When they get to the part where he's breaking her heart
It can really make me cry
Just like before
It's yesterday once more

(Shoobidoo, wangdang)
(Shoobidoo, wangdang)

Looking back on how it was in years gone by
And the good times that I had
Makes today seem rather sad
So much has changed

It was songs of love that I would sing to them
And I'd memorize each word
Those old melodies still sound so good to me
As they melt the years away

Every shalalala, every oho, oho
Still shines
Every shing-a-ling-a-ling that they're starting to sing's
So fine

All my best memories come back clearly to me
Some can even make me cry
Just like before
It's yesterday once more

(Shoobidoo, wangdang)
(Shoobidoo, wangdang)

Every shalalala, every oho, oho
Still shines
Every shing-a-ling-a-ling that they're starting to sing's
So fine

Every shalalala, every oho, oho
Still shines
Every shing-a-ling-a-ling that they're starting to sing's
So fine","['adult contemporary', 'baroque pop', 'classic pop and rock', 'country pop', 'easy listening', 'pop']",342.9,70,1973,4.800000000000001,72.83,232,32,"{'neg': 0.045, 'neu': 0.754, 'pos': 0.201, 'compound': 0.9899}",Yesterday Once More,4.8,Carpenters,27,27
"Clair
The moment I met you, I swear
I felt as if something, somewhere
Had happened to me
Which I couldn't see
And then
The moment I met you again
I knew in my heart that we were friends
It had to be so
It couldn't be no
But try 
As hard as I might do, I don't know why
You get to me in a way I can't describe
Words mean so little when you look up and smile
I don't care what people say, to me you're more than a child
Oh, Clair
Clair

Clair
If ever a moment so rare 
Was captured for all to compare
That moment is you 
In all that you do
But why
In spite of our age difference do I cry
Each time I leave you I feel I could die
Nothing means more to me than hearing you say
""I'm going to marry you, will you marry me, Uncle Ray?""  
Oh, Clair
Clair

Clair
I've told you before, don't you dare
Get back into bed
Can't you see that it's late
No you can't have a drink
Oh all right then, but wait just a bit
While I, in an effort to babysit
Catch of my breath what there is left of it
You can be murder at this hour of the day
But in the morning this hour will seem a lifetime away
Oh, Clair  
Clair
Oh, Clair","['british', 'classic pop and rock', 'english', 'irish', 'uk']",266.4,72,1973,5.2,105.66,238,29,"{'neg': 0.08700000000000001, 'neu': 0.891, 'pos': 0.023, 'compound': -0.9156000000000001}",Clair,0.5,Gilbert O'Sullivan,16,8
