lyrics,tags,num_syllables,pos,year,fog_index,flesch_index,num_words,num_lines,sentiment,title,f_k_grade,artist,difficult_words,num_dupes
"I been in the right place but it must have been the wrong time
I'd have said the right thing but I must have used the wrong line
I been in the right trip but I must have used the wrong car
My head was in a bad place and I'm wondering what it's good for
I been the right place but it must have been the wrong time
My head was in a bad place but I'm having such a good time

I been running trying to get hung up in my mind
Got to give myself a good talking-to this time
Just need a little brain salad surgery
Got to cure my insecurity

I been in the wrong place but it must have been the right time
I been in the right place but it must have been the wrong song
I been in the right vein but it seems like the wrong arm
I been in the right world but it seems wrong wrong wrong wrong wrong

Slipping dodging sneaking creeping hiding out down the street
See me life shaking with every ho' I meet
Refried confusion is making itself clear
Wonder which way do I go to get on out of here

I been in the right place but it must have been the wrong time
I'd have said the right thing but I must have used the wrong line
I'd have took the right road but I must have took a wrong turn
I'd have took the right move but I made it at the wrong time
I been on the trip road but I must have used the wrong car
My head was in a good place and I wonder what it's bad for.","['classic pop and rock', 'folk', 'new orleans r&b', 'psychedelic rock']",325.8,24,1973,6.800000000000001,101.59,290,24,"{'neg': 0.277, 'neu': 0.66, 'pos': 0.062, 'compound': -0.9977}","Right Place, Wrong Time",2.1,Dr. John,12,5
"Very superstitious, writing's on the wall
Very superstitious, ladder's 'bout to fall
Thirteen-month-old baby, broke the lookin' glass
Seven years of bad luck, your good thing's in your past

When you believe in things that you don't understand
Then you suffer
Superstition ain't the way
Yeah-eah, ay

Ooh, very superstitious, wash your face and hands
Rid me of the problem, do all that you can
Keep me in a daydream, keep me goin' strong, yeah
You don't wanna save me, sad is my song

When you believe in things that you don't understand
Then you suffer
Superstition ain't the way
Yeah, yeah
Oh, no
Ahh, ha!
Ow

Very superstitious, nothin' more to say
Very superstitious, the Devil's on his way
Thirteen-month-old baby, mmm, broke the lookin' glass
Seven years of bad luck, good things in your past
Mmm-hmm

When you believe in things that you don't understand
Then you suffer
Superstition ain't the way
No, no, no
Ooh

Ah-ah-ah, ah-ah
Ooh
Ah

Mmm, yeah, yeah, yeah, yeah
Hee, hee, hee, hee, hee, hee
Ooh-ooh
Ooh-ooh
Ooh-hoo
Hoo, hmm, hmm","['contemporary r&b', 'funk', 'pop', 'pop soul', 'rhythm & blues', 'rock and indie', 'soul']",224.1,26,1973,4.800000000000001,89.75,179,25,"{'neg': 0.181, 'neu': 0.683, 'pos': 0.136, 'compound': -0.9026000000000001}",Superstition,2.5,Stevie Wonder,21,14
"When I was a little boy (When I was just a boy)
And the Devil'd call my name (When I was just a boy)
I say, ""Now who do"" (Who)
""Who do you think you're fooling?"" (When I was just a boy)
I'm a consecrated boy (When I was just a boy)
Singer in a Sunday choir
Oh, my mama loves me, she loves me
She get down on her knees and hug me
And she loves me like a rock
She rocks me like the rock of ages
And loves me
She love me, love me, love me, love me

When I was grown to be a man (Grown to be a man)
Mm, and the Devil would call my name (Grown to be a man)
I say ""Now who do"" (Who)
""Who do you think you're fooling?"" (Grown to be a man)
I'm a consummated man (Grown to be a man)
I can snatch a little purity
My mama loves me, she loves me
She get down on her knees and hug me
Oh, she loves me like a rock
She rock me like the rock of ages
And loves me
She love me, love me, love me, love me

And if I was the President (Was the President)
The minute the Congress call my name (Was the President)
I say ""Now, who do"" (Who)
""Who do you think you're fooling?"" (Who do you think you're fooling?)
I got the Presidential seal (Was the President)
I'm up on the Presidential podium
My mama loves me, she loves me
She get down on her knees and hug me
Oh, and she loves me like a rock
She rock me like the rock of ages
And love me
She love me, love me, love me, love me
Love me like a rock
She love me, love me, love me, love me
Love me like a rock
She love me, love me, love me, love me
Love me like a rock
Whoo, yeah
Love me like a rock
La-la-la-la-la-la
Rock me like the rock of ages
Love me like a rock
Love me like a rock
Rock me like the rock of ages
Love me like a rock
Love me like a rock
La-la-la-la-la-la
Rock me like the rock of ages
Love me like a rock
Love me like a rock
Whoo-hoo
Rock me like the rock of ages
Love me like a rock
Love me like a rock
Rock me like the rock of ages
Love me like a rock
Love me like a rock
Rock me like the rock of ages
Love me like a rock
Love me like a rock
Rock me like the rock of ages","['american', 'classic', 'classic pop and rock', 'contemporary folk', 'folk', 'folk pop', 'folk rock', 'paul-simon', 'pop', 'pop rock', 'pop/rock', 'rock', 'singer/songwriter', 'various artists', 'world']",532.8,27,1973,4.800000000000001,98.21,449,64,"{'neg': 0.007, 'neu': 0.53, 'pos': 0.463, 'compound': 0.9998}",Loves Me Like A Rock,1.3,Paul Simon,18,32
"There's got to be a morning after
If we can hold on through the night
We have a chance to find the sunshine
Let's keep on looking for the light

Oh, can't you see the morning after?
It's waiting right outside the storm
Why don't we cross the bridge together
And find a place that's safe and warm?

It's not too late, we should be giving
Only with love can we climb
It's not too late, not while we're living
Let's put our hands out in time

There's got to be a morning after
We're moving closer to the shore
I know we'll be there by tomorrow
And we'll escape the darkness
We won't be searching anymore

There's got to be a morning after
(There's got to be a morning after)
There's got to be a morning after
(There's got to be a morning after)
There's got to be a morning after
(There's got to be a morning after)
There's got to be a morning after
(There's got to be a morning after)
There's got to be a morning after
(There's got to be a morning after)
There's got to be a morning after
(There's got to be a morning after)","['broadway theatre', 'pop']",252.9,28,1973,4.4,90.77,201,29,"{'neg': 0.01, 'neu': 0.904, 'pos': 0.08600000000000001, 'compound': 0.9295}",The Morning After,2.1,Maureen McGovern,18,15
"He was born in the summer of his 27th year
Comin' home to a place he'd never been before
He left yesterday behind him, you might say he was born again
You might say he found a key for ev'ry door

When he first came to the mountains, his life was far away
On the road and hangin' by a song
But the string's already broken and he doesn't really care
It keeps changin' fast and it don't last for long

But the Colorado Rocky Mountain high
I've seen it rainin' fire in the sky
The shadow from the starlight is softer than a lullaby
Rocky Mountain high (Colorado)
Rocky Mountain high (high in Colorado)

He climbed cathedral mountains, he saw silver clouds below
He saw everything as far as you can see
And they say that he got crazy once and he tried to touch the sun
And he lost a friend but kept the memory

Now he walks in quiet solitude, the forests and the streams
Seeking grace in every step he takes
His sight has turned inside himself to try and understand
The serenity of a clear blue mountain lake

And the Colorado Rocky Mountain high
I've seen it rainin' fire in the sky
Talk to God and listen to the casual reply
Rocky Mountain high (high in Colorado)
Rocky Mountain high (high in Colorado)

Now his life is full of wonder but his heart still knows some fear
Of a simple thing he cannot comprehend
Why they try to tear the mountains down to bring in a couple more
More people, more scars upon the land

And the Colorado Rocky Mountain high
I've seen it rainin' fire in the sky
I know he'd be a poorer man if he never saw an eagle fly
Rocky Mountain high

It's a Colorado Rocky Mountain high
I've seen it rain fire in the sky
Friends around the campfire and everybody's high
Rocky Mountain high (high in Colorado)
Rocky Mountain high (high in Colorado)
Rocky Mountain high (high in Colorado)
Rocky Mountain high (high in Colorado)
Rocky Mountain high (high in Colorado)
Rocky Mountain high (high in Colorado)","['american', 'country', 'country folk', 'death by airplane', 'folk', 'folk rock', 'pop', 'pop folk', 'rock', 'rock and roll']",475.2,29,1973,5.2,88.74,358,43,"{'neg': 0.069, 'neu': 0.885, 'pos': 0.046, 'compound': -0.7765000000000001}",Rocky Mountain High,2.9,John Denver,37,18
"Well, I don't know why I came here tonight
I got the feeling that something ain't right
I'm so scared in case I fall off my chair
And I'm wondering how I'll get down the stairs
Clowns to the left of me, jokers to the right
Here I am, stuck in the middle with you

Yes, I'm stuck in the middle with you
And I'm wondering what it is I should do
It's so hard to keep this smile from my face
Losing control, yeah, I'm all over the place
Clowns to the left of me, jokers to the right
Here I am, stuck in the middle with you

Well, you started off with nothing
And you're proud that you're a self-made man
And your friends they all come crawlin'
Slap you on the back and say, ""Please, please""

Trying to make some sense of it all
But I can see it makes no sense at all
Is it cool to go to sleep on the floor?
Well, I don't think I can take anymore
Clowns to the left of me, jokers to the right
Here I am, stuck in the middle with you

Well, you started out with nothing
And you're proud that you're a self-made man
And your friends they all come crawlin'
Slap you on the back and say, ""Please, please""

Yeah, I don't know why I came here tonight
I got the feeling that something ain't right
I'm so scared in case I fall off my chair
And I'm wondering how I'll get down the stairs
Clowns to the left of me, jokers to the right
Here I am, stuck in the middle with you

Yes, I'm stuck in the middle with you
Stuck in the middle with you
Here I am, stuck in the middle with you","['british', 'classic pop and rock', 'scottish', 'uk']",338.4,30,1973,5.2,105.66,302,35,"{'neg': 0.109, 'neu': 0.78, 'pos': 0.111, 'compound': -0.12340000000000001}",Stuck In The Middle With You,0.5,Stealers Wheel,13,19
"Wash away my troubles, wash away my pain
With the rain in Shambala
Wash away my sorrow, wash away my shame
With the rain in Shambala

Ah, ooh, yeah
Yeah, yeah, yeah, yeah, yeah
Ah, ooh, yeah
Yeah, yeah, yeah, yeah, yeah

Everyone is helpful, everyone is kind
On the road to Shambala
Everyone is lucky, everyone is so kind
On the road to Shambala

Ah, ooh, yeah
Yea, yeah, yeah, yeah, yeah
Ah, ooh, yeah
Yeah, yeah, yeah yeah, yeah

How does your light shine
In the halls of Shambala
How does your light shine
In the halls of Shambala?

I can tell my sister by the flowers in her eyes
On the road to Shambala
I can tell my brother by the flowers in his eyes
On the road to Shambala

Ah, ooh, yeah
Yeah, yeah, yeah yeah, yeah
Ah, ooh, yeah
Yeah, yeah, yeah yeah, yeah

How does your light shine
In the halls of Shambala?
How does your light shine
In the halls of Shambala?
Tell me how does your light shine
In the halls of Shambala?
(Tell me how) How does your light shine
In the halls of Shambala?

Ah, ooh, yeah
Yeah, yeah, yeah yeah, yeah
Ah, ooh, yeah
On the road to Shambala

Ah, ooh, yeah
Shambala, la
Ah, ooh, yeah
On the road to Shambala","['classic pop and rock', 'never been to spain']",255.6,31,1973,4.0,108.7,223,43,"{'neg': 0.044, 'neu': 0.579, 'pos': 0.377, 'compound': 0.9974000000000001}",Shambala,-0.7000000000000001,Three Dog Night,10,34
"People all over the world (everybody)
Join hands (join)
Start a love train, love train
People all over the world (all the world, now)
Join hands (love ride)
Start a love train (love ride), love train

The first stop that we'll make will be England
Tell all the folks in Russia and China, too
Don't you know that it's time to get on board
And let this train keep on riding, riding on through
Well, well

People all over the world (you don't need no money)
Join hands (come on)
Start a love train, love train (don't need no ticket, come on)
People all over the world (Join in, ride this train)
Join in (Ride this train, y'all)
Start a love train (Come on, train), love train

All of you brothers over in Africa
Tell all the folks in Egypt, and Israel, too
Please don't miss this train at the station
'Cause if you miss it, I feel sorry, sorry for you
Well

People all over the world (Sisters and brothers)
Join hands (join, come on)
Start a love train (ride this train, y'all), love train (Come on)
People all over the world (Don't need no tickets)
Join hands (come on, ride)
Start a love train, love train

Ride, let it ride
Let it ride
Let it ride
People, ain't no war
People all over the world (on this train)
Join in (ride the train)
Start a love train, love train (ride the train, y'all)
People all over the world (come on)
Join hands (you can ride or stand, yeah)
Start a love train, love train (makin' love)
People all over the world ('round the world, y'all)
Join hands (come on)
Start a love train, love train","['classic pop and rock', 'r&b', 'soul']",338.4,32,1973,4.800000000000001,98.21,287,39,"{'neg': 0.013000000000000001, 'neu': 0.659, 'pos': 0.328, 'compound': 0.9988}",Love Train,1.3,O'Jays,19,8
"It feels so good
You lying here next to me
Oh, what a groove
You have no idea how it feels
My hands just won't keep still
I love you, baby
Oh, I love you, I love you, I love you
I just wanna hold you
Run my fingers through your hair
Ooh
Outta sight
Uh-huh, right there, you like it like that
Closer
Come here, closer, close
Oh, baby
Oh, baby

Give it up, ain't no use
I can help myself if I'd wanted to
I'm hung up, no doubt
I'm so in love with you, for me there's no way out

'Cause deeper and deeper
In love with you I'm falling
Sweeter and sweeter
Your tender words of love keeps calling

Eager and eager, yeah
To feel your lips upon my face
Please her and please her
Any time or any place

I'm gonna love you, love you, love you just a little more, baby
I'm gonna need you, need you, need you every day
I'm gonna want you, want you, want you in every way

Make no mistake for I'll hold back knowin'
This time it looks like lover is here to stay
As long as I shall live
I'll give you all I have and all I have to give

'Cause please her and please her
Any time or any place
Eager and eager
To feel your sweet lips on my face

Deeper and deeper
In love with you I'm falling, yeah
Sweeter and sweeter
Your tender words of love keeps calling

I'm gonna love you, love you, love you just a little more, baby
I'm gonna need you, need you, need you every day
I'm gonna want you, want you, want you in every way","['american', 'classic pop and rock', 'disco', 'easy listening', 'funk', 'pop', 'pop soul', 'smooth soul', 'soul']",357.3,33,1973,4.800000000000001,98.21,290,41,"{'neg': 0.20600000000000002, 'neu': 0.647, 'pos': 0.147, 'compound': -0.9801000000000001}",I'm Gonna Love You Just A Little More,1.3,Barry White,24,14
"Keep on truckin', baby
I got to keep on truckin'
Got to get to your good lovin'

Shame --
A double shame on me, yeah
Love --
Love, I let it control me, yeah
From just one kiss I am inspired
To lovers in time there's a fire

And I'll keep on truckin', baby
I got to keep on truckin'
I got to get to your good lovin'
Huh...huh...huh...huh...

Baby, its bad --
It's so hard to bear
Yes, babe --
You're hard to bear
I've got a fever rising with desire
It's my love jones and I feel like I'm on fire

And I'll keep on keep on truckin', baby
I got to keep on truckin'
Got to get to your good lovin'

Feelin' good
No, you can't stop the feelin'
No, you can't stop the feelin'
No, not now
Keep on truckin' on
Keep on truckin' on
Keep on truckin'
Keep on truckin' on
Keep on truckin'

Yes, I've got a fever rising with desire
It's my love jones and I feel like I'm on fire
And I'll keep on keep on truckin', baby

I'm the red ball express of lovin'
Diesel-powered straight to you, I'm truckin'
In old Temptation's rain, I'm duckin'
For your love through sleet and snow, I'm truckin', ooh
I'm the red ball express of lovin'
Diesel-powered straight to you, I'm truckin'
In old Temptation's rain, I'm duckin'
For your love through sleet and snow, I'm truckin'

Ain't nothin' holdin' me back nothin'
I'll keep right on, right on truckin'
Ain't nothin' holdin' me back nothin'
I'll keep right on, right on truckin'",['rock and indie'],320.4,35,1973,4.4,99.23,265,41,"{'neg': 0.085, 'neu': 0.686, 'pos': 0.23, 'compound': 0.9931000000000001}",Keep On Truckin',0.9,Eddie Kendricks,22,21
"People smile and tell me I'm the lucky one
And we've just begun
I think I'm gonna have a son
He will be like him and me, as free as a dove
Conceived in love
The sun is gonna shine above

And even though we ain't got money
I'm so in love with you honey
Everything will bring a chain of love
And in the morning when I rise
Bring a tear of joy to my eyes
And tell me everything's gonna be all right

Love a guy who holds the world in a paper cup
Drink it up
Love him and he'll bring you luck
And if you find he helps your mind, better take him home
Yeah, and don't you live alone
Try to earn what lovers own

And even though we ain't got money
I'm so in love with you honey
Everything will bring a chain of love
And in the morning when I rise
Bring a tear of joy to my eyes
And tell me everything's gonna be all right

And even though we ain't got money
I'm so in love with you honey
Everything will bring a chain of love
And in the morning when I rise
Bring a tear of joy to my eyes
And tell me everything's gonna be all right","['canadian', 'classic pop and rock', 'country', 'pop']",258.3,37,1973,4.800000000000001,98.21,218,30,"{'neg': 0.0, 'neu': 0.705, 'pos': 0.295, 'compound': 0.9975}",Danny's Song,1.3,Anne Murray,11,15
"Diamond Girl
You sure do shine
Glad I found you
Glad you're mine

Oh, my love
You're like a precious stone
Part of earth where
Heaven has rained on

Makes no difference
Where you are
Day or night time
You're like a shining star

And how could I
Shine without you
When it's about you
That I am, woah, oh

Diamond Girl
Roaming wild
Such a rare thing
Radiant child

I could never find
Another one like you
Part of me is
Deep down inside you

Can't you feel
The whole world turning
We are real and
We are burning, yeah

Diamond Girl
Now that I've found you
Well, it's about you that I am
Whoa, Whoa, oh

Diamond Girl
You sure do shine
Diamond Girl
You sure do shine
Diamond Girl
You sure do shine
Diamond Girl
You sure do, you sure do
You sure do shine","['classic pop and rock', 'soft rock']",185.4,40,1973,3.6,92.8,148,32,"{'neg': 0.012, 'neu': 0.631, 'pos': 0.357, 'compound': 0.9951000000000001}",Diamond Girl,1.3,Seals and Crofts,11,17
"Give me love
Give me love
Give me peace on earth
Give me light
Give me life
Keep me free from birth
Give me hope
Help me cope with this heavy load
Trying to touch and reach you
With heart and soul

OM, my Lord
Please, take hold of my hand
That I might understand you

Won't you please
Oh, won't you
Give me love
Give me love
Give me peace on earth
Give me light
Give me life
Keep me free from birth
Give me hope
Help me cope with this heavy load
Trying to touch and reach you 
With heart and soul

OM, my Lord

Won't you please
Oh, won't you
Give me love
Give me love
Give me peace on earth
Give me light
Give me life
Keep me free from birth
Give me hope
Help me cope with this heavy load
Trying to touch and reach you 
With heart and soul

Give me love
Give me love
Give me peace on earth
Give me light
Give me life
Keep me, keep me free from birth
Now, give me hope
Help me cope with this heavy load
Trying to touch and reach you 
With heart and soul

OM, my Lord","['british', 'classic pop and rock', 'death by lung cancer', 'electronic', 'english', 'experimental', 'folk', 'folk pop', 'my sweet lord', 'pop', 'pop rock', 'pop/rock', 'psychedelic rock', 'rock', 'singer/songwriter', 'uk', 'united kingdom']",234.9,42,1973,3.6,101.26,203,49,"{'neg': 0.015, 'neu': 0.637, 'pos': 0.34900000000000003, 'compound': 0.998}",Give Me Love,0.1,George Harrison,0,37
"If you want me to stay,
I'll be around today,
to be available for you to see.
But I am about to go,
And then you'll know,
For me to stay here I got to be me.

You'll never be in doubt,
That's what it's all about,
You can't take me for granted and smile.
Count the days I'm gone
Forget reachin' me by phone
Because I promise I'll be gone for a while.

And when you see me again,
I hope that you have been,
The kind of person....that you really are now.
Got to get in straight,
How could I ever be late,
When you're my woman taking up my time.

Whoa, oh how could I ever allow,
I guess I wonder how,
I could get out a pocket for fun.   HOW HOW!!
When you know that you're never number two,
Number one's gonna be number one,
ohh oww oohh

I'll be good,
I wish I could
I get this message over to you now.
ahhh, yeah, message, mmmm
When you see me again,
I hope that you have been,
The kind of person you really are now.
I'll be so good, oh
I wish I could,
I get this message over to you now.

ahhh, yeah.....","['funk', 'psychedelic soul', 'soul', 'soul and reggae']",242.1,43,1973,4.0,100.24,209,35,"{'neg': 0.027, 'neu': 0.846, 'pos': 0.127, 'compound': 0.9685}",If You Want Me To Stay,0.5,Sly and The Family Stone,16,6
"You're the girl of my dreams
I'd like to thank you for waiting patiently
Daddy's home, your daddy's home to stay

How I've waited for this moment
To be by your side
Your best friend wrote and told me
You had teardrops in your eyes
Daddy's home, your daddy's home to stay

It wasn't on a Sunday (Monday and Tuesday went by)
It wasn't on a Tuesday afternoon (all I could do was cry)
But I made a promise that you treasured
I made it back home to you

How I've waited for this moment
To be by your side
Your best friend wrote and told me
You had teardrops in your eyes
Daddy's home, your daddy's home to stay
Daddy's home to stay
I'm not a thousand miles away
Daddy's home to stay
I'm gonna be here come what may
Daddy's home to stay",['classic pop and rock'],179.1,44,1973,4.4,99.23,145,22,"{'neg': 0.0, 'neu': 0.8200000000000001, 'pos': 0.18, 'compound': 0.9806}",Daddy's Home,0.9,Jermaine Jackson,12,10
"It's sad to think we're not gonna make it
And it's gotten to the point
Where we just can't fake it
For some ungodly reason
We just won't let it die

I guess neither one of us
Neither one of us wants to be the first to say good-bye

I keep wondering
Wondering
What I'm gonna do without you
And I guess you must be wondering the same thing too
So we go on
Go on together
Living a lie

Because neither one of us
Neither one of us wants to be the first to say good-bye

Every time I find the nerve
Every time I find the nerve to say I'm leaving, old memories
Those old memories get in my way 

Lord knows it's only me 
Heaven knows it's only me
That I'm deceiving

When it comes to saying good-bye
That's a simple word that I just cannot say

There can be no way
There can be no way
This can have a happy ending
No, no
So we just go on
Hurting and pretending
Convincing ourselves to give it just one more try

Because neither one of us
Neither one of us wants to be the first to say
Neither one of us wants to be the first to say
Neither one of us wants to be the first to say
Farewell my love
Goodbye","['doo-wop', 'funk', 'gospel', 'motown', 'rhythm and blues', 'smooth soul', 'soft rock', 'soul']",280.8,45,1973,4.4,99.23,227,34,"{'neg': 0.07, 'neu': 0.843, 'pos': 0.08700000000000001, 'compound': 0.7184}",Neither One Of Us,0.9,Gladys Knight,23,12
"Since I met you, I've begun to feel so strange
Every time I speak your name
That's funny, you say that you
Are so helpless too
That you don't know what to do

Each night I pray there will never come a day
When you up and take your love away
Say you feel the same way too
And I wonder what
It is I feel for you

(Could it be I'm falling in love)
With you, baby
(Could it be I'm falling in love)
Woo
(Could it be I'm falling in love)
With you
With you
With you
(With you)

I don't need all those things that used to bring me joy
You've made me such a happy boy
And honey, you'll always be
The only for me
Meeting you was my destiny

You can be sure I will never let you down
When you need me I'll be around
And darling you'll always be
The only for me
Heaven made you specially

(Could it be I'm falling in love)
With you, baby
(Could it be I'm falling in love)
Woo
(Could it be I'm falling in love)
With you
With you
With you
(With you)

And darling you'll always be
The only for me
Heaven made you specially

(Could it be I'm falling in love)
With you, baby
(Could it be I'm falling in love)
I want to know now, baby
(Could it be I'm falling in love)
With you
With you
With you
(With you)

I walk around with my heart in my hands, hey
I walk the street as long as I can, baby
I used to sing fa fa fa fa
But right now I feel so good, I sing la la la la
Once you get me up, wn't let me down
Just let this feeling carry me on
Skip the beats with my heart girl","['punk', 'turkey']",347.4,47,1973,4.800000000000001,106.67,312,43,"{'neg': 0.061, 'neu': 0.801, 'pos': 0.137, 'compound': 0.9844}",Could It Be I'm Falling In Love,0.1,Spinners,13,32
