lyrics,tags,num_syllables,pos,year,fog_index,flesch_index,num_words,num_lines,sentiment,title,f_k_grade,artist,difficult_words,num_dupes
"Hey What's Happinin' Homie?
It's Your Lil' One Plies Man
I Ran Across The Eyes Of A Lil' Baby The Other Day Homie
Lil' Mama So Bad She Had Me Hypnotized
I Couldn't Get My Eyes Off Her
Let Me Tell You How It's Like To Be Hypnotized.

Akon
You Got Me So Hypnotized
The Way Your Body Rollin' Round & Round
That Booty Keep Bumpin' Titty's Just Bouncin' Up & Down
You Got Me So Hypnotized
The Way Your Body Rollin' Round & Round
That Booty Keep Bumpin' Titty's Just Bouncin' Up & Down.

It's 2:00 In The Mornin'
I'm Yiked Up & I'm Horny
All I Need Now Is Some Moanin'
That Pussy Got Me Zoanin'
Her Vibe Tell Me She Want It
She Gotta Fuck How She On Me
I Got Her Tonight Cause She Joanin'
I Know In The Panty She Foamin'
I'm Locked Eyes On That Monkey
I Know She Wet, Cause She Told Me
That Ass On The She Pokin'
Every Nigga In Here Scopin'
I See Me Up In Her Pokin'
She Bent Over & I'm Strokin'
Her Cheeks Spread Wide Opened
I'm Beatin' It & I'm Focused.

Akon
You Got Me So Hypnotized
The Way Your Body Rollin' Round & Round
That Booty Keep Bumpin' Titty's Just Bouncin' Up & Down
You Got Me So Hypnotized
The Way Your Body Rollin' Round & Round
That Booty Keep Bumpin' Titty's Just Bouncin' Up & Down.

Akon
Now Do It Some More (Just Like That)
Just Do It Some More (Yes Just like That)
Girl Do It Some More (Now Shake That Ass, Make A Nigga Like Me Spend That Cash)
Now Do It Some More (Just Like That)
Just Do It Some More (Yes Just Like That)
Girl Do It Some More (Now Shake That Ass, Make A Nigga Like Me Spend That Cash)

She Bad As Hell & She Swoll
I'm Tryin' To Play In Her Hole 
Lil' Mama A Dime, She Cold
I Fuck Her Once & She Sold
I Want Her Naked No Clothes 
I'm Into Private Shows
No Limit Anything Goes
I'm A Let Her Ride Me Her Toes
Just Stand In Front Of Me & Pose
You Touch Mine, I Touch Yours
To Get Her Sprung Is My Goal
First Time I Seen Her I Froze
I Had To Get Her She Knows
She Buck'd It Then She Fold
Cause I'm Too Real & She Knows
She Wanna Goon & It Show.

Akon
You Got Me So Hypnotized
The Way Your Body Rollin' Round & Round
That Booty Keep Bumpin' Titty's Just Bouncin' Up & Down
You Got Me So Hypnotized
The Way Your Body Rollin' Round & Round
That Booty Keep Bumpin' Titty's Just Bouncin' Up & Down.

Akon
Now Do It Some More (Just Like That)
Just Do It Some More (Yes Just Like That)
Girl Do It Some More (Now Shake That Ass, Make A Nigga Like Me Spend That Cash)
Now Do It Some More (Just Like That)
Just Do It Some More (Yes Just Like That)
Girl Do It Some More (Now Shake That Ass, Make A Nigga Like Me Spend That Cash)

Akon
You Got Me So Hypnotized
The Way Your Body Rollin' Round & Round
That Booty Keep Bumpin' Titty's Just Bouncin' Up & Down
You Got Me So Hypnotized
The Way Your Body Rollin' Round & Round
That Booty Keep Bumpin' Titty's Just Bouncin' Up & Down.","['gangsta rap', 'hip hop', 'pop rap', 'soul and reggae', 'southern hip hop', 'trap rap']",670.5,77,2008,4.800000000000001,98.21,553,74,"{'neg': 0.083, 'neu': 0.852, 'pos': 0.064, 'compound': -0.9454}",Hypnotized,1.3,Plies,44,40
"Da da da da

The smell of your skin lingers on me now
You're probably on your flight back to your home town
I need some shelter of my own protection baby
To be with myself and center, clarity
Peace, serenity

I hope you know, I hope you know
That this has nothing to do with you
It's personal, myself and I
We've got some straightening out to do

And I'm gonna miss you like a child misses their blanket
But I've got to get a move on with my life
It's time to be a big girl now
And big girls don't cry
Don't cry
Don't cry
Don't cry

The path that I'm walking, I must go alone
I must take the baby steps until I'm full grown, full grown
Fairy tales don't always have a happy ending, do they
And I foresee the dark ahead if I stay

I hope you know, I hope you know
That this has nothing to do with you
It's personal, myself and I
We've got some straightening out to do

And I'm gonna miss you like a child misses their blanket
But I've got to get a move on with my life
It's time to be a big girl now
And big girls don't cry

Like the little schoolmate in the school yard
We'll play jacks and Uno cards
I'll be your best friend and you'll be mine
Valentine

Yes, you can hold my hand if you want to
'Cause I want to hold yours, too
We'll be playmates and lovers
And share our secret worlds

But it's time for me to go home
It's getting late, dark outside
I need to be with myself and center, clarity
Peace, serenity

I hope you know, I hope you know
That this has nothing to do with you
It's personal, myself and I
We've got some straightening out to do

And I'm gonna miss you like a child misses their blanket
But I've got to get a move on with my life
It's time to be a big girl now
And big girls don't cry
Don't cry
Don't cry
Don't cry

La da da da da da","['hip hop', 'pop', 'r&b', 'soul and reggae']",431.1,78,2008,5.2,97.2,363,44,"{'neg': 0.044, 'neu': 0.747, 'pos': 0.21, 'compound': 0.9962000000000001}",Big Girls Don't Cry,1.7000000000000002,Fergie,26,33
"Kanye West and T-Pain:
Like we always do at this time
I go for mine, I gots to shine
(Now throw yo' hands up in the sky)
I go, go for mine, I gots to shine
(Now throw yo' hands up in the sky
I'mma get on the TV momma, I'mma
I'mma put shit down)
Ay, (Ay), Ay, (Ay)
Ay, (Ay), Ay, (I'm good)

Welcome to the good life, where niggas who sell D
Won't even get pulled over in they new V
The good life, let's go on a living spree
Shit, they say the best things in life are free
The good life, it feel like Atlanta
It feel like L.A., it feel like Miami
It feel like N.Y., summertime Chi
Ahh (Now throw yo' hands up in the sky)
So I roll through good, y'all pop the trunk
I pop the hood, Ferrari
And she got the goods, and she got that ass
I got to look, sorry
Yo, it's got to be 'cause I'm seasoned
Haters give me them salty looks, Lawry's
50 told me, go 'head, switch the style up
And if they hate then let 'em hate
And watch the money pile up, the good life

Now I, I go for mine, I got to shine
(Now throw yo' hands up in the sky)
Now I, I go for mine, I got to shine
(Now throw yo' hands up in the sky
I'mma get on this TV momma, I'mma
I'mma put shit down)
Ay, (Ay), Ay, (Ay)
Ay, (Ay), Ay, (I'm good)

Welcome to the good life
Where we like the girls who ain't on TV
'Cause they got mo' ass than the models
The good life, so keep it comin' with the bottles
'Cause she feel booze like she bombed at Apollo
The good life, it feel like Houston
It feel like Philly, it feel like DC
It feel like VA or the Bay or Yay
Ay, this is the good life (Welcome to the good life)
Homey, tell me what's good
Why I only got a problem when you in the hood? (Welcome to the good life)
Like I'm new in the hood
The only thing I wish, I wish a nigga would (Welcome to the good life)
He probably think he could
But, but, I don't think he should (Welcome to the good life)
50 told me, ""Go 'head, switch the style up
And if they hate then let 'em hate
And watch the money pile up, the good life""

Now I, I go for mine, I got to shine
(Now throw yo' hands up in the sky)
Now I, I go for mine, I got to shine
(Now throw yo' hands up in the sky
I'mma get on this TV momma, I'mma
I'mma put shit down)
Ay, (Ay), Ay, (Ay)
Ay, (Ay), Ay, (I'm good)

Have you ever popped champagne on a plane
While gettin' some brain?
Whipped it out, she said, ""I never seen Snakes on a Plane""
Whether you broke or rich you gotta get this
Havin' money's not everything not havin' it is
I was splurgin' on Tryst, but when I get my card back
Activated, I'm back to Vegas
'Cause (The good life) I always had a passion for flashin'
Before I had it, I closed my eyes and imagined the good life

T-Pain:
Better than the life I lived
When I thought that I was gonna go crazy
And now my grandmama
Ain't the only girl callin' me, ""Baby""
If you feelin' me now
Then put yo' hands up in the sky, and let me hear you say
Hey, hey, ooh I'm good","['american', 'hip hop', 'hip hop rnb and dance hall', 'hip-hop', 'producer', 'rapper', 'us']",689.4,79,2008,4.800000000000001,106.67,608,79,"{'neg': 0.068, 'neu': 0.788, 'pos': 0.14400000000000002, 'compound': 0.9884000000000001}",Good Life,0.1,Kanye West,54,20
"Superstar, where you from? How's it going?
I know you got a clue what you're doing
You can play brand new to all the other chicks out here
But I know what you are, what you are, baby

Look at you gettin' more than just a re-up
Baby, you got all the puppets with their strings up
Fakin' like a good one but I call 'em like I see 'em
I know what you are, what you are, baby

Womanizer, woman-womanizer, you're a womanizer
Oh, womanizer, oh, you're a womanizer, baby
You, you-you are, you, you-you are
Womanizer, womanizer, womanizer
(Womanizer)

Boy, don't try to front
I-I know just, just, what you are, are-are
Boy don't try to front
I-I know just, just, what you are, are-are

(You) You got me goin'
(You) You're oh so charmin'
(You) But I can't do it
(You) You womanizer

Boy, don't try to front
I-I know just, just, what you are, are-are
Boy don't try to front
I-I know just, just, what you are, are-are

(You) You say I'm crazy
(You) I got your crazy
(You) You're nothing but a
(You) Womanizer

Daddy-O, you got the swagger of a champion
Too bad for you, you just can't find the right companion
I guess when you have one too many, makes it hard, it could be easy
Who you are, that's just who you are, baby

Lollipop, must mistake me, you're the sucker
To think that I would be a victim, not another
Say it, play it, how you want it
But no way I'm never gonna fall for you, never you, baby

Womanizer, woman-womanizer, you're a womanizer
Oh, womanizer, oh, you're a womanizer, baby
You, you-you are, you, you-you are
Womanizer, womanizer, womanizer
(Womanizer)

Boy, don't try to front
I-I know just, just, what you are, are-are
Boy don't try to front
I-I know just, just, what you are, are-are

(You) You got me goin'
(You) You're oh so charmin'
(You) But I can't do it
(You) You womanizer

Boy, don't try to front
I-I know just, just, what you are, are-are
Boy don't try to front
I-I know just, just, what you are, are-are

(You) You say I'm crazy
(You) I got your crazy
(You) You're nothing but a
(You) Womanizer

Maybe if we both lived in a different world, yeah
(Womanizer, womanizer, womanizer, womanizer)
It would be all good and maybe I could be your girl
But I can't, 'cause we don't, you

Womanizer, woman-womanizer, you're a womanizer
Oh, womanizer, oh, you're a womanizer, baby
You, you-you are, you, you-you are
Womanizer, womanizer, womanizer
(Womanizer)

Boy, don't try to front
I-I know just, just, what you are, are-are
Boy don't try to front
I-I know just, just, what you are, are-are

(You) You got me goin'
(You) You're oh so charmin'
(You) But I can't do it
(You) You womanizer

Boy, don't try to front
I-I know just, just, what you are, are-are
Boy don't try to front
I-I know just, just, what you are, are-are

(You) You say I'm crazy
(You) I got your crazy
(You) You're nothing but a
(You) Womanizer

Boy, don't try to front
I-I know just, just, what you are, are-are
Boy don't try to front
I-I know just, just, what you are, are-are

Womanizer, woman-womanizer, you're a womanizer
Oh, womanizer, oh, you're a womanizer, baby","['american', 'américain', 'dance', 'dance-pop', 'electropop', 'if you seek amy', 'pop', 'pop and chart', 'urban pop', 'usa']",741.6,80,2008,4.4,90.77,560,84,"{'neg': 0.067, 'neu': 0.883, 'pos': 0.05, 'compound': -0.8862}",Womanizer,2.1,Britney Spears,31,73
"We were both young when I first saw you
I close my eyes and the flashback starts
I'm standing there
On the balcony in summer air

See the lights, see the party, the ball gowns
See you make your way through the crowd
And say, ""Hello.""
Little did I know

That you were Romeo, you were throwing pebbles
And my daddy said, ""Stay away from Juliet!""
And I was crying on the staircase
Begging you, ""Please don't go!"" 
And I said

Romeo, take me somewhere we can be alone
I'll be waiting, all there's left to do is run
You'll be the prince and I'll be the princess
It's a love story, baby, just say, ""Yes.""

So I sneak out to the garden to see you
We keep quiet, 'cause we're dead if they knew
So close your eyes
Escape this town for a little while
Oh, oh

'Cause you were Romeo, I was a scarlet letter
And my daddy said, ""Stay away from Juliet!""
But you were everything to me
I was begging you, ""Please don't go!"" 
And I said

Romeo, take me somewhere we can be alone
I'll be waiting, all there's left to do is run
You'll be the prince and I'll be the princess
It's a love story, baby, just say, ""Yes.""

Romeo, save me, they're trying to tell me how to feel
This love is difficult, but it's real
Don't be afraid, we'll make it out of this mess
It's a love story, baby, just say, ""Yes.""

Oh, oh

I got tired of waiting
Wondering if you were ever coming around
My faith in you was fading
When I met you on the outskirts of town 
And I said

Romeo, save me, I've been feeling so alone
I keep waiting for you but you never come
Is this in my head, I don't know what to think
He knelt to the ground and pulled out a ring and said

Marry me, Juliet, you'll never have to be alone
I love you, and that's all I really know
I talked to your dad, go pick out a white dress
It's a love story, baby, just say, ""Yes.""

Oh, oh
Oh, oh, oh

'Cause we were both young when I first saw you","['contemporary country', 'country', 'country pop', 'country-pop', 'dance-pop', 'electropop', 'female vocals', 'fixme label mess', 'pop', 'pop rock', 'singer/songwriter', 'taylor-swift', 'teen pop', 'top 40']",446.4,81,2008,4.800000000000001,98.21,376,49,"{'neg': 0.056, 'neu': 0.8300000000000001, 'pos': 0.114, 'compound': 0.9766}",Love Story,1.3,Taylor Swift,36,23
"You know I love music
And every time I hear something hot
It makes me wanna move
It makes me wanna have fun
But it's something about this joint right here
This joint right here
Its makes me wanna…..Woooh

Let it go...
Can't let this thing called love get away from you
Feel free right now, go do what you want to do
Can't let nobody take it away, from you, from me, from we
No time for moping around, are you kidding?
And no time for negative vibes, cause I'm winning
It's been a long week, I put in my hardest
Gonna live my life, feels so good to get it right

So I like what I see when I'm looking at me
When I'm walking past the mirror
Don't stress through the night, at a time in my life
Ain't worried about if you feel it
Got my head on straight, I got my vibe right
I aint gonna let you kill it
You see I wouldn't change my life, my life's just...

Fine, fine, fine, fine, fine, fine, ooooh
Fine, fine, fine, fine, fine, fine, ooooh
Just fine, fine, fine, fine, fine, fine, ooooh
You see I wouldn't change my life, my life's just fine

Feels so good, when you're doing all the things that you want to do
Get the best out of life, treat yourself to something new
Keep your head up high
In yourself, believe in you, believe in me
Having a really good time, I'm not complaining
And I'm a still wear a smile if it's raining
I got to enjoy myself regardless
I appreciate life, I'm so glad that it's fine

So I like what I see when I'm looking at me

When I'm walking past the mirror
Aint worried about you and what you gonna do
I'm a lady so I must stay classy
Got to keep it hot, keep it together
If I want to get better
See I wouldn't change my life, my life's just...
Fine, fine, fine, fine, fine, fine, ooooh
Fine, fine, fine, fine, fine, fine, ooooh
Just fine, fine, fine, fine, fine, fine, ooooh
See I won't change my life, my life's just fine

I ain't gon' let nothing get in my way
(I ain't gone let nobody bring me down, no, no, no)
No matter what nobody has to say
(No way, no way, no way)
I ain't gon' let nothing get in my way
No matter what nobody has to say

Feels so good, when you're doing all the things that you want to do
Get the best out of life, treat yourself to something new
It's a really good thing to say
That I won't change my life, my life's just fine

Fine, fine, fine, fine, fine, fine, ooooh
Fine, fine, fine, fine, fine, fine, ooooh
Just fine, fine, fine, fine, fine, fine, ooooh
See I won't change my life, my life's just fine

So I like what I see when I'm looking at me
When I'm walking past the mirror
Don't stress through the night, at a time in my life
Ain't worried about if you feel it
Got my head on straight, I got my vibe right
I ain't gonna let you kill it
You see I wouldn't change my life, my life's just...

Fine, fine, fine, fine, fine, fine, ooooh
Fine, fine, fine, fine, fine, fine, ooooh
Just fine, fine, fine, fine, fine, fine, ooooh
You see I wouldn't change my life, my life's just fine","['hip hop', 'hip hop rnb and dance hall', 'r&b']",724.5,82,2008,5.2,97.2,586,70,"{'neg': 0.047, 'neu': 0.608, 'pos': 0.34600000000000003, 'compound': 0.9993000000000001}",Just Fine,1.7000000000000002,Mary J. Blige,29,34
"I'm Miss American Dream since I was seventeen
Don't matter if I step on the scene or 
Sneak away to the Philippines
They still gon' put pictures of my derrière in the magazine
You want a piece of me?
You want a piece of me?

I'm Miss Bad Media Karma, another day, another drama
Guess I can't see the harm in working and being a mom
And with a kid on my arm, I'm still an exceptional earner
You want a piece of me?

I'm Mrs. Lifestyles of the Rich & Famous
You want a piece of me?
I'm Mrs. ""Oh My God! That Britney's Shameless!""
You want a piece of me?
I'm Mrs. ""Extra! Extra! This Just In!""
You want a piece of me?
I'm Mrs. ""She's Too Big, Now She's Too Thin""
You want a piece of me?

I'm Mrs. ""You Want a Piece of Me?"" tryin' and pissin' me off
Well, get in line with the paparazzi, who's flippin' me off
Hoping I'll resort to some havoc, end up settlin' in court
Now are you sure you want a piece of me?
You want a piece of me?

I'm Mrs. Most Likely to Get On the TV for Strippin' On the Streets
When getting the groceries. No, for real. Are you kidding me?
No wonder there's panic in the industry, I mean, please
Do you want a piece of me?

I'm Mrs. Lifestyles of the Rich & Famous
You want a piece of me?
I'm Mrs. ""Oh My God! That Britney's Shameless!""
You want a piece of me?
I'm Mrs. ""Extra! Extra! This Just In!""
You want a piece of me?
I'm Mrs. ""She's Too Big, Now She's Too Thin""
You want a piece of me?

I'm Miss American Dream since I was seventeen
Don't matter if I step on the scene 
Or sneak away to the Philippines
They still gon' put pictures of my derrière in the magazine
You want a piece of me?
You want a piece, piece of me?

You want a piece of me?

I'm Mrs. Lifestyles of the Rich & Famous
You want a piece of me?
I'm Mrs. ""Oh My God! That Britney's Shameless!""
You want a piece of me?
I'm Mrs. ""Extra! Extra! This Just In!""
You want a piece of me?
I'm Mrs. ""She's Too Big, Now She's Too Thin""
You want a piece of me?

I'm Mrs. Lifestyles of the Rich & Famous
You want a piece of me?
I'm Mrs. ""Oh My God! That Britney's Shameless!""
You want a piece of me?
I'm Mrs. ""Extra! Extra! This Just In!""
You want a piece of me?
I'm Mrs. ""She's Too Big, Now She's Too Thin""
You want a piece of me?

Piece of me, me, me
You want a piece of me?","['american', 'américain', 'dance', 'dance-pop', 'electropop', 'if you seek amy', 'pop', 'pop and chart', 'urban pop', 'usa']",523.8,83,2008,4.4,107.69,460,67,"{'neg': 0.047, 'neu': 0.788, 'pos': 0.165, 'compound': 0.9861000000000001}",Piece Of Me,-0.30000000000000004,Britney Spears,31,45
"T-Pain
I got a fresh line-up, yeah, fresh outfit
'About to have the parkin' lot on smash
Plus I got a chevy wit a 454 in the hood
That bitch got 125 on the dash.

Rick Ro$$
She like 'em gangsta 'cause
I'm The biggest Boss that you seen this far
I'm The I'm The biggest Boss that you've seen this far
I'm The biggest Boss that you've seen this far.

T-Pain
'Cause it's just another day in the life of The god damn Boss.

Rick Ro$$
I don't make love baby we make magic
Come home wit a thug let's get shit crackin'
Always wear a plastics baby 'cause shit happens
She leak the backseat just to freak in the magnum
Hopped out the magnum hopped in the trey
Just to let the top back & thank God for the day.
Who gives a fuck what a hater gotta say?
I made a couple million dollars last year dealin' whey
Still in the streets, strapped wit them things
She in love wit a G so she tatted my name ""Ro$$""
I'm The biggest Boss that you seen this far
10 black >maybacks back to back in the lane
I'm a make it rain & I'm a make it back
You are just a lame little homey that's a fact
Workin' wit the police, actin' like you know me.
Fresh outta jail already in your old >jeep?

T-Pain
I got a fresh line-up, yeah, fresh outfit
'About to have the parkin' lot on smash
Plus I got a chevy wit a 454 in the hood
That bitch got 125 on the dash.

Rick Ro$$
She like 'em gangsta 'cause
I'm The biggest Boss that you seen this far
I'm The I'm The biggest Boss that you've seen this far
I'm The biggest Boss that you've seen this far.

T-Pain
'Cause it's just another day in the life of The god damn Boss.

The Boss Boss Boss The Boss Boss Boss The Boss Boss Boss The Boss.
The Boss Boss Boss The Boss Boss Boss The Boss Boss Boss The Boss.
Shawty straight diggin' me & I ain't even rich
I know you niggas on the sideline like ""Ain't that a bitch?""
I'm on my job & I ain't gettin' off
'Cause it's just another day in the life of The god damn Boss.

Rick Ro$$
I'm The biggest Boss that you seen this far
Got the biggest car spanish broads no broad
Call that other lame for the walks in the park
I ain't come to play games I just wanna to play my part
Tell your girlfriend to come talk wit me dawg
We straight G's & we came here to ball
Bottle after bottle & I'm sure you count 'em all
Then we off to that Chevy fired up & takin' off
Baby slow it down 'cause you movin' too fast
Your ass to fine to be movin' too fast
Back to the thuggin' now I'm sippin' sizzer
All my niggas love it, baby that's my wizard
Stack for the G's 5 bones for the shizzer
I don't smoke 20's 800 for the Izzer
I'm The biggest Boss that you seen this far
You can tell by the shones that's standin' by the car.

T-Pain
I got a fresh line-up, yeah, fresh outfit
'About to have the parkin' lot on smash
Plus I got a chevy wit a 454 in the hood
That bitch got 125 on the dash.

Rick Ro$$
She like 'em gangsta 'cause
I'm The biggest Boss that you seen this far
I'm The I'm The biggest Boss that you seen this far
I'm The biggest Boss that you've seen this far.

T-Pain
'Cause it's just another day in the life of The god damn Boss.
Eh yeah yeah yeah yeah yeah yeah hey!
Yeah yeah yeah yeah yeah yeah yeah yeah, uh-huh
Yeah eh eh eh uh-huh
Yeah yeah yeah yeah yeah.

Rick Ro$$
I""m The biggest Boss that you seen this far.
I'm The biggest Boss that you seen this far.
I'm The biggest Boss that you seen this far.
I'm The I'm The biggest Boss that you seen this far.
I'm The biggest Boss that you seen this far.
I'm The I'm The biggest Boss that you seen this far.","['gangsta rap', 'hardcore hip hop', 'hip hop', 'hip hop rnb and dance hall', 'pop rap', 'southern hip hop', 'trap rap']",771.3,84,2008,5.6,104.64,711,75,"{'neg': 0.099, 'neu': 0.772, 'pos': 0.129, 'compound': 0.6939000000000001}",The Boss,0.9,Rick Ross,57,46
"It was 1989
My thoughts were short, my hair was long
Caught somewhere between a boy and man
She was seventeen
And she was far from in between
It was summertime in northern Michigan

Splashing through the sandbar
Talking by the campfire
It's the simple things in life like when and where
We didn't have no internet
But man I never will forget
The way the moonlight shined upon her hair

And we were trying different things
And we were smoking funny things
Making love out by the lake to our favorite song
Sipping whiskey out the bottle
Not thinking 'bout tomorrow
Singing ""Sweet Home Alabama"" all summer long
Singing ""Sweet Home Alabama"" all summer long

Catching walleye from the dock
Watching the waves roll off the rocks
She'll forever hold a spot inside my soul
We'd blister in the sun
We couldn't wait for night to come
To hit that sand and play some rock 'n' roll

While we were trying different things
And we were smoking funny things
Making love out by the lake to our favorite song
Sipping whiskey out the bottle

Not thinking 'bout tomorrow
Singing ""Sweet Home Alabama"" all summer long
Singing ""Sweet Home Alabama"" all summer long
Turn it up

Now nothing seems as strange
As when the leaves begin to change
Or how we thought those days would never end
Sometimes I hear that song
And I start to sing along
And think, man, I'd love to see that girl again

And we were trying different things
And we were smoking funny things
Making love out by the lake to our favorite song
Sipping whiskey out the bottle
Not thinking 'bout tomorrow
Singing ""Sweet Home Alabama"" all summer long

We were trying different things
And we were smoking funny things
Making love out by the lake to our favorite song
Sipping whiskey out the bottle

Not thinking 'bout tomorrow
Singing ""Sweet Home Alabama"" all summer long
Singing ""Sweet Home Alabama"" all summer long
Singing ""Sweet Home Alabama"" all summer long
Singing ""Sweet Home Alabama"" all summer long
Singing ""Sweet Home Alabama"" all summer long","['country', 'country rock', 'hard rock', 'hip hop', 'pop rock', 'rap', 'rap rock', 'rock', 'southern rock']",483.3,85,2008,4.4,82.31,351,55,"{'neg': 0.0, 'neu': 0.79, 'pos': 0.21, 'compound': 0.9977}",All Summer Long,3.3,Kid Rock,29,30
