lyrics,tags,num_syllables,pos,year,fog_index,flesch_index,num_words,num_lines,sentiment,title,f_k_grade,artist,difficult_words,num_dupes
"I'm gonna take my time
She gon' get hers before I
I'm gonna take it slow
I'm not gonna rush the stroke

So she can get a sensual seduction
So I can get a sensual seduction
So we can get a sensual seduction
Sensual seduction

She might be with him
But she's thinking 'bout me, me, me
We don't go to the mall
We don't go out to eat, eat, eat

All that we ever do
Is play in the sheets, sheets, sheets
Smoke us a cigarette
And go back to sleep, sleep, sleep

'Cause we done got a sensual seduction
Sensual seduction
Sensual seduction
Sensual seduction

I'm gonna take my time
She gon' get hers before I
I'm gonna take it slow
I'm not gonna rush the stroke

If ya don't know by know
Doggy Dogg is a freak, freak, freak
I keep a bad bitch with me
Seven days out the week, week, week

And all that we ever do
Is play in the sheets, sheets, sheets
Then smoke us a cigarette
Then go back to sleep, sleep, sleep

'Cause we done got a sensual seduction
Sensual seduction
Sensual seduction
Sensual seduction

I was all in da club, havin' a drink, no one on the suite
When I peeped this little freak out
I was all on the bar when drifter Shawty Redd came over
Then she hit the floor, now

With a see through dress, long hair, light brown eyes
Lookin' like Miss Bo Peep
And a playa know if I take her home, with them real big hips,
She's so right I'm gon' beat

So I approached the chick with the real pretty face
Nice curves although with a little bitty waist
I whispered in her ear, ""Lil' mama, what you drink?
I know that you're a freak but you know that I ain't gon' say shit""

See my game is outrageous
I got her to the crib and exchanged some love faces
But it was no need for me to rush to bust one
'Cause I wanted her to have an eruption

Sensual seduction
Sensual seduction
Sensual seduction
Sensual seduction
Sensual seduction
Sensual seduction","['american', 'g-funk', 'gangsta rap', 'hip hop', 'hip hop rnb and dance hall', 'hip-hop', 'reggae', 'west coast hip hop', 'west coast hip-hop']",439.2,50,2008,4.800000000000001,98.21,359,45,"{'neg': 0.068, 'neu': 0.89, 'pos': 0.042, 'compound': -0.7311000000000001}",Sensual Seduction,1.3,Snoop Dogg,26,30
"Looking back at the beginning of this
And how life was
Just you and me and loving all of our friends
Living life like an ocean

Now the current's only pulling me down
It's getting harder to breathe
It won't be too long and I'll be going under
Can you save me from this?

'Cause it's not my time
I'm not going
There's a fear in me
And it's not showing
This could be the end of me
And everything I know
Ooh, but I won't go

I look ahead to all the plans that we made
And the dreams that we had
I'm in a world that tries to take 'em away
Oh, but I'm taking 'em back

'Cause all this time I've just been too blind to understand
What should matter to me
My friend this life we live, it's not what we have
It's what we believe in

It's not my time
I'm not going
There's a fear in me
And it's not showing
This could be the end of me
And everything I know

But it's not my time
I'm not going
There's a will in me
And now I know that
This could be the end of me
And everything I know
Ooh, but I won't go
I won't go

There might be more than you believe
(There might be more than you believe)
There might be more than you can see

But it's not my time
I'm not going
There's a fear in me
And it's not showing
This could be the end of me
And everything I know

But it's not my time 
I'm not going
There's a will in me
And now it's gonna show
This could be the end of me
And everything I know, oh

There might be more than you believe
(There might be more than you believe)
There might be more than you can see

But I won't go
Oh no, I won't go down
Yeah","['acoustic rock', 'alternative rock', 'hard rock', 'pop rock', 'post-grunge', 'rock', 'southern rock']",369.9,52,2008,4.0,108.7,328,57,"{'neg': 0.018000000000000002, 'neu': 0.897, 'pos': 0.08600000000000001, 'compound': 0.9612}",It'S Not My Time,-0.7000000000000001,3 Doors Down,15,31
"It's been the longest winter without you 
I didn't know where to turn to 
See, somehow I can't forget you 
After all that we've been through 

Goin', comin' thought I heard a knock 
Who's there, no one 
Thinking that I deserve it 
Now I realize that I really didn't know 
If you didn't notice you mean everything 
Quickly I'm learning to love again 
All I know is I'm gon' be okay

Thought I couldn't live without you
It's gonna hurt when it heals too (Oh yeah)
It'll all get better in time
And even though I really love you
I'm gonna smile cause I deserve to
It'll all get better in time

I couldn't turn on the TV 
Without something there to remind me 
Was it all that easy 
To just put aside your feelings 

If I'm dreaming don't wanna let it 
Hurt my feelings but that's the path 
I believe in 
And I know time will heal it 
If you didn't notice boy you meant everything 
Quickly I'm learning to love again 
All I know is I'm gon' be okay

Thought I couldn't live without you
It's gonna hurt when it heals too (Oh yeah)
It'll all get better in time
And even though I really love you
I'm gonna smile cause I deserve to
It'll all get better in time

Since there's no more you and me (no more you and me)
It's time I let you go 
So I can be free 
And live my life how it should be 
No matter how hard it is I'll be fine without you 
Yes I will 

Thought I couldn't live without you
It's gonna hurt when it heals too (Ohh)
It'll all get better in time
And even though I really love you
I'm gonna smile cause I deserve to (Yes I do)
It'll all get better in time

Thought I couldn't live without you
It's gonna hurt when it heals too
(Yeah)
It'll all get better in time
Even though I really loved you
I'm gonna smile cause I deserve to","['british', 'contemporary r&b', 'dance-pop', 'electropop', 'english', 'pop', 'pop and chart', 'uk', 'x factor']",416.7,53,2008,4.4,99.23,343,51,"{'neg': 0.07100000000000001, 'neu': 0.726, 'pos': 0.202, 'compound': 0.9945}",Better In Time,0.9,Leona Lewis,16,23
"I close both locks below the window
I close both blinds and turn away
Sometimes solutions aren't so simple
Sometimes goodbye's the only way, o-o-oh

And the sun will set for you
The sun will set for you
And the shadow of the day
Will embrace the world in grey
And the sun will set for you

In cards and flowers on your window
Your friends all plead for you to stay
Sometimes beginnings aren't so simple
Sometimes goodbye's the only way, o-o-oh

And the sun will set for you
The sun will set for you
And the shadow of the day
Will embrace the world in grey
And the sun will set for you

And the shadow of the day
Will embrace the world in grey
And the sun will set for you

And the shadow of the day
Will embrace the world in grey
And the sun will set for you","['alternative metal', 'alternative rock', 'american', 'américain', 'hip hop', 'industrial rock', 'metal', 'new metal', 'nu metal', 'nu-metal', 'pop rock', 'rap metal', 'rap rock', 'rapcore', 'rock', 'rock and indie', 'roxette', 'united states', 'usa']",176.4,55,2008,4.4,99.23,153,24,"{'neg': 0.0, 'neu': 0.882, 'pos': 0.11800000000000001, 'compound': 0.9153}",Shadow Of The Day,0.9,Linkin Park,9,17
"Some live for the bill
Some kill for the bill, (yeah)
She whine for the bill
Grind for the bill (whoa)

And she used to be the sweetest girl
Some steal for the bill, if they got to pay the bill (yeah)
And she used to be the sweetest girl
Tonight Wyclef, Akon, Weezy on the bill (whoa)

High school she was
That girl that make me do the hula hoop around the gym
(Just to get a peek again, she's a 10)
High School she was
That girl that make me do the hula hoop around the gym
(Just to get a peek again, she's a 10)

Never thought that she would come and work for the president
Mr. George Washington (Where my money at?)
She thought, he'd call (Where my money at?)
She had a good day, bad day, sunny day, rainy day (rainy day...)
All he'd wanna know is  (Where my money at?)

Closed legs don't get fed, go out there and make my bread
All he'd wanna know is (Where my money at?)
She ended up in a roll call, bruised up, scarred heart
All he'd wanna know is (Where my money at?)
She thought, he'd call (Where my money at?)

So I'mma tell you like Wu told me
Cash rules everything around me
Singin', dollar dollar bill, y'all (dollar, dollar bill, y'all)
Singin', dollar dollar bill, y'all (dollar, dollar bill, y'all)

So I'mma tell you like Wu told me
Cash rules everything around me
Singin', dollar dollar bill, y'all (dollar, dollar bill, y'all)
Singin', dollar dollar bill, y'all (dollar, dollar bill, y'all)

Pimpin' got harder cos hoes got smarter
On the strip is something they don't wanna be a part of
Rather be up in the club shakin' for a dub
Get triple times the money and spending it like they wanna

They got they mind on the money, money on they mind
They got they finger on the trigger, hand on their nines
See every day they feel the struggle, but stand on the grind
And ain't nobody take it from us, and that's the bottom line

But I know there's a drop in the block
You move slow, you gettin' pressure from cops
You don't know, how not to lay low
'cause 25 to life's no joke

To all my real gorillas thuggin'
On top of corners every day strugglin'
All the beautiful womens gettin' money
Washin' them dollar bills like laundry

See I'mma tell you like Wu told me
Cash rules everything around me
Singin' dollar, dollar bill, y'all (dollar, dollar bill, yeah)
Singin' dollar, dollar bill, y'all (dollar, dollar bill, yeah)

See I'mma tell you like Wu told me
Cash rules everything around me
Singin' dollar, dollar bill, y'all (dollar, dollar bill, yeah)
Singin' dollar, dollar bill, y'all (dollar, dollar bill, yeah)

Money, money-money-money
Money, money-money-money
It drive the world crazy
(She used to be)

She used to be the sweetest girl
She used to be the sweetest girl ever (ever)
Ever, now she like Sour Amaretto
She wears a dress to the T like the letter
And if you make it rain she will be under the weather

She used to run track back in high school
Now she tricks on the track right by a school
She takes a loss 'cause she don't wanna see her child lose
So respect her or pay up for the time used

And then she runs to the pastor (pastor)
And he tells her there will be a new chapter (chapter)
But she feels no different after
And then she asks him... Where my money at?

See I'mma tell you like Wu told me
Cash rules everything around me
Singin' dollar, dollar bill, yeah (dollar, dollar bill, yeah)
Singin' dollar, dollar bill, yeah (dollar, dollar bill, yeah)

See I'mma tell you like Wu told me
Cash rules everything around me
Singin' dollar, dollar bill, yeah (dollar, dollar bill, yeah)
Singin' dollar, dollar bill, yeah (dollar, dollar bill, yeah)

Some live for the bill
Some kill for the bill Yeah, where my money at?
She wind for the bill
Grind for the bil woah, where my money at?
Some steal for the bill if they got to pay the bill
Yeah... (Where my money at?)
Tonight Wyclef, Akon, Weezy on the bill
Whoa... Where my money at?","['classic pop and rock', 'hip hop', 'hip hop rnb and dance hall', 'hip-hop', 'r&b']",889.2,56,2008,5.2,97.2,723,88,"{'neg': 0.066, 'neu': 0.847, 'pos': 0.08700000000000001, 'compound': 0.9511000000000001}",Sweetest Girl,1.7000000000000002,Wyclef Jean,63,43
"Yeah, yeah yeah,
Yeah, yeah yeah,
Yeah, yeah yeah yeah.

Ooh, is somethin' about,
Just somethin' about the way she move,
I can't figure it out,
It's somethin' about her

(Say) Ooh, is somethin' about,
Kinda woman that want you but don't need you,
(Hey) I can't figure it out,
It's somethin' about her.

'Cause she walk like a boss,
Talk like a boss,
Manicure nails just set the pedicure off,
She's fly effortlessly, (effortlessly)

And she move like a boss,
Do what a boss,
Do, she got me thinkin' about gettin' involved, (involved)
That's the kinda girl I need, oh.

She got her own thing,
That's why I love her,
Miss Independent,
Won't you come and spend a little time,
She got her own thing

That's why I love her,
Miss Independent,
Ooh, the way me shine,
Miss Independent, yeah.

Yeah, yeah yeah,
Yeah, yeah yeah,
Yeah, yeah yeah yeah. (ohh)

Ooh, there's somethin' about,
Kinda woman that can do for herself,
I look at her and it makes me proud,
There's somethin' about her

Somethin', ooh, so sexy about,
Kinda woman that don't even need my help,
She said she got it, she got it, (she said she got it, she got it)
No doubt, there's something about her. (there's somethin' about her)

'Cause she work like the boss,
Play like the boss,
Car and the crib she 'bout to pay 'em both off, (both off)
And bills are payed on time, yeah

She made for a boss,
Only a boss,
Anything less she tellin' them to get lost, (get lost)
That's the girl that's on my mind.

She got her own thing,
That's why I love her,
Miss Independent,
Won't you come and spend a little time

She got her own thing,
That's why I love her,
Miss Independent,
Ooh, the way Miss Shine,
Miss Independent, yeay.

(Mmhm) Her favorite thing to say,
Don't worry I got it, (mmhm)
And everything she got,
Best believe she bought it (mmhm)

She gon' steal my heart,
Ain't no doubt about it, girl,
You're everything I need,
Said you're everything I need.

Yeah, yeah yeah,
Yeah yeah,
Yeah yeah, yeah yeah yeah.

She's got her own thing, (oooohoooohhhoh)
That's why I love her, (that's why I love her, oh ohh)
Miss Independent, (independent)
Won't you come and spend a little time (ohh)

She's got her own thing, (she got, she got)
That's why I love her, (that's why I love that girl)
Miss Independent, (ohh ohh)
Ooh, the way Miss Shine,
Miss Independent.

Miss Independent,
That's why I love her.","['dance', 'hip hop', 'hip hop rnb and dance hall']",526.5,57,2008,4.0,100.24,430,72,"{'neg': 0.077, 'neu': 0.643, 'pos': 0.281, 'compound': 0.9989}",Miss Independent,0.5,Ne-Yo,27,32
"(Chorus x2)
will.i.am
Oh hot damn , this is my jam
Keep me partying till the A.M
Yall don't understand, make me throw my hands
In the ayer-ay-ayer, ayer-ay-ayer

Flo Rida
Hey this is my jam
Yall don't understand
I'll make you understand
What's pumpin in my CD player (player)
Party all night like yayer (yayer)
Shawty got her hands in the ayer (ayer)
Make me want to take it there
Then I go ""here I go yea that's my song""
DJ bring it back come in my zone
I get paid for them couple bones
The next wop until the early morn
I need that crunk when I'm up in tha club
Even my Chevy that pull up on dubs
Give me that drop yellow waist like a drug
Lil mama hot and she might show me love
Oh hot damn celebrate to tha A.M.
I love it so much it got me sayin

(Chorus x2)

Flo Rida
Hey I just might start the wave
Like I'm at a ball game do my thang
Hands up high got money in tha bank
I'm so fly 747 plane
Rock it no stop it how I got my name
Baby keep poppin you might get tha fame
Walk tha red carpet won't see you the same
I get tha stuntin forget my name
Start with me
Ride with me
Represent and vibe with me
Make me
Throw it up ma timid in tha club
Go ahead throw it up
Gotta wonder how much
To show enough to stare (stare)
I'm hood so its really unfair (unfair)
Shorty go ahead and get bare (bare)
We treat our city like the mayor (mayor)

(Chorus x2)

will.i.am
Alright now stop (oooo)
Put your hands in the ayer
It's a stick (a stick up stick up) its a stick up touch the ceilin' baby
Put your hands up
Put your hands up
Put your, put your hands (Throw my hands in the)
Put your hands up to the sky (to the sky)
Wave em, wave em round and round, side to side (side to side)
It's the party shawty going touch the roof (touch the roof)
And we got em bottoms poppin' at my proof
So throw your hands in the ayer (ayer)
Touch the ceilin' baby
Fell it, feel it baby
Throw your hands up

Oh hot damn , this is my jam
Keep me partying till the A.M
Yall don't understand , make me throw my hands
In the ayer , ay , ayer , ayer , ay , ayer
(Throw your hands up)","['a filk artist', 'dance-pop', 'electro', 'electropop', 'hip hop', 'hip hop rnb and dance hall', 'hip house', 'pop rap', 'southern hip hop']",463.5,59,2008,4.800000000000001,106.67,423,58,"{'neg': 0.054, 'neu': 0.854, 'pos': 0.092, 'compound': 0.9534}",In The Ayer,0.1,Flo Rida,30,12
"Hurry up and wait
So close, but so far away
Everything that you've always dreamed of
Close enough for you to taste
But you just can't touch

You wanna show the world, but no one knows your name yet
Wonder when and where and how you're gonna make it
You know you can if you get the chance
In your face as the door keeps slamming
Now you're feeling more and more frustrated
And you're getting all kind of impatient waiting

(Chorus)
We live and we learn to take 
One step at a time
There's no need to rush
It's like learning to fly
Or falling in love
It's gonna happen when it's
Supposed to happen that we
Find the reasons why 
One step at a time

You believe and you doubt
You're confused, and got it all figured out
Everything that you always wished for
Could be yours, should be yours, would be yours
If they only knew

You wanna show the world, but no one knows your name yet
Wonder when and where and how you're gonna make it
You know you can if you get the chance
In your face as the door keeps slamming
Now you're feeling more and more frustrated
And you're getting all kind of impatient waiting

(Chorus)
We live and we learn to take 
One step at a time
There's no need to rush
It's like learning to fly
Or falling in love
It's gonna happen when it's
Supposed to happen that we
Find the reasons why 
One step at a time

When you can't wait any longer
But there's no end in sight (when you need to find the strength)
It's the faith that makes you stronger
The only way you get there
Is one step at a time

(Chorus)
Take one step at a time
There's no need to rush
It's like learning to fly
Or falling in love
It's gonna happen when it's
Supposed to happen that we
Find the reasons why 
One step at a time

(Chorus)
One step at a time
There's no need to rush
It's like learning to fly
Or falling in love
It's gonna happen when it's
Supposed to happen that we
Find the reasons why 
One step at a time","['american idol', 'hip hop rnb and dance hall', 'pop']",469.8,61,2008,4.4,99.23,376,61,"{'neg': 0.116, 'neu': 0.766, 'pos': 0.11800000000000001, 'compound': 0.7228}",One Step at A Time,0.9,Jordin Sparks,25,41
"
That's how much I love you
That's how much I need you
And I can't stand you
Must everything you do make me wanna smile
Can I not like you for awhile? (No...)


But you wont let me
You upset me girl
And then you kiss my lips
All of a sudden I forget (that I was upset)
Can't remember what you did


But I hate it...
You know exactly what to do
So that I can't stay mad at you
For too long that's wrong


But I hate it...
You know exactly how to touch
So that I don't want to fuss and fight no more
Said I despise that I adore you


And I hate how much I love you boy (yeah...)
I can't stand how much I need you (I need you...)
And I hate how much I love you boy (oooh whoa...)
But I just can't let you go
And I hate that I love you so (oooh...)


You completely know the power that you have
the only one that makes me laugh


Said and it's not fair
How you take advantage of the fact
That I... love you beyond a reason why
And it just ain't right


And I hate how much I love you girl
I can't stand how much I need you (yeah...)
And I hate how much I love you girl
But I just can't let you go
But I hate that I love you so


One of these days maybe your magic won't affect me
And your kiss won't make me weak...
But no one in this world knows me the way you know me
So you'll probably always have a spell on me...


Yeaahhh... oohh...


That's how much I love you (how much I need you)
That's how much I need you (how much I love you)
That's how much I love you (oh, need you)
That's how much I need you

And I hate that I love you soooo...
And I hate how much I love you boy
I can't stand how much I need ya (can't stand how much I need you)
And I hate how much I love you boy
But I just can't let you go (but I just can't let you go no...)
And I hate that I love you so


And I hate that I love you so... soo.","['barbade', 'barbadian', 'barbadien', 'barbados', 'contemporary r b', 'contemporary r&b', 'dance', 'dance-pop', 'dancehall', 'electro house', 'electropop', 'hip hop', 'pop', 'pop and chart', 'pop soul', 'r&b', 'reggae', 'rehab', 'rnb']",424.8,62,2008,5.2,105.66,395,49,"{'neg': 0.157, 'neu': 0.651, 'pos': 0.192, 'compound': 0.9726}",Hate That I Love You,0.5,Rihanna,12,28
"Matthew Santos
If you are what they say you are - a superstar
Then have no fear, the camera's here
And the microphones and they wanna know
If you are that they say you are - a superstar
Then have no fear, the crowd is here
And the lights are on and they want a show

Lupe Fiasco
A fresh cool young Lu
Trying to cash his microphone check two one two
Want to believe my own hype but it's too untrue
The world brought me to my knees what have you brung you?
Did you improve on the design? Did you do something new?
Well you're name ain't on the guest list, who brung you?
You, the more famous person you come through
And the sexy lady next to you, you come too
And then it hit me standing outside of Heaven waitin' for God to come and get me
I'm too uncouth, unschool'd to the rules and too gum shoe
Too much of a newcomer and too uncool
Like Shadow and Lavelle I battle with it well
Though I need a holiday like lady who sung blue
Go back what ever you did you undo
Heavy as Heaven, the devil on my two tons too
Ha ha ha ha ha ha

Matthew Santos
If you are what they say you are - a superstar
Then have no fear, the camera's here
And the microphones and they wanna know

Lupe Fiasco
And you better wear your shades
The spotlights here can burn holes through the stage
Down through the basement past the Indian graves where the dinosaurs laid
And out through China nearly misses air liners
Magnified times five this is pointed at the rhymer
Ricochets off the moon and sets the forest ablaze
Now that's important to say 'cause even with all of that most of us don't want it to fade
We want it to braid meaning we want it to grow meaning we want it to stay
Like the governor called and he told him to wait
Un-strap him from the chair and put him back in his cage
The audience ain't fazed and they ain't gone clap and they ain't gone praise 
They want everything back that they paid 'cause they been waiting since ten to see the lights get dim
Ha ha ha ha ha ha

Matthew Santos
If you are that they say you are - a superstar
Then have no fear, the crowd is here
And the lights are on and they want a show

Lupe Fiasco
So chauffeur chauffeur come and take me away
'Cause I've been standing in this line for like five whole days
Me and security ain't getting along
And when I got to the front they told me all of the tickets were gone
So just take me home where the mood is mellow
And the roses are thrown, M&M's are yellow 
And the light bulbs around my mirror don't flicker
Everybody gets a nice autographed picture
One for you and one for your sister
Who had to work tonight but is an avid listener
Every songs a favorite song and mics don't feedback
All the reviewers say you need to go and see that
And everybody claps 'cause everybody is pleased
Then they all take the stage and start performing for me
Like ha ha ha ha ha...
Ha ha ha ha ha...ha

Matthew Santos
If you are what they say you are - a superstar
Then have no fear, the camera's here
And the microphones and they wanna know
If you are that they say you are - a superstar
Then have no fear, the crowd is here
And the lights are on and they want a show","['hip hop rnb and dance hall', 'hip-hop', 'rapper']",774.9,63,2008,5.6,87.72,617,64,"{'neg': 0.088, 'neu': 0.713, 'pos': 0.199, 'compound': 0.9971000000000001}",Superstar,3.3,Lupe Fiasco,65,23
