lyrics,tags,num_syllables,pos,year,fog_index,flesch_index,num_words,num_lines,sentiment,title,f_k_grade,artist,difficult_words,num_dupes
"Why drink the water from my hand
Contagious as you think I am?
Just tilt my sun towards your domain
Your cup runneth over again

Don't scream about, don't think aloud
Turn your head, now baby, just spit me out
Don't worry 'bout, don't speak of doubt
Turn your head, now baby, just spit me out

Why follow me to higher ground
Lost as you swear I am?
Don't throw away your basic needs
Ambiance and vanity

Don't scream about, don't think aloud
Turn your head, now baby, just spit me out
Don't worry 'bout, don't speak of doubt
Turn your head, now baby, just spit me out

December promise you gave unto me
December whispers of treachery
December clouds are now covering me
December songs no longer I sing

Don't scream about, don't think aloud
Turn your head, now baby, just spit me out
Don't worry 'bout, don't speak of doubt
Turn your head, now baby, just spit me out

December promise you gave unto me
December whispers of treachery
December promise you gave unto me
December whispers of treachery

Don't scream about, don't think aloud
Turn your head, now baby, just spit me out
Don't worry 'bout, don't speak of doubt
Turn your head, now baby, just spit me out

Don't scream about, don't think aloud
Turn your head, now baby, just spit me out
Don't worry 'bout, don't speak of doubt
Turn your head, now baby, just spit me out","['alternative rock', 'hard rock', 'post-grunge']",292.5,41,1995,4.4,99.23,243,36,"{'neg': 0.037, 'neu': 0.799, 'pos': 0.164, 'compound': 0.9823000000000001}",December,0.9,Collective Soul,16,28
"I don't want no fly guy
I just want a shy guy
Thats what I want yey
You khow what I want yey

Oh Lord have mercy mercy mercy
Di man dem in a di party party party
Di ole a dem sexy sexy sexy
Watch dem just a
Follow me follow me follow me

Everywhere me go di man dem a rush me
Yes a whole eep a pretty boy wah fi love me
A me dem love yes a me dem love

True them know me sweet and me sexy
Everywhere me go me say me ever ready
A me dem love yes a me dem love

But I don't want somebody
Who's loving everybody
I need a shy guy
He's the kinda guy who'll only be mine

Oh Lord have mercy mercy mercy
Di man dem in a di party party party
Di ole a dem sexy sexy sexy
Watch dem just a
Follow me follow me follow me
Have mercy mercy mercy
But none a dem no move me move me move me
Shy guy a weh me wanty wanty wanty
Only him can make me irie irie irie

Roughneck man me no want none a dem
Beat up me body lick off me head top
Me no want none a dat
Me no want none a dat
Big things a gwaan fi all di shy man dem
Wat to be my love and wat to be my friend
Till the very end till the very end

But I don't want somebody
Who's loving everybody
I need a shy guy he's the kinda guy
Who'll only be mine

Oh Lord have mercy mercy mercy
Di man dem in a di party party party
Di ole a dem sexy sexy sexy
Watch dem just a
Follow me follow me follow me
Have mercy mercy mercy
But none a dem no move me move me move me
Shy guy a weh me wanty wanty wanty
Only him can make me irie irie irie

Have mercy mercy mercy
mercy mercy come on

Shy man we wanna here you put ur hands in the air
And then make me I you if you wanna  none of them me no wanna see
You this one dedicated to all the shy man ohh..
You this one dedicated to all the shy man ohh..

But I don't want somebody
Who's loving everybody
I need a shy guy
He's the kinda guy who'll only be mine

Oh Lord have mercy mercy mercy
Di man dem in a di party party party
Di ole a dem sexy sexy sexy
Watch dem just a
Follow me follow me follow me
Have mercy mercy mercy
But none a dem no move me move me move me
Shy guy a weh me wanty wanty wanty
Only him can make me irie irie irie

Shy guy shy guy shy guy",['pop'],598.5,43,1995,4.800000000000001,98.21,481,68,"{'neg': 0.067, 'neu': 0.561, 'pos': 0.372, 'compound': 0.9995}",Shy Guy,1.3,Diana King,19,45
"Please baby, can't you see my mind's a burnin' hell?
I got razors a rippin'
And tearin' and strippin'
My heart apart as well

Tonight you told me that you ache for something new
And some other woman is lookin' like something
That might be good for you

Go on and hold her
'Til the screaming is gone
Go on believe her
When she tells you
""Nothing's wrong""

But I'm the only one who'll walk across the fire for you
And I'm the only one who'll drown in my desire for you
It's only fear that makes you run
The demons that you're hiding from
When all your promises are gone
I'm the only one

Please baby, can't you see I'm trying to explain
I've been here before
And I'm locking the door
And I'm not going back again

Her eyes and arms and skin won't make it go away
You'll wake up tomorrow
And wrestle the sorrow
That holds you down today

Go on and hold her
'Til the screaming is gone
Go on believe her
When she tells you
""Nothing's wrong""

But I'm the only one who'll walk across the fire for you
And I'm the only one who'll drown in my desire for you
It's only fear that makes you run
The demons that you're hiding from
When all your promises are gone
I'm the only one

Go on and hold her
'Til the screaming is gone
Go on believe her
When she tells you
""Nothing's wrong""

But I'm the only one who'll walk across the fire for you
And I'm the only one who'll drown in my desire for you
It's only fear that makes you run
The demons that you're hiding from
When all your promises are gone
I'm the only one

Yeah...
Eh...

And I'm the only one who'll drown in my desire for you
It's only fear that makes you run
The demons that you're hiding from
When all your promises are gone
I'm the only one

I'm the only one
I'm the only one
Ain't nobody else is gonna love you
Ain't nobody else is gonna love you","['blues rock', 'folk rock', 'heartland rock']",443.7,44,1995,4.4,99.23,356,54,"{'neg': 0.138, 'neu': 0.762, 'pos': 0.1, 'compound': -0.9403}",I'm The Only One,0.9,Melissa Etheridge,25,41
"You Are On My Mind, You Are On My Mind


Every Little Thing I Do You're On My Mind
The Way I Feel Lately, It's Driving Me Crazy
Every Little Thing I Do You're On My Mind
I Can't Get Over You, I Think About You All The Time

Can't You See What You Do To Me
I Think About You All The Time
My Mind Is Hazy And I'm Mixed Up Feeling Crazy Over You
Let's Not Waste Anytime



Round And Round I Go, Where I'll Stop Only You Know
I Guess It's All In My Mind
Take Your Time Think It Over Let Me Know
What You Wanna Do, Baby It's So Good



Every Little Thing I Do You're On My Mind
You're On My Mind, Hey...

",['hip hop rnb and dance hall'],152.1,45,1995,5.2,97.2,129,15,"{'neg': 0.076, 'neu': 0.887, 'pos': 0.037, 'compound': -0.6258}",Every Little Thing I Do,1.7000000000000002,Soul For Real,15,12
"(verse 1)
I would like to get to know if I could be
the kind of girl that you could be down for,
'Cause when I look at you I feel something tell me;
That you're the kind of guy that I should make a move on

And if I don't let you know, then I won't be for real
I could be wrong, but I feel like something could be going on
The more I see you the more that it becomes so true,
There ain't no other, for me there's only you

(Chorus)

I wanna be down, with what you're going through
I wanna be down, i wanna be down with you
No matter the time, of day or night it's true
I wanna be down

(verse 2)

I know anybody's gonna be lonely 
Without the reason they got someone to care for
Maybe all you need's a shoulder to cry on
If that's a fact, then I'll be more than you ever could dream of

If all you need is the time, that I got plenty of
I'll dedicate all my love, until you call me baby
I wanna stay by your side
Be there to call you up
And let you know everthing will be alright

(chorus x2 )

Yeah oh
Yeah, oh

(chorus x3)","['american', 'contemporary r&b', 'hip hop rnb and dance hall', 'pop', 'r&b', 'rnb']",245.7,49,1995,6.0,103.63,218,21,"{'neg': 0.053, 'neu': 0.803, 'pos': 0.14400000000000002, 'compound': 0.9619000000000001}",I Wanna Be Down,1.3,Brandy,13,8
"Close your eyes, make a wish
And blow out the candlelight
For tonight is just your night
We're gonna celebrate all through the night

Pour the wine, light the fire
Girl, your wish is my command
I submit to your demands
I will do anything, girl you need only ask

I'll make love to you
Like you want me to
And I'll hold you tight
Baby, all through the night

I'll make love to you
When you want me to
And I will not let go
Till you tell me to

Girl relax, let's go slow
I ain't got nowhere to go
I'm just gon' concentrate on you
Girl, are you ready? It's gon' be a long night

Throw your clothes (throw your clothes) on the floor (on the floor)
I'm gonna take my clothes off too
I've made plans to be with you
Girl, whatever you ask me, you know I can do

I'll make love to you
Like you want me to
And I'll hold you tight
Baby, all through the night

I'll make love to you
When you want me to
And I will not let go
Till you tell me to

Baby, tonight is your night
And I will do you right
Just make a wish on your night
Anything that you ask
I will give you the love of your life
Your life, your life

I'll make love to you
Like you want me to
And I'll hold you tight
Baby, all through the night

I'll make love to you (I'll make love)
When you want me to
And I will not let go
Till you tell me to

I'll make love to you (I'll make love)
Like you want me to
And I'll hold you tight (hold you tight)
Baby, all through the night

I'll make love to you (I'll make love)
When you want me to
And I will not let go
Till you tell me to","['contemporary r&b', 'new jack swing', 'pop', 'pop soul', 'smooth soul', 'soul', 'soul and reggae']",359.1,50,1995,4.0,108.7,324,55,"{'neg': 0.007, 'neu': 0.784, 'pos': 0.209, 'compound': 0.9966}",I'll Make Love To You,-0.7000000000000001,Boyz II Men,14,34
"(Ha Ha) 
Yeah. What up, this is Dr. Dre 
The party's goin' on (Ha) 
Thank God it's Friday. Now. 

Bu-Bu-Bu-Bu-Boo-ya-cachad 
Bu-Bu-Bu-Bu-Boo-ya-cachad 
Bu-Bu-Bu-Bu-Boo-ya-cachad 
Bu-Bu-Bu-Bu-Boo-ya-cachad 

Keep their heads ringin' 

Ring ding dong ring a ding ding dong 
Keep their heads ringin' 
Ring ding dong ring a ding ding dong 
Uh yeah 

Hey you, sittin' over there (say what) 
You better get up outta your chair (that's right) 
And work your body down (yeah) 
No time to funk around 'cause we goin'

Funk you right on up 
So get up, get a move on 
And get your groove on 
It's the D-R-E, the spectacula' 
In a party, I go for your neck 
So call me Dracula 
As I drain a victim's jugular vein 
And maintain to leave blood stains 
So don't complain, just chill 
Listen to the beats I spill 
Keepin' it real
Enables me to make another mill
Still brothers run up and try to kill at will 
But get popped like a pimple 
So call me Clearasil 
I wipe fools off the face of the earth 
Since birth, I've been a bad honey 
So let me tell ya what I'm worth 
More than a stealth bomba 
I cause drama, the enforcer 
Music floats like a flying saucer 
Or a 747 jet, never forget 
I'm the brother that keeps the girls' panties wet 
The mic gets smoked 
Once you hear the beat kick 
With grooves so funky, they come with a Speed Stick 
So check the flavor that I'm bringin' 
The one and only D-R-E 
And you know I keep their heads ringin' 

Ring ding dong ring a ding ding dong 
Keep their heads ringin' 
Ring ding dong ring a ding ding dong 

One, two for the crew 
Three, four for the dough 
Five for the host 
Six, seven, eight for Death Row 
Mad brothers bout to feel the full effect 
Of intellect, so I can collect respect 
Plus a check
Now I'm fend to got end to my men, too 
To take of this business I need to attend to 
'Cause my rent's due
And the rap gang's my meal ticket 
So you goddamn right, I'm a kick it 
Or get evicted
I bring terror like Stephen King 
A black Casanova runnin' brothers over like Christine 
When I rock the spot 
With the flavor I got 
I get plenty of ass, so call me an astronaut 
As I blast pass another brother's ass who thought he was strong 
But I smoke him like grass, just like Cheech and Chong 
When I flow fools, know it's time to take a hike 
'Cause I grab the mike 
And flip my tongue like a dike 
I got rhymes to keep you enchanted 
Produce smokescreen with the funky green to keep your eyes slanted 
So check the flavor that I'm bringin'
The one and only D-R-E 
And you know I keep their heads ringin' 

Ring ding dong ring a ding ding dong 
Keep their heads ringin' 
Ring ding dong ring a ding ding dong 

If you want to get on down 
You gotta get on down 
Just get on down 

Debonair with flair 
I scare wear and tear 
Without a care 
Runnin' things, as if I was a mayor 
But I ain't no politician 
No competition 
Sendin' all opposition 
To see a mortician 
I'm up front, never in the back drop 
Step on stage and get faded just like a flat top 
Your rhymes sounds like you bought 'em at stop-n-go 
Dre came to wax you, so just call me Mop-N-Glo 
Many try to, but just can't rock wit 
I'm six-one, two twenty-five of pure chocolate 
Your chances of jackin' me are slim, G 
'Cause I rock from summer 'til Santa comes down the chimney 
Ho, ho, ho, and so as I continue to flow 
'Cause, yo, I'm just a fly Negro so 
Check the flavor that I'm bringin'
The one and only D-R-E 
And I gots to keep their heads ringin' 

Ring ding dong ring a ding ding dong 
Keep their heads ringin' 
Ring ding dong ring a ding ding dong 

Ring ding dong ring a ding ding dong 
I keep their heads ringin' 
Ring ding dong ring a ding ding dong","['classic pop and rock', 'g-funk', 'gangsta rap', 'hardcore hip hop', 'hip hop', 'instrumental hip hop', 'pop rap', 'producer', 'rapper', 'west coast hip hop']",817.2,53,1995,4.4,99.23,698,103,"{'neg': 0.051000000000000004, 'neu': 0.879, 'pos': 0.07, 'compound': 0.5731}",Keep Their Heads Ringin',0.9,Dr. Dre,71,29
"Look around your world, pretty baby
Is it everything you'd hoped it'd be?
The wrong guy, the wrong situation
The right time to roll to me
Roll to me

And look into your heart, pretty baby
Is it aching with some nameless need?
Is there something wrong and you can't put your finger on it
Right then, roll to me

And I don't think I have ever seen
A soul so in despair
So if you want to talk the night through
Guess who will be there?

So don't try to deny it, pretty baby
You've been down so long you can hardly see
When the engine's stalled and it won't stop raining, it's the
Right time to roll to me
Roll to me
Roll to me

And I don't think I have ever seen
A soul so in despair
So if you want to talk the night through
Guess who will be there?

So look around your world, pretty baby
Is it everything you'd hoped it'd be?
The wrong guy, the wrong situation
The right time to roll to me
The right time to roll to me
the right time to roll to me","['british', 'classic pop and rock', 'scotland', 'scottish', 'uk']",220.5,55,1995,4.4,107.69,195,29,"{'neg': 0.12, 'neu': 0.767, 'pos': 0.113, 'compound': -0.5522}",Roll To Me,-0.30000000000000004,Del Amitri,9,14
"I wanna freak you
I wanna freak you
I wanna freak you
I wanna freak you

I wanna freak you
I wanna freak you
I wanna freak you
I wanna freak you

Every time I close my eyes, wake up feelin' so horny
I can't get you outta my mind, sexin' you be all I see
I would give anything just to make you understand me
I don't give a damn about nothing else, freek'n you is all I see

Tonight I need your body
Tonight you got my time
Tonight you won't be sorry
Tonight you got my mind

What must I say, what must I do
To show how much I think about freek'n you
What must I say, what must I do
To show how much I think about freek'n you

I could go on for days but I couldn't go on for weeks
I can even play with another body but it wouldn't last 'cause I'm a freak
By everything you say, turned on by everything you do
And at night when I close my eyes, I only dream of freek'n you

Tonight, I need your body
Tonight you got my time
Tonight you won't be sorry
Tonight you got my mind

What must I say, what must I do
To show how much I think about freek'n you
What must I say, what must I do
To show how much I think about freek'n you

Freek out and freek me up and down
DeVante swing
Freek out and freek me up and down
Freek out and freek me up and down
Freek out and freek me up and down

Every freek'n night and every freek'n day
I wanna freek you baby in every freek'n way
Every freek'n day, every freek'n night
I wanna freek you, girl, your body's so freek'n tight

Every freek'n night and every freek'n day
I wanna freek you baby in every freek'n way
Every freek'n day, every freek'n night
I wanna freek you, girl, your body's so freek'n tight

What must I say, what must I do
To show how much I think about freek'n you
What must I say, what must I do
To show how much I think about freek'n you

What must I say, what must I do
To show how much I think about freek'n you

I think about freek'n you
I wanna freek you
I wanna freek you
I wanna freek you

I think about freek'n you
I wanna freek you
I wanna freek you
I wanna freek you

I think about freek'n you
I think about freek'n you
I think about freek'n you",['hip hop rnb and dance hall'],486.9,57,1995,4.800000000000001,106.67,438,61,"{'neg': 0.049, 'neu': 0.926, 'pos': 0.025, 'compound': -0.8306}",Freek'n You,0.1,Jodeci,14,52
"Hey, this is radio station W-S-K-E-E
We're takin' calls on the wish line
Making all your wacky wishes come true

Hello

I wish I was little bit taller, I wish I was a baller,
I wish I had a girl who looked good I would call her
I wish I had a rabbit in a hat with a bat
And a 64' Impala

I wish I was like six-foot-nine 
So I can get with Leoshi, cause she don't know me, but yo she's really fine
You know I see her all the time
Everywhere I go and even in my dreams I can scheme a way to make her mine
Cause I know she's livin phat
Her boyfriend's tall and he plays ball, so how am I gonna compete with that
'Cause when it comes to playing basketball
I'm always last to be picked and in some cases never picked at all
So I just lean up on the wall
Or sit up in the bleachers with the rest of the girls who came to watch their men ball
Dag y'all! I never understood, black
Why the jocks get the fly girls and me I get the hood rats
I tell 'em scat, skittle, scabobble
Got hit with a bottle and I been in the hospital for talkin' that mess
I confess it's a shame 
When you livin' in a city that's the size of a box and nobody knows yo' name
Glad I came to my senses 
Like quick-quick got sick-sick to my stomach overcommeth 
By the thoughts of me and her together, right? 
So when I asked her out she said I wasn't her type

I wish I was little bit taller, I wish I was a baller,
I wish I had a girl who looked good I would call her
I wish I had a rabbit in a hat with a bat
And a 64' Impala

I wish I was little bit taller, I wish I was a baller,
I wish I had a girl who looked good I would call her
I wish I had a rabbit in a hat with a bat
And a 64' Impala

I wish I had a brand-new car, so far I got this hatchback 
And everywhere I go, yo I gets laughed at
And when I'm in my car, I'm laid back
I got an 8-track and a spare tire in the backseat, but that's flat
And do you really wanna know what's really whack
See I can't even get a date, so what do you think of that?
I heard that prom night is a bomb night with the hood rats you can hold tight, but really tho' 
I 'm a figaro when I'm in my car I can't even get a hello
Well so many people wanna cruise Crenshaw on Sunday
Well then I'ma have to get in my car and go
You know I take the 110 until the 105
Get off at Crenshaw tell my homies look alive
Cause it's hard to survive 
When your livin' in a concrete jungle and These girls just keep passin' me by
She looks fly, she looks fly
Makes me say my, my, my

I wish I was little bit taller, I wish I was a baller,
I wish I had a girl who looked good I would call her
I wish I had a rabbit in a hat with a bat
And a 64' Impala

I wish I was little bit taller, I wish I was a baller,
I wish I had a girl who looked good I would call her
I wish I had a rabbit in a hat with a bat
And a 64' Impala

I wish I was little bit taller
I wish I was little bit taller, 
I wish I was a baller,
I wish I was a baller,
I wish I was little bit taller,  y'all
I wish I was little bit taller,  y'all
I wish I was a baller,
I wish I was a baller,
I wish I was little bit taller,  y'all
I wish I was little bit taller,  y'all
I wish I was a baller,
I wish I was a baller,
I wish I was little bit taller,  y'all
I wish I was little bit taller,  y'all
I wish I was a baller, yeah

Hey, I wish I had my way 'cause everyday would be a Friday
You could even speed on the highway
I would play ghetto games, name my kids ghetto names
Little Mookie, Big Al, Lorraine
Yo you know that's on the real
So if you're down on your luck then you should notice how I feel
Cause if you don't want me around
See I go simple, I go easy, I go greyhound
Hey, you, what's that sound?
Everybody look what's going down
Ahhhh, yes, ain't that fresh?
Everybody wants to get down like dat

I wish I was little bit taller, I wish I was a baller,
I wish I had a girl who looked good I would call her
I wish I had a rabbit in a hat with a bat
And a 64' Impala

I wish I was little bit taller, I wish I was a baller,
I wish I had a girl who looked good I would call her
I wish I had a rabbit in a hat with a bat
And a 64' Impala

I wish
I wish
I wish
I wish
I wish
I wish
I wish
I wish
I wish
I wish
I wish
I wish",['rock and indie'],1026.9,58,1995,5.6,104.64,926,94,"{'neg': 0.016, 'neu': 0.681, 'pos': 0.303, 'compound': 0.9998}",I Wish,0.9,Skee-lo,65,57
"I believe in love, it's all we got
Love has no boundaries, costs nothing to touch
War makes money, cancer sleeps
Curled up in my father and that means something to me
Churches and dictators, politics and papers
Everything crumbles sooner or later
But love, I believe in love

I believe in love, it's all we got
Love has no boundaries, no borders to cross
Love is simple, hate breeds
Those who think difference is the child of disease
Father and son make love and guns
Families together kill someone
Without love, I believe in love

Without love I wouldn't believe
In anything that lives and breathes
Without love I'd have no anger
I wouldn't believe in the right to stand here
Without love I wouldn't believe
I couldn't believe in you
And I wouldn't believe in me
Without love

I believe in love
I believe in love
I believe in love","['adult contemporary', 'british', 'classic pop and rock', 'elton-john', 'english', 'glam rock', 'piano rock', 'pop', 'pop rock', 'pop/rock', 'rock', 'singer/songwriter', 'uk']",220.5,59,1995,4.4,73.85,152,24,"{'neg': 0.11800000000000001, 'neu': 0.533, 'pos': 0.34900000000000003, 'compound': 0.9952000000000001}",Believe,4.5,Elton John,23,6
"Well I've walked these streets
A virtual stage it seemed to me
Makeup on their faces
Actors took their places next to me

Well I've walked these streets
In a carnival of sights to see
All the cheap thrill seekers
The vendors and the dealers they crowded around me

Have I been blind
Have I been lost inside myself and my own mind
Hypnotized mesmerized by what my eyes have seen

Well I've walked these streets
In a spectacle of wealth and poverty
In the diamond market
The scarlet welcome carpet that they just rolled out for me

And I've walked these streets
In the madhouse asylum they can be
Where a wild eyed misfit prophet on a traffic island stopped
And he raved of saving me

Have I been blind
Have I been lost inside myself and my own mind
Hypnotized mesmerized by what my eyes have seen

Have I been wrong
Have I been wise to shut my eyes and play along
Hypnotized paralyzed by what my eyes have found
By what my eyes have seen
What they have seen

Have I been blind
Have I been lost have I been wrong
Have I been wise have I been strong
Have I been hypnotized mesmerized
By what my eyes have found

In that great street carnival
In that carnival",['folk'],292.5,60,1995,4.4,90.77,221,34,"{'neg': 0.109, 'neu': 0.753, 'pos': 0.138, 'compound': 0.7906000000000001}",Carnival,2.1,Natalie Merchant,31,13
"Let me run with you tonight
I'll take you on a moonlight ride
There's someone I used to see
But she don't give a damn for me

But let me get to the point
Let's roll another joint
And turn the radio loud
I'm too alone to be proud

You don't know how it feels
You don't know how it feels
To be me

People come, people go
Some grow young, some grow cold
I woke up in between
A memory and a dream

So let's get to the point
Let's roll another joint
And let's head on down the road
There's somewhere I gotta go

You don't know how it feels
You don't know how it feels
To be me

My old man was born to rock
He's still trying to beat the clock
Think of me what you will
I've got a little space to fill

So let's get to the point
Let's roll another joint
And let's head on down the road
There's somewhere I gotta go

And you don't know how it feels
You don't know how it feels
No, you don't know how it feels
To be me

You don't know how it feels
You don't know how it feels
No, you don't know how it feels
To be me","['classic pop and rock', 'heartland rock', 'pop rock', 'rock', 'singer/songwriter', 'southern rock']",228.6,61,1995,4.0,108.7,215,38,"{'neg': 0.03, 'neu': 0.936, 'pos': 0.034, 'compound': 0.2401}",You Don't Know How It Feels,-0.7000000000000001,Tom Petty,6,23
