lyrics,tags,num_syllables,pos,year,fog_index,flesch_index,num_words,num_lines,sentiment,title,f_k_grade,artist,difficult_words,num_dupes
"(I can't stop loving you)
I've made up my mind
To live in memories
Of the lonesome times

(I can't stop wanting you)
It's useless to say
So I'll just live my life
In dreams of yesterdays (dreams of yesterdays)

Those happy hours
That we once knew
Though long ago
They still make me blue

They say that time
Heals a broken heart
But time has stood still
Since we've been apart

(I can't stop loving you)
I've made up my mind
To live in memories
All the lonesome time

(I can't stop wanting you)
It's useless to say
So I'll just live my live
In dreams of yesterdays

(Those happy hours) Those happy hours
(That we once knew) That we once knew
(Though long ago) Though long ago
(Still make me blue) Still make me blue

(They say that time) They say that time
(Heals a broken heart) Heals a broken heart
(But time has stood still) Time has stood still
(Since we've been apart) Since we've been apart

(I can't stop loving you)
I said I've made up my mind
To live in memories
All the lonesome time
Sing the song, children

(I can't stop wanting you)
It's useless to say
So I'll just live my life
Of dreams of yesterdays (of yesterdays)","['american', 'blues', 'classic pop and rock', 'country', 'country blues', 'country soul', 'death by lung cancer', 'gospel', 'jazz', 'live in concert', 'piano blues', 'pop', 'rhythm & blues', 'rnb', 'soul', 'soul blues', 'soul jazz', 'the way i feel', 'vocal jazz']",273.6,2,1962,4.0,91.78,215,41,"{'neg': 0.137, 'neu': 0.742, 'pos': 0.121, 'compound': -0.7278}",I Can't Stop Loving You,1.7000000000000002,Ray Charles,14,19
"(Roses are red, my love)
(Doo doo da doo)

A long, long time ago 
On graduation day 
You handed me your book 
I signed this way: 

""Roses are red, my love.
Violets are blue.
Sugar is sweet, my love.
But not as sweet as you.""

We dated through high school
And when the big day came
I wrote into your book
Next to my name:

""Roses are red, my love.
Violets are blue.
Sugar is sweet, my love.
But not as sweet as you."" (as sweet as you)

Then I went far away
And you found someone new
I read your letter, dear
And I wrote back to you:

""Roses are red, my love.
Violets are blue.
Sugar is sweet, my love.
But luck may God bless you."" (may God bless you)

Is that your little girl? 
She looks a lot like you
Someday some boy will write
In her book, too:

""Roses are red, my love.
Violets are blue.
Sugar is sweet, my love.
But not as sweet as you.""
(Roses are red)",['classic pop and rock'],206.1,4,1962,3.6,101.26,174,37,"{'neg': 0.0, 'neu': 0.784, 'pos': 0.216, 'compound': 0.9898}",Roses Are Red,0.1,Bobby Vinton,11,17
"Come on baby
Let's do the twist
Come on baby
Let's do the twist
Take me by my little hand
And go like this

Ee-yah twist
Baby, baby twist
Ooh yeah, just like this
Come on little miss and do the twist

My daddy is sleepin'
And mama ain't around
Yeah, daddy just sleepin'
And mama ain't around
We're gonna twisty twisty twisty
Till we tear the house down

Come on and twist
Yeah, baby twist
Oooh yeah, just like this
Come on miss and do the twist
Ee-yah

('Round and 'round and 'round and 'round)
('Round and 'round and 'round and 'round)

Yeah, you should see my little sis
You should see my my litlle Sis
She really knows how to rock
She knows how to twist

Come on and twist
Yeah, baby twist
Oooh yeah, just like this
Come on little miss and do the twist

('Round and 'round and 'round and 'round)
('Round and 'round and 'round and 'round)

Yeah, rock on now
Yeah, twist on down
Twist
('Round and 'round and 'round)","['rhythm & blues', 'rock & roll']",192.6,9,1962,4.0,108.7,176,34,"{'neg': 0.079, 'neu': 0.8210000000000001, 'pos': 0.101, 'compound': 0.8052}",The Twist,-0.7000000000000001,Chubby Checker,9,17
"Soldier boy
Oh my little soldier boy
I'll be true to you

You were my first love
And you'll be my last love
I will never make you blue
I'll be true to you

In the whole world
You can love but one girl
Let me be the one girl
For I'll be true to you

Wherever you go
My heart will follow
I love you so
I'll be true to you

Take my love with you
To any port or foreign shore
Darling you must feel for sure
And I'll be true to you

Soldier boy
Oh my little soldier boy
I'll be true to you","['pop', 'rnb', 'soul']",119.7,10,1962,4.0,108.7,107,20,"{'neg': 0.0, 'neu': 0.666, 'pos': 0.334, 'compound': 0.9932000000000001}",Soldier Boy,-0.7000000000000001,Shirelles,5,9
"Duke, Duke, Duke, Duke of Earl
Duke, Duke, Duke of Earl
Duke, Duke, Duke of Earl
Duke, Duke, Duke of Earl
Duke, Duke, Duke of Earl
Duke, Duke, Duke of Earl
Duke, Duke, Duke of Earl

As I walk through this world
Nothing can stop the Duke of Earl
And you, you are my girl
And no one can hurt you, oh, no

Yes, I
Oh, I'm gonna love you
Oh, oh
Come on, let me hold you, darlin'
'Cause I'm the Duke of Earl
So, yeah, yeah, yeah, yeah

And when I hold you
You'll be my Duchess, Duchess of Earl
We'll walk through my dukedom
And a paradise we will share

Yes, I 
Oh, I'm gonna love you
Oh, oh
Nothing can stop me now
'Cause I'm the Duke of Earl
So, yeah, yeah, yeah, yeah

Ooh ooh ooh ooh ooh
Ooh ooh ooh ooh ooh
Oh, oh, oh, oh
Ooh ooh ooh ooh ooh
Ooh ooh ooh ooh ooh
Oh, oh, oh

Well, I
Oh, I'm gonna love you
Oh, oh
Nothing can stop me now
'Cause I'm the Duke of Earl
So, yeah, yeah, yeah, yeah

Ooh ooh ooh ooh ooh
Ooh ooh ooh ooh ooh
So, oh, oh, oh, oh
Ooh ooh ooh ooh ooh",['classic pop and rock'],234.0,13,1962,4.0,108.7,210,37,"{'neg': 0.057, 'neu': 0.718, 'pos': 0.225, 'compound': 0.9906}",Duke Of Earl,-0.7000000000000001,Gene Chandler,7,26
"Do do do
Down dooby doo down down
Comma, comma, down dooby doo down down
Comma, comma, down dooby doo down down
Breaking up is hard to do

Don't take your love away from me
Don't you leave my heart in misery
If you go then I'll be blue
Cause breaking up is hard to do

Remember when you held me tight
And you kissed me all through the night
Think of all that we've been through
And breaking up is hard to do

They say that breaking up is hard to do
Now I know
I know that it's true
Don't say that this is the end
Instead of breaking up I wish that we were making up again

I beg of you don't say goodbye
Can't we give our love another try?
Come on, baby, let's start anew
Cause breaking up is hard to do

(They say that breaking up is hard to do)
Now I know
I know that it's true
(Don't say that this is the end)
Instead of breaking up I wish that we were making up again

I beg of you don't say goodbye
Can't we give our love another try?
Come on, baby, let's start anew
Cause breaking up is hard to do

(Down dooby doo down down)
Comma, comma, down dooby doo down down
Comma, comma, down dooby doo down down
Comma, comma, down dooby doo down down
Comma, comma, down dooby doo down",['classic pop and rock'],277.2,15,1962,4.4,107.69,242,36,"{'neg': 0.094, 'neu': 0.849, 'pos': 0.058, 'compound': -0.7364}",Breaking Up Is Hard To Do,-0.30000000000000004,Neil Sedaka,12,18
"Baby baby baby baby take it easy
Let's do it right 
Ar baby take it easy
Don't cha know we got all night 
Cause there's no no twistin'
Like a slow slow twistin' with you

Yeah a little crazy motion
Is all you need 
Ar twist a slow devotion
You don't need speed 
Cause there's no no twistin'
Like a slow slow twistin' with you

Ar come on come on
And please me baby 
Come on and tease me baby 
Come on and drive me crazy 
Come on and let's a twist it baby 
Cause there's no no twistin'
Like a slow slow twistin' with you

Ar ya gonna last longer, longer
Just a take your time 
Ar you're gonna feel stronger
And I feel so fine 
Cause there's no no twistin'
Like a slow slow twistin' with you

Ar come on, come on yeah
Ar come on, come on and please me baby 
Come on and tease me baby 
Come on and drive me crazy 
A twist it a take it easy baby
Cause there's no no twistin'
Like a slow slow twistin' with you

Ar ya gonna last longer, longer
Just a take your time 
Ar ya gonna feel stronger, a longer
And I feel so fine Yeah Yeah
Cause there's no no twistin'
Like a slow slow twistin' with you
Ar with you ar with you
Ar come on Ar come on","['rhythm & blues', 'rock & roll']",293.4,17,1962,4.0,100.24,235,40,"{'neg': 0.139, 'neu': 0.676, 'pos': 0.186, 'compound': 0.9289000000000001}",Slow Twistin',0.5,Chubby Checker,14,18
"I cry myself to sleep each night
Wishing I could hold you tight
Life seems so empty since you went away
The pillow where you lay your head
Now holds my lonely tears instead
And it keeps right on a-hurtin'
Since you're gone

It keeps right on a-hurtin every minute of the day
Every hour you're away I feel so lonely
And I can't help it, I don't think I can go on
And it keeps right on a-hurtin' since you're gone

They say a man should never cry
But when I see you passing by
My heart breaks down and cries a million tears
You broke my heart and set me free 
But you forgot your memory
And keeps right on a-hurtin' since your gone

It keeps right on a-hurtin every minute of the day
Every hour you're away I feel so lonely
And I can't help it, I don't think I can go on
And it keeps right on a-hurtin' since you're gone",['classic pop and rock'],202.5,18,1962,4.800000000000001,98.21,165,21,"{'neg': 0.17300000000000001, 'neu': 0.797, 'pos': 0.03, 'compound': -0.9669000000000001}",It Keeps Right On a-Hurtin',1.3,Johnny Tillotson,10,6
"Some other girls are filling your head with jive
So, now you're acting like you don't know I'm alive

Love, you better wake up
Yeah, before we break up
And you lose me, little me
The one who really loves you

Suzie, only wants you until the day
(Only wants you until the day)
That she'll again have her true love
Who's far, far, away
(Her true love who's far away)

(Wake up)
So, love you better wake up
Yeah, before we break up
And you lose me, little me
The one who really loves you
(I really love you, yeah-yeah-yeah)

Ginny only wants you,
'Cause she thinks she has to have everyone
Minnie, only wants you
'Cause she thinks that hurting me would be fun
Oh, oh, oh

Silly Lilly, you know she doesn't really
Want you with a love that's true
In fact, there's no other girl
In this whole wide world
Who can love you like I do

They get tired of you
Then they're gonna put ya down
(Put you down, put you down)
They ain't gonna want you hangin' around
(Hangin' around, hangin' around)

(Wake up)
So, love you better wake up
Yeah, before we break up
And you lose me, little me
The one who really loves you
(I really love you, yeah-yeah-yeah)

I-I-I do (yeah-yeah)
Really, really, love you
(I really love you, yeah-yeah-yeah)
Oh-oh, oh-oh, oh-oh, ooh-ooh (yeah-yeah)","['death by laryngeal cancer', 'death by pneumonia', 'rock and indie']",306.9,19,1962,4.0,91.78,236,40,"{'neg': 0.067, 'neu': 0.639, 'pos': 0.294, 'compound': 0.9973000000000001}",The One Who Really Loves You,1.7000000000000002,Mary Wells,28,17
"Don't want a four leaf clover
Don't want an old horse shoe
Want your kiss 'cause I just can't miss
With a good luck charm like you

Come on and be my little good luck charm
Uh-huh huh, you sweet delight
I want a good luck charm
a-hanging on my arm
To have, to have, to hold, to hold tonight

Don't want a silver dollar
Rabbit's foot on a string
The happiness in your warm caress
No rabbit's foot can bring

Come on and be my little good luck charm
Uh-huh huh, you sweet delight
I want a good luck charm
a-hanging on my arm
To have, to have, to hold, to hold tonight

If I found a lucky penny
I'd toss it across the bay
Your love is worth all the gold on earth
No wonder that I say

Come on and be my little good luck charm
Uh-huh huh, you sweet delight
I want a good luck charm
a-hanging on my arm
To have, to have, to hold, to hold tonight","['american', 'blue-eyed soul', 'blues', 'christmas music', 'classic pop and rock', 'country', 'flaming', 'gospel', 'if you talk in your sleep', 'love', 'oldies', 'party', 'pop', 'pop rock', 'pop/rock', 'rock', 'rock & roll', 'rock and roll', 'rockabilly', 'singer']",194.4,20,1962,4.4,107.69,173,27,"{'neg': 0.126, 'neu': 0.507, 'pos': 0.366, 'compound': 0.9955}",Good Luck Charm,-0.30000000000000004,Elvis Presley,10,14
"Sweet little Sheila, you'll know her if you see her
Blue eyes and a ponytail
Her cheeks are rosy, she looks a little nosey
Man, this little girl is fine

Never knew a girl like-a little Sheila
Her name drives me insane
Sweet little girl, that's my little Sheila
Man, this little girl is fine

Me and Sheila go for a ride
Oh-oh-oh-oh, I feel all funny inside
Then little Sheila whispers in my ear
Oh-oh-oh-oh, I love you Sheila dear

Sheila said she loved me, she said she'd never leave me
True love will never die
We're so doggone happy just bein' around together
Man, this little girl is fine

Never knew a girl like-a little Sheila
Her name drives me insane
Sweet little girl, that's my little Sheila
Man, this little girl is fine

Me and Sheila go for a ride
Oh-oh-oh-oh, I feel all funny inside
Then little Sheila whispers in my ear
Oh-oh-oh-oh, I love you Sheila dear

Sheila said she loved me, she said she'd never leave me
True love will never die
We're so doggone happy just bein' around together
Man, this little girl is fine

Oh, this little girl is fine
Yeah, this little girl is fine
Oh, this little girl is fine","['bubblegum pop', 'pop', 'rock and roll']",281.7,22,1962,4.4,90.77,210,31,"{'neg': 0.046, 'neu': 0.657, 'pos': 0.298, 'compound': 0.9956}",Sheila,2.1,Tommy Roe,16,21
"Let me tell you 'bout a place
Somewhere up-a New York way
Where the people are so gay
Twistin' the night away
Here they have a lot of fun
Puttin' trouble on the run
Man, you find the old and young
Twistin' the night away

They're twistin', twistin'
Everybody's feelin' great
They're twistin', twistin'
They're twistin' the night away

Here's a man in evening clothes
How he got here, I don't know, but
Man, you oughta see him go
Twistin' the night away
He's dancin' with a chick in slacks
She's movin' up and back
Oh, man, there ain't nothin' like
Twistin' the night away

They're twistin', twistin'
Everybody's feelin' great
They're twistin', twistin'
They're twistin' the night

Let's twist a while
Lean up
Lean back
Lean up
Lean back
Watusi
Now fly
Now twist
They're twistin' the night away

Here's a fella in blue jeans
Dancin' with an older queen
Who's dolled up in her diamond rings and
Twistin' the night away
Man, you oughta see her go
Twistin' to the rock and roll
Here you find the young and old
Twistin' the night away

They're twistin', twistin', man
Everybody's feelin' great
They're twistin', twistin'
They're twistin' the night

One more time
Lean up
Lean back
Lean up
Lean back
Watusi
Now fly
Now twist","['death by gun', 'gospel', 'pop soul', 'rhythm & blues', 'soul', 'soul and reggae', 'southern soul', 'traditional pop', 'vocal']",279.9,23,1962,4.0,91.78,216,39,"{'neg': 0.02, 'neu': 0.895, 'pos': 0.085, 'compound': 0.9484}",Twistin' The Night Away,1.7000000000000002,Sam Cooke,22,28
"Break it to me gently
Let me down the easy way
Make me feel that you still love me
If it's just, if it's just for one more day

Break it to me gently
So my tears, my tears won't fall too fast
If you must go, then go slowly
Let me love you 'til the last

The love we shared, for oh so long
Is such a big part of me
If you must take your love away
Take it gradually

Oh, oh, break it, break it to me gently
Give me time, oh give me a little time to ease the pain
Love me just a little longer
'Cause I'll never never love again
'Cause I'll never love again","['american', 'classic pop and rock', 'country', 'pop', 'rock']",141.3,26,1962,4.800000000000001,98.21,121,17,"{'neg': 0.049, 'neu': 0.656, 'pos': 0.295, 'compound': 0.9908}",Break It To Me Gently,1.3,Brenda Lee,7,3
"Ramblin' rose, ramblin' rose
Why you ramble, no one knows
Wild and wind-blown, that's how you've grown
Who can cling to a ramblin' rose?

Ramble on, ramble on
When your ramblin' days are gone
Who will love you with a love true
When your ramblin' days are GONE

Ramblin' rose, ramblin' rose
Why I want you, heaven knows
Though I love you with a love true
Who can cling to a ramblin' rose?

SPOKEN
""One more time, everybody, now""

Ramblin' rose, ramblin' rose
Why I want you, heaven knows
Though I love you with a love true
Who can cling to a ramblin' rose?","['american', 'death by lung cancer', 'easy listening soundtracks and musicals', 'jazz', 'jump blues', 'pop', 'swing', 'usa', 'vocal jazz']",134.1,28,1962,4.4,90.77,104,17,"{'neg': 0.018000000000000002, 'neu': 0.637, 'pos': 0.34500000000000003, 'compound': 0.9913000000000001}",Ramblin' Rose,2.1,Nat King Cole,8,9
"And when I told her 
I didn't love her anymore 
She cried (she cried) 
And when I told her 
Her kisses were not like before 
She cried (she cried) 
I thought that our romance was over and done 
But to her it had just begun 

And when I told her 
Another girl had caught my eye 
She cried (she cried) 
And when I kissed her 
A kiss that only meant goodbye 
She cried (she cried) 

(sha-la-la-la sha-la-la) 

And when I told her 
I didn't love her anymore 
She cried (she cried)","['blue-eyed soul', 'rock']",107.1,30,1962,4.0,100.24,91,17,"{'neg': 0.21, 'neu': 0.672, 'pos': 0.11800000000000001, 'compound': -0.8199000000000001}",She Cried,0.5,Jay and The Americans,7,9
"(Don't break the heart that loves you so)

Don't break the heart that loves you
Handle it with care
Don't break the heart that needs you
Darling, please be fair

Why do you flirt and constantly hurt me?
Why do you treat our love so carelessly?

You know I'm jealous of you
And yet you seem to try
To go out of your way
To be unkind

Sweetheart, I'm begging of you
Don't break this heart that loves you
Don't break this heart of mine

Darling, please don't hurt me
Please, don't make me cry
I don't know what I'd do if you'd ever say goodbye
Remember, I love you so much
And love is life's greatest joy
Please don't break my heart like a child breaks a little toy

Sweetheart, I'm begging of you
Don't break this heart that loves you
Don't break this heart of mine","['american', 'pop']",165.6,31,1962,4.4,107.69,148,23,"{'neg': 0.08, 'neu': 0.578, 'pos': 0.342, 'compound': 0.9952000000000001}",Don't Break The Heart That Loves You,-0.30000000000000004,Connie Francis,12,8
"Get up from your chair
Get up from your chair...

Darling, may I have
The pleasure of having
This next twist with you
I dont know how to twist
You dont know how to twist
No, well, let me tell you

Well now, there's a new dance
That's known as the twist
It's really not new
It's something you've missed

But there's a new dance
That's known as the twist
It's really not new
It's something you've missed

Dear lady
(Get up from your chair)
Dear, dear lady
(Get up from your chair)

Well, now, doctors agree

So I've been told
Do the twist and
You'll never grow old

Well, one night I happened
On a go-go dance
Believing I'd find
Me some romance

And this old lady
I happened to see
I said, come on, baby
Do the twist with me

Dear lady
(Get up from your chair)
Oh, dear lady
(Get up from your chair)

Well, now, doctors agree
So I've been told
Do the twist and
You'll never grow old

Get up and do the twist now
Yeah, oh, yeah

Well, I said, I'd love to
Dance from now until dawn
She said, thank you, baby
But I'm almost gone

I said, now the rhythm
Is getting real sweet
This is no time to
Slow up your feet

Dear lady
(Get up from your chair)
Dear, dear lady
(Get up from your chair)

Well, now, doctors agree
So I've been told
Do the twist and
You'll never grow old

You gotta do the twist
You gotta do the twist",['classic pop and rock'],291.6,32,1962,3.6,109.72,262,57,"{'neg': 0.029, 'neu': 0.742, 'pos': 0.228, 'compound': 0.9947}",Dear Lady Twist,-1.0,Gary U.S. Bonds,13,35
"Well, shake it up baby now
Twist and shout
Come on, come on, come, come on baby now
Come on and work it on out
Well work it on out, honey
You know you look so good
You know you got me goin' now
Just like I know you would

Well, shake it up baby now
Twist and shout
Come on, come on, come, come on baby now
Come on and work it on out
You know you twist, little girl
You know you twist so fine
Come on and twist a little closer now
And let me know that you're mine, woo

Ah, ah, ah, ah
Yeah, shake it up baby now
Twist and shout
Come on, come on, come, come on baby now
Come on and work it on out
You know you twist, little girl
You know you twist so fine
Come on and twist a little closer now
And let me know that you're mine
Well shake it, shake it, shake it, baby now
Well shake it, shake it, shake it, baby now
Well shake it, shake it, shake it, baby now
Ah, ah, ah, ah","['american', 'contemporary r&b', 'doo wop', 'funk', 'rhythm & blues', 'rnb', 'rock', 'rock & roll', 'smooth soul', 'soul', 'soul and reggae']",217.8,38,1962,4.4,107.69,190,29,"{'neg': 0.096, 'neu': 0.768, 'pos': 0.136, 'compound': 0.9095000000000001}",Twist And Shout,-0.30000000000000004,Isley Brothers,3,14
"Sha la la la la la la la-a
Sha la la la la la la la-a
Sha la la la la la la la-a

Sha la la la la
It's not the way you smile
That touched my heart –
(Sha la la la la)
It's not the way you kiss
That tears me apart!
Uh, oh, oh, many, many, many nights go by
I sit alone at home and I cry over you –
What can I do?
I can't help myself, 'cause baby, it's you –
Baby, it's you!
(Sha la la la la)
You should hear, what they say about you
(Cheat cheat)
(Sha la la la la)
They say, they say
You never never, never, ever been true!
Uh oh

It doesn't matter what they say
I know I'm gonna love you any old way!
What can I do, and it's true
Don't want nobody, nobody –
But, baby, it's you!
(Sha la la la la la la)
Baby, it's you!
(Sha la la la la la la)

Uh, oh, oh, many, many, nights go by
I sit alone at home and I cry over you –
What can I do?
Can't help myself, 'cause baby, it's you –
Baby, it's you!
Don't leave me all alone –
Come on home!","['pop', 'rnb', 'soul']",225.9,44,1962,4.4,107.69,215,34,"{'neg': 0.099, 'neu': 0.842, 'pos': 0.059000000000000004, 'compound': -0.7177}",Baby It's You,-0.30000000000000004,Shirelles,10,11
"It was a moonlit night in Old Mexico.
I walked alone between some old adobe haciendas.
Suddenly, I heard the plaintive cry of a young Mexican girl:

La la la, la la la la la la la la, la la la la la la la la, la la la la
la la la la.

You better come home Speedy Gonzales, away from tannery row.
Stop all of your drinking with that floosie named Flo!
Come on home to your adobe and slap some mud on the wall!
The roof is leaking like a strainer. There's loads of roaches in the
hall.
(La la la la)

Speedy Gonzales (Speedy Gonzales),
why don't you come home?
Speedy Gonzales (Speedy Gonzales),
how come you leave me all alone?

""He, Rosita, I have to go shopping downtown for my mother,
she needs some Tortillias and Chilli Pepper!""

La, la la la la la la la la, la la la la la la la la, la la la la la la
la la.

Your doggie's gonna have a puppy, and we're running out of Coke.
no enchiladas in the icebox, and the television's broke.
I saw some lipstick on your sweatshirt, I smell some perfume in your
ear.
Well, if you're gonna keep on messin', don't bring your business back
a-here.
(La la la la)

Mmm, Speedy Gonzales (Speedy Gonzales),
why don't you come home?
Speedy Gonzales (Speedy Gonzales),
how come you leave me all alone?

""He, Rosita, come quick!
Down at the cantina, they're giving green stamps with Tequila!""

La, la la la la la la la la, la la la la la la la la, la la la la la la
la la
La la la la, la la la la la la la la, la la la la la la la la, la la la
la la la la la.","['country', 'gospel', 'pop']",388.8,45,1962,5.6,87.72,308,32,"{'neg': 0.05, 'neu': 0.913, 'pos': 0.037, 'compound': -0.5152}",Speedy Gonzales,3.3,Pat Boone,38,14
"A little bitty tear let me down, spoiled my act as a clown
I had it made up not make a frown, but a little bitty tear let me down.

You said you were leaving tomorrow
That today was our last day
I said there'd be no sorrow, that I'd laugh when you walked away.

A little bitty tear let me down, spoiled my act as a clown
I had it made up not make a frown, but a little bitty tear let me down.

I said I'd laugh when you left me
Pull a funny as you went out the door
That I'd have another waiting
And I'd wave goodbye as you go.

A little bitty tear let me down, spoiled my act as a clown
I had it made up not make a frown, but a little bitty tear let me down.

Everything went like a planned it
And really put on quite a show
In my heart I felt I could stand it
Till you walked with your *grip* through the door.
A little bitty tear let me down, spoiled my act as a clown
I had it made up not make a frown, but a little bitty tear let me down.

A little bitty tear let me down.","['american', 'classic pop and rock']",239.4,46,1962,6.0,103.63,212,20,"{'neg': 0.037, 'neu': 0.88, 'pos': 0.084, 'compound': 0.8885000000000001}",A Little Bitty Tear,1.3,Burl Ives,10,11
"I'll never let you see 
The way my broken heart is hurtin' me 
I've got my pride and I know how to hide 
All my sorrow and pain 
I'll do my cryin' in the rain 

If I wait for cloudy skies 
You won't know the rain from the tears in my eyes 
You'll never know that I still love you so 
Though the heartaches remain 
I'll do my cryin' in the rain 

Rain drops fallin' from heaven 
Could never wash away my misery 
But since we're not together 
I look for stormy weather 
To hide these tears I hope you'll never see 

Some day when my cryin's done 
I'm gonna wear a smile and walk in the sun 
I may be a fool but till then darling you'll 
Never see me complain 
I'll do my cryin' in the rain 

I'll do my cryin' in the rain 
I'll do my cryin' in the rain",['classic pop and rock'],170.1,47,1962,4.4,107.69,153,22,"{'neg': 0.11900000000000001, 'neu': 0.787, 'pos': 0.094, 'compound': -0.0516}",Crying In The Rain,-0.30000000000000004,Everly Brothers,7,6
