lyrics,tags,num_syllables,pos,year,fog_index,flesch_index,num_words,num_lines,sentiment,title,f_k_grade,artist,difficult_words,num_dupes
"If I had a hammer
I'd hammer in the morning
I'd hammer in the evening
All over this land

And I'd hammer out danger
I'd hammer out a warning
I'd hammer out love between my brothers and my sisters
All over this land

If I had a bell
I'd ring it in the morning
I'd ring it in the evening
All over this land

I'd ring out danger
I'd ring out a warning
I'd ring out love between my brothers and my sisters
All over this land, ooh

If I had a song
I'd sing it in the morning
I'd sing it in the evening
All over this land

I'd sing out danger
I'd sing out a warning
I'd sing out love between my brothers and my sisters
All over this land, ooh

Well I got a hammer
And I got a bell
And I got a song to sing
All over this land

It's the hammer of Justice
It's the bell of Freedom
It's the song about Love between my brothers and my sisters
All over this land

It's the hammer of Justice
It's the bell of Freedom
It's the song about Love between my brothers and my sisters
All over this land","['folk', 'johnnie has gone for a solider']",238.5,98,1962,4.0,100.24,204,36,"{'neg': 0.076, 'neu': 0.756, 'pos': 0.167, 'compound': 0.9747}",If I Had A Hammer,0.5,"Peter, Paul and Mary",9,17
"Let's go surfin' now
Everybody's learning how
Come on and safari with me
(Come on and safari with...)

Early in the morning we'll be startin' out
Some honeys will be coming along
We're loading up our Woody
With our boards inside
And headin' out singing our song

Come on (surfin') baby wait and see (surfin' safari)
Yes I'm gonna (surfin') take you surfin' (surfin' safari) with me
Come along (surfin') baby wait and see (surfin' safari)
Yes I'm gonna (surfin') take you surfin' (surfin' safari) with me

Let's go surfin' now
Everybody's learning how
Come on and safari with me
(Come on and safari with...)

At Huntington and Malibu
They're shooting the pier
At Rincon they're walking the nose
We're going on safari to the islands this year
So if you're coming get ready to go

Come on (surfin') baby wait and see (surfin' safari)
Yes I'm gonna (surfin') take you surfin' (surfin' safari) with me
Come along (surfin') baby wait and see (surfin' safari)
Yes I'm gonna (surfin') take you surfin' (surfin' safari) with me

Let's go surfin' now
Everybody's learning how
Come on and safari with me
(Come on and safari with...)

They're anglin' in Laguna in Cerro Azul
They're kicking out in Dohini too
I tell you surfing's mighty wild
It's getting bigger every day
From Hawaii to the shores of Peru

Come on (surfin') baby wait and see (surfin' safari)
Yes I'm gonna (surfin') take you surfin' (surfin' safari) with me
Come along (surfin') baby wait and see (surfin' safari)
Yes I'm gonna (surfin') take you surfin' (surfin' safari) with me

Let's go surfin' now
Everybody's learning how
Come on and safari with me
(Come on and safari with...)

With me
Surfin' Safari
With me
Surfin' Safari
With me
Surfin' Safari
With me
Surfin' Safari
With me
Surfin' Safari
With me
Surfin' Safari
With me
Surfin' Safari","['american', 'américain', 'b7005bb9-fcd9-4d06-8c39-c5ef11275ef1', 'baroque pop', 'classic pop and rock', 'pop', 'pop rock', 'pop/rock', 'psychedelic pop', 'psychedelic rock', 'rock', 'rock and roll', 'sunshine pop', 'surf', 'surf rock', 'today', 'usa']",459.9,100,1962,4.800000000000001,72.83,311,43,"{'neg': 0.0, 'neu': 0.9420000000000001, 'pos': 0.058, 'compound': 0.9493}",Surfin' Safari,4.8,Beach Boys,38,42
